id,title,abstract,is_generated
37,Fizikāli – ķīmiskās pirmapstrādes un enzimātiskās hidrolīzes efektivitātes paaugstināšana bioetanola ražošanai no lignocelulozes substrāta,"The first two steps – pretreatment and hydrolysis - in producing bioethanol from lignocellulosic biomass are essential, as they ground  the outcome for next ones – fermentation and distillation. Therefore these steps are intensively studied and many physical, chemical and biological routes developed. Yet there is a need to adjust the optimal treatment for each type of biomass. In this work I evaluate the effect of explosive decompression pretreatment applied on barley straw and hay, as well as optimal hydrolysis temperature evaluation is presented. The key findings are consistent with literature that the optimal pretreatment temperature is 150º C. Meanwhile, it is doubtful that the energy required for this kind of pretreatment is justifiable, based on ethanol yield increase after fermentation. Moreover, in case with enzyme from Trichoderma reesei it is shown that glucose yield increase after hydrolysis is easy achievable with increase of hydrolysis temperature for 10 - 20º C. These findings confirm that for each type of biomass there is a need for optimal pretreatment method and hydrolysis conditions.",0
38,Personalizēta krūts vēža molekulārā diagnostikas testa izstrāde individuāli pielāgotai ārstniecības izvēlei un slimības gaitas novērošanai,"The aim of this study was to develop a precision medicine test, which is based on the detection of somatic mutations in breast cancer patient tissues and monitoring them in the circulation during the progression of the disease. Targeted sequencing was used on 121 genes in tumor tissue and blood cell genomic DNA to determine somatic mutations. Biological significance of these mutations were evaluated. Cell-free DNA (cfDNA) and extracellular vesicles (EVs) were isolated from patient blood samples and specific mutations were planned to be tested in these samples. It was planned to compare two liquid biopsy approaches – quantification of mutations in cfDNA samples using digital droplet PCR (ddPCR) and sequencing of EV-enclosed RNA.",0
39,Proteīndisulfīdizomerāzes A17 izoformas strukturālie un funkcionālie pētījumi,"The aim of bachelor’s theses is to study the structural and functional properties of PDI A17 (AGR2) isoform within the framework of a project of searching the selective inhibitors of pro-oncogenic protein disulfide isomerases (PDI). To fulfil the project, develop a protocol to obtain PDI A17 in its active form and adjust protein for studies by means of nuclear magnetic resonance (NMR) spectroscopy. Investigate the bind between non-activated and activated azidine- 2-carboxylic acid derivatives and PDI A17 isoform.  This thesis describes the optimization of production of PDI A17 isoform, explains the choice of conditions and methods for protein-ligand binding studies by 2D 1H-15N-HSQC experiments. This work also illustrates the first results of binding of azidine-2-carboxylic acid  N-sulfonyl derivatives to PDI A17 active site. The research was carried out in Latvian Institute of Organic Synthesis in the period from November 2018 to May 2020.",0
40,Intervālās badošānās efekti uz ķermeņa audu kompozīciju un asins plazmas bioķīmiskiem parametriem,"Intermittent fasting diet is a relatively new approach for weight loss, improvement of body tissue composition and health condition overall. The main feature of intermittent fasting diet is the control of calory intake periods, rather than the calory intake.    In this study two intermittent fasting diet models were compared: time restricted and weekly fasting model. We observed an impact of aforementioned models on anthropometric parameters, including body tissue and biochemical composition of blood plasma before and after the diet. For this aim kaliper and ultrasonography methods were used in order to define relative amount of fat and width of various fat layers, accordingly. Also, biochemical blood tests were performed.   The results showed statistically significant difference of weight changes before and after diets, which means that both diet models are similarly effective.",0
41,"Mērenas, nemainīgas slodzes un augstas intensitātes intervālslodzes ietekme uz vielmaiņas rādītājiem pēcslodzes periodā personām ar mazkustīgu dzīvesveidu.","The aim of this study was to develop a high-intensity interval training (HIIT) protocol suitable for sedentary people and to comparatively test its effect on metabolic rate (MR) in the post-exercise period. Two exercise protocols were used: HIIT and moderate, continuous intensity training (MICT). HIIT consisted of twenty 30-second bouts at 85% Pmax interspersed with 60- second active recovery periods with 50% of Pmax. MICT was a single continuous bout at 65% Pmax. MR was determined using indirect calorimetry. HIIT and MICT protocols were tested on two subjects (21 and 20 years). The results show that both tests have a similar effect on MR in the post-exercise period, but the HIIT was more exciting. The developed HIIT protocol is suitable for sedentary persons, but its impact on MR should be further tested by increasing the number of participants.",0
42,Farmaceitisko līdzekļu potenciālā ietekme uz ūdens organismiem,"Environmental pollution with pharmaceuticals has been growing rapidly in recent years. They are potentially bioactive and may have a significant effect on water quality and aquatic organisms, but eco-toxicological information is incomplete or non-existent for many pharmaceuticals. The study was performed to determine the potential effects of widely used and in ecotoxicology little studied pharmaceutical products on aquatic organisms. In the course of the work, the LC50, EC50, LOEC and NOEC values of the products were determined. The results of the experiment showed that for aquatic organisms toxic effects were observed in concentrations ranging from 10 to 100 mg·l-1 in acute tests. In chronic tests, the inhibitory effect was observed at significantly lower concentrations (0.25 - 13 mg·l-1). Pharmaceutical products containing sulpiride (antidepressant), ipidacrine (NS stimulant) and chloropyramine (antiallergic) stand out with the highest toxicity. The persistent release of pharmaceuticals into water bodies can reduce the reproductive capacity or viability of crustaceans and inhibit algal growth, especially at the outlets of pharmaceutical plants.",0
43,"Smēķēšanas un kustību aktivitātes ietekme uz abdominālo taukaudu relatīvo daudzumu un to izvietojumu jauniem, veseliem cilvēkiem","The purpose of this study was to evaluate how smoking and physical activity level affect the relative amount and distribution of adipose tissue, and associated blood biochemical parameters.  The study involved 47 individuals aged 18-35 with different smoking habits. Smoking experience, physical activity level and anthropometric measures were determined using a questionnaire method. Blood biochemical parameters characterizing lifestyle and visceral adiposity were analyzed from the literature data. The results of current study indicate that parameters associated with visceral adiposity in smokers with low smoking history and intensity, but higher everyday physical activity level do not substantially differ from nonsmokers. Thus the disfunction of adipose tissue is rather the result of several factors.  Smoking cessation causes an increased accumulation of visceral adipose tissue, and the effect is mostly observed in the first two years post-quitting.",0
44,DAUDZZIEDU AIRENES RAIBUMA VĪRUSA SERĪNA PROTEĀZES STRUKTURĀLIE PĒTĪJUM,"This Bachelor’s thesis was developed from September 2019 until May 2020 in Latvian Biomedicine research and study centre, in plant virology laboratory in the guidance of Dr. Biol Andris Zeltiņš and Dr. Biol Ina Baļķe. The object of this thesis is ryegrass mottle virus serine protease.  Sobemoviral serine proteases cleave polyproteins 2a and 2ab on specific sites in their functional domains. Protease catalytic centre triad amino acids are D-H-S, the substitution of whom stops polyprotein cleaving. At this moment only Sesbania mosaic virus’s 3D structure has been established. It is made of two β barrels that are connected with a long interdomain loop. These proteases are glutamyl peptidases, which are serine proteases that cleave the peptide site after glutamic acid. The amino acids that make up the glutamic acid binding site (S1-binding cleft) for SeMV are H298, T279 and N308. Previously, two expression vectors were made - pET-Δ117Procm-N6H and pET-Δ50Procm-N6H. For both, the catalytic centre’s amino acid S159 was substituted by A. Both constructs were expressed in E. coli strain C2566 and purified. Δ117Procm was crystallized with and without syntethic peptide and 3D structure was established for Δ117Procm with syntetic peptide by X-ray difraction methode, however Δ50Procm aggregated during the purification process.",0
45,Hipoksiskā ventilatorā reakcija pieaugošas intensitātes fiziskas slodzes laikā normobāriskas hipoksijas apstākļos,"The aim of this study was to examine how acute exercise under hypoxic conditions affects pulmonary ventilation and its characteristic values - respiratory rate and tidal volume and gas exchange efficiency. In this study we included results of 10 male volunteer exercise tests. Each participant performed submaximal incremental cycle ergometer exercise test twice- one under normoxic (21% FiO2) and the other under hypoxic (15% FiO2) conditions. It was concluded that acute hypoxia leads to arterial hypoxemia, which deepens in proportion to the intensity of exercise. During exercise in hypoxia, increased pulmonary ventilation was achieved by an increase in tidal volume but not respiratory rate. Significantly higher respiratory efficiency was observed under hypoxic conditions in combination with submaximal intensity exercise.",0
46,Polikaprolaktona potenciālais pielietojums trīsdimensionālajā biodrukāšanā un biomedicīnā,"The aim of the work was to make different polycaprolactone (PCL) scaffold architectures with different bioinks and to assess biocompatibility for initial research with chondrocyte and osteosarcoma cell lines for cartilage tissue engineering research. Evaluating feasibility study results, it was found that 3D printed scaffold architecture and PCL material is usable to archieve further research goals. It was intended to determine biocompatibility for PCL scaffolds with different hydrogels, using cell viability test, inflammatory reaction mediator secretion examination and also extracellular matrix formation, cultivating cells in 3D scaffolds. This part of the work could not be carried out because of the limitation of the PSKUS work due to the Covid-19 pandemic and state emergency situation. The results obtained in the work will be used in the preparation of a new research application. Results were reported in 77 International Scientific Conference on Medicine on February 22, 2019 and abstracts were submitted for 78 International Scientific Conference on Medicine, which was planned on March 20, 2020.",0
47,2-feniletanola biosintēze ar raugiem Kluyveromyces spp. divfāzu ekstraktīvā fermentācijā,"The aim of this work was to investigate the possibility of laboratory-scale biotechnological production of 2-phenylethanol (2-PE) with yeast Kluyveromyces spp. in two-phase extractive fermentation, using a lactose containing mediums, including food industry waste products.  Among three Kluyveromyces spp. yeasts the highest 2-PE concentration was obtained in fermentation with K. marxianus DSM 5422. The amount of 2-PE obtained in the two-phase fermentation increased threefold, compared to the single-phase fermentation. The maximum concentration of 3,35 g/L 2-PE was obtained by adding 1/7 of total fermentation volume of oil. We concluded that whey permeate is a suitable substrate for 2-PE biosynthesis. The main methods used in the work: fermentation on lactose containing mediums, two-phase extractive fermentation, enzymatic determination of L-phenylalanine, determination of 2-PE, lactose and ethanol with HPLC chromatograph.",0
49,Bakteriofāga izcelsmes dsRNS (Larifan) ietekme uz melanomas augšanu peļu audzēju modeļos,"Melanoma is a type of skin cancer that begins in melanocytes – melanin producing cells. Melanoma is characterized by rapid development of the disease and early metastasis. It is resistant to standard therapeutic methods. Recent progress in the treatment of melanoma has not brought the expected results, so new treatments are still required. Larifan is a heterogeneous population of dsRNA molecules, which has been isolated from E.coli cells infected with RNA bacteriophage f2 mutant. It is mostly known for its ability to induce type (I) interferons (IFNs) and it is used as antiviral agent with rare side effects. Nonetheless, it has also been shown to exhibit an anti-tumoral effect in some tumour models. The aim of the master’s thesis was to elucidate the effect of Larifan on primary tumors and melanoma metastasis in a mouse model of B16 mouse melanoma. The results showed that Larifan inhibits the development of lung metastases in the B16 mouse melanoma that is likely mediated by the IFN system. Intraperitoneal administration of Larifan gave the best results in the primary melanoma model. We have observed a connective tissue capsule formed around the primary tumors, the presence of which could affect the outcome of the treatment. The research for the master’s thesis was carried out at the Latvian Biomedical Research and Study Centre from September 2018 till May 2020. Key words: melanoma Larifan, dsRNA, tumor, metastasis, B16 cells.",0
50,GRM2 tipa bakteriālo mikrokompartmentu daļiņu raksturojums,"Bacterial microcompartments (BMCs) are bacterial organelles able to encapsulate enzymes into protein shell. The goal of this study was to analyse the properties of recombinant BMC shells and explore encapsulation mechanisms of heterologous cargo in GRM2 BMCs. As a result, three ethanologenesis enzymes from Zymomonas mobilis were encapsulated in Klebsiella pneumoniae GRM2 BMC shells using SpyTag/SpyCatcher adhesin system. Also, BMCs were analyzed with cryo-EM. The study involved design of constructs, expression and purification of proteins and BMC analysis in TEM and cryo-EM. Results suggest low encapsulation rate when  using signature enzyme CutC. Significantly higher encapsulation rate is observed when permutated shell protein is used. From cryo-EM analysis six shell structures were solved with 6.6-22.2 Å resultion, representing the shape diversity of BMCs. Study was performed in Latvian Biomedical Research and Study Centre under supervision of  Dr.biol. Gints Kalniņš.",0
51,Latvijas teritorijā sastopamās Q-drudža ierosinātājas baktērijas Coxiella burnetii genotipu noteikšana slaucamo govju saimniecībās,"Coxiella burnetii is causative agent of Q fever, obligate intracellular pathogen from Coxiellaceae family. Widespread worldwide, mandatory notifiable disease in 25 European Union countries.  The aim of the scientific work is to determinate genotypes and distribution in dairy cow farms of Q fever causative bacterium Coxiella burnetii circulating in territory of Latvia. The master's thesis was developed within the framework of the project “Effect of Zoonotic Q-fever on the reproduction of dairy cows and solutions for reducing the incidence of the disease and sustainable use of animals” at the Scientific Institute of Food Safety, Animal Health and Environment, “BIOR”. Within the framework of the work, a comprehensive summary of the information obtained in the project on the prevalence of Q-fever in dairy herds in Latvia has been made. The prevalence of Coxiella burnetii DNA was found to be 18,32% in the samples of bulk tank milk and pooled milk samples, analyzed 9,09 % farms. Antibodies to the Q-fever agent were detected in 21,04% of dairy cows examined for the cause of abortion, out of 14,81% of farms. The presence of C. burnetii DNA in pathological samples from aborted calves was detected in only two farms. The Coxiella burnetii genotype – MST61, circulating in the territory of Latvia was determined by the MLST genotyping method.",0
53,Upes nēģa Lampetra fluviatilis populāciju ģenētiskās daudzveidības izpēte ar mikrosatelītiem,"This bachelor’s thesis is a continuation of the course work – “Microsatellite fenotyping  of Lametra fluviatilis found in Kurzeme rivers”. This work is the first study of genetic diversity  and population genetic structure of river lamprey in Latvian rivers, based on microsatellite DNA  variations. The aim of this research was to assess and evalute genetic diversity of the lamprey  population in the Latvian rivers. The results of this study contribute significantly to the general  knowledge of the river lamprey genetic structure and will be useful to make recommendations  for sustainable management of genetic resources.  From five different rivers (Saka, Venta, Daugava, Salaca, Gauja) together was collected  210 lamprey tissue samples from second dorsal fin for DNA extraction. Genotyping of  microsatellite markers was performed. It was concluded that there is no genetic differentiation  between the populations. Thus, Latvian lamprey population can be managed as a single  population.  Study has 7 chapters with subdivisions. The totals amount of 40 references, 4 figures and 12 tables were used in this study. This work was done in Institude of food safety, animal health and environment ''BIOR''. The Latvian lamprey population can be managed as a single population",0
54,Purīna patēriņš maizes rauga Saccharomyces cerevisiae purīna sintēzes mutantos,"Baker’s yeast is a great tool for studies of eukaryotic metabolism and can greatly improve understanding of purine metabolism and its possible practical applications. In this work mutants of the purine biosynthesis de novo pathway were grown in purine limiting conditions in a 96-well plate. The obtained growth curves were analysed to obtain information about batch culture kinetic parameters, substrate affinity and purine intracellular reserves. It was found that adenine auxotrophs have a higher affinity for extracellular adenine, compared to hypoxanthine. Extracellular hypoxanthine is mainly used for creation of purine reserves, which are also higher in CEN.PK strain. Mutants of the first steps of the purine biosynthesis pathway were found to have a more effective purine consumption that could indicate their role in pathway regulation.",0
55,Patogēnas mtDNS mutācijas saturošu citoplazmatisko hibrīdu šūnu modeļu izveide un raksturošana,"The genetic material of eukaryotic cells consists in both forms - the nuclear DNA and the mitochondrial DNA. Pathogenic mutations in mitochondrial DNA (mtDNA) can result in a variety of heterogeneous diseases. Cytoplasmic hybrid or cybrid cell models can be used to study the effects of pathogenic mtDNA mutations on mitochondrial function. The aim of this bachelor's thesis is to develop and characterize cytoplasmic hybrid cell models containing pathogenic mtDNA mutations. Full-length mtDNA sequencing, the creation of cybrid cell models with subsequent cell viability test and OXPHOS enzyme activity measurement were performed. Full-length mtDNA sequencing was performed in 20 patients with suspected mitochondrial disease. Pathogenic mutations were detected in three patients, and in two cases the mutation was in a heteroplasmic state. Three different types of cybrid cell models were developed, but only one line harboring pathogenic patient mutation was obtained at the end of experiments. Several clones from this cybrid cell  model were selected and further evaluated for cell viability and OXPHOS enzyme activity.",0
56,Trīs no antarktiskās ledus-brīvas augsnes jaunizdalīto Caudovirales kārtas bakteriofāgu raksturošana,"Three from Antarctic ice-free soils isolated bacteriophages from order Caudovirales were described in this study with high emphasis on in silico analyses in addition to traditional micro- and molecular biology techniques. Antarctic bacterial strains were retrieved from the Antarctic soil samples collected during the First Latvian Antarctic Expedition. Bacterial strains were identified using 16s rRNA gene sequencing results and strains without any known associated bacteriophages were selected for phage isolation. First known Sporosarcina and Psychrobacillus genera infecting bacteriophages were isolated during this study. Isolated bacteriophages were subject to morphological characterization, whole genome sequencing with further annotation using comparative genomics approaches. Functions for many of the studied phage gene products could not be reliably inferred. Phage sequence uniqueness has proven itself a hurdle for reliable inference of their evolutionary origins. Annotated bacteriophage complete genome sequences were deposited to GenBank open-access biological sequence database with the following titles “Sporosarcina phage Lietuvens”, “Psychrobacillus phage Spoks” and “Psychrobacillus phage Perkons”, under corresponding accession numbers MT104122.1, MT410774.1 un MT325768.1.",0
57,Visa genoma asociācijas pētījumā identificēti četri riska polimorfismi un izveidots poligēnā riska modelis 2. tipa diabēta pacientiem Latvijas populācijā,"Whole genome association study of type 2 diabetes mellitus identifies four risk polymorphisms and develops polygenic risk model in Latvian population  Masters thesis was devoted to investigation of genetic causes of type 2 diabetes mellitus in population of Latvia, as well as creation of automatic pipeline software for whole genome association studies. In this work we discover four genome wide significant associations with type 2 diabetes risk. These variants function in relation to pancreatic beta cells. Incorporating 41 independed loci variants, we propose a poligenic risk score. It explains 11% of disease variation in Latvian population and shows factor of 2.8 increase in risk for highest quartile, compared to average. Employing UMAP PCA transformation method, we discover significant population stratification  between different ethnic and regional groups. Future genome wide studies will have to take this effect into account. In order to automate above tasks for future research, full analysis software was published in GitHub repository.  Study was conducted in Human genetics and disease pathogenesis resaerch group in Latvian Biomedical Research and Study Centre.  Key words  Type 2 diabetes, SNP, GWAS, PRS, population stratification, GWAS analysis software",0
58,Klimatisko faktoru ietekme uz pundurbērza Betula nana augšanu Teiču purvā un purvainajā mežā,"In order to predict the impact of future climate change on plant growth, it is necessary to find out how they have responded to the most important climate factors in the past. One of the most frequently used methods of obtaining information on the impact of climatic factors on the species is through the variability of tree ring widths and differences in the anatomical structure of the tree rings. Recently, such dendrecological studies use dwarf shrub species, as they also grow in areas where trees are not. In researches also dwarf birch is often  used, which is a rare and protected species in Latvia. The aim of the study was to determine the climatic factors connection with extreme or pointer years of dwarf birch growing in the raised bog and the bog woodland in Teiču nature reserve. Dwarf birch individuals were collected in the raised swamp and the bog woodland of the territory of the Teiču nature reserve. Five individuals were collected in each area, from which thin cross-sections were subsequently obtained. From the cuts tree rings were measured, after graphically crossdated. Pointer years were calculated using a modified method of relative growth change. The relationship between the significant years and the climatic factors was clarified by correlation analyses. The climatic which used in the research was average, minimum, maximum air temperature, average precipitation and  snow cover, over different periods of time. The work results show that the most significant correlations are with air temperature. The amount of precipitation has mostly negative effect on the radial growth of the dwarf birch. The study found that there was no significant difference between the tree rings variation and the pointer years variation between the two habitats, but the climatic factors affecting the growth of the dwarf birch in the different habitats generally differed.",0
