id,title,abstract,is_generated
152,Pirmsslodzes ogļhidrātu uzņemšanas ietekme uz glikozes līmeni asinīs submaksimālas slodzes laikā,"The aim of the Master's Thesis is to explore the effect of pre-exercise carbohydrates intake on the blood glucose level and their potential impact on work capacity during submaximal exercise.  In the experiment, blood glucose levels were measured in 8 athletes. Glucose measurement was performed in 4 experimental tests - Glucose Tolerance Measurement, Changes in Glucose Levels in Plasma Blood Plasma During Submaximal Load; The effect of pre-loading carbohydrates on blood glucose levels in venous blood when taken 45min before exercise; The effect of pre-loading carbohydrates on blood glucose in the plasma of venous blood at 15 min before physical exercise The glucose measurement was performed with a glucometer, the physical exercise was carried out on a veloergometer. Master thesis consists of introduction, literature review part, research methodology and tools, result review, result analysis, conclusions. The work contains 66 pages, 11 pictures, 5 tables, 3 attachments.",0
154,"Uztura, fiziskās attīstības un asins plazmas bioķīmisko parametru izvērtējums jaunākā skolas vecuma bērniem","Master thesis title: Assessment of dietary habits, physical development and blood plasma biochemical parameters in junior school age children.  Background: Rapid increase of obesity in children and adolescents is alerting health problem. Regular measurements of weight and height, including body mass index (BMI) plotting on growth charts are important tools in monitoring children health and nutritional status. Early detection and treatment is likely to reduce morbidity and mortality from cardiometabolic diseases. The aim of the study is to evaluate dietary habits, physical fitness and blood plasma biochemical parameters in junior school age children according to the parameters characterizing the physical development of children.  Materials and methods. 96 children (age 9-10 years) from 13 schools in Latvia were enrolled in the study.  Anthropometric data and blood pressure were measured with standard procedures. Fitness level was determined by 3-minute step test. In order to find out children nutritional habits food frequency questionnaire was used. Children were divided into two groups: one group with overweight/obesity (N=32) and the second group with normal BMI/ underweight (N=64) based on World Health Organization BMI percentile scale. Nutritional habits and fitness level were compared between both groups. Triglyceride, high density lipoprotein and glucose levels were determined by E. Gulbis clinical laboratory. Estimated parameters using International Diabetes Federation criteria of metabolic syndrome in children were compared in both groups.  Results. There was a significant difference between the normal/underweight and overweight/obesity group in BMI, waist circumference, fitness level, systolic and diastolic blood pressure, glucose and triglyceride concentration. Three participants in overweight/obesity group have two International Diabetes Federation criteria of metabolic syndrome. Only 57.3% of participants eat breakfast every day, 24% eat fruits and 35.4% vegetables every day. In normal/underweight group participants eat more vegetables and drink more sweetened drinks. Conclusions: The primary results of the study provide a comprehensive analysis of children's dietary habits, blood plasma biochemical parameters, fitness level and physical development. The results suggest that children's dietary habits require significant adjustments to produce beneficial effects on children's physical development and regulation of blood plasma lipids and glucose homeostasis. Key words: dietary habits, physical development, blood plasma parameters, junior school age children.",0
155,"Studentu izpratnes, informētības un intereses izvērtējums par pievienotajiem cukuriem","Sugar is a part of our daily diet. People like it, and it is being consumed in many ways – by adding it to tea or coffee, in sugar sweetened beverages, or many other products where it is added during the manufacturing process and it would be hard to imagine about. Sugar overconsumption is a general health problem of the population globally. The basis of concern about overconsumption of added sugars is excessive caloric load without any nutritional value, which leads to positive energy balance in diet. That may lead to progress of health problems like obesity, cardiovascular diseases, type 2.diabetes (WHO, 2015). Young people are the group of population who do not care much about their dietary habits. Consumption of fruit, vegetable and wholegrain is less likely than sweets and sugar sweetened beverages (Vilaro et.al., 2018). Also, the data show that level of knowledge and understanding is weak about healthy diet and place of sugar in it. But – as the knowledge is higher, the level of interest is also growing and the consumption of sugar is lower. The data obtained in our questionnaire show that understanding of added sugars is quite weak. Although, students are interested in their sugar consumption to maintain body weight or by health concerns, in most cases, added sugars are not recognized in the food labels. In about 50% of cases, sugar amount on the paper is not understood in real life. Anyway, students are interested in the topic and the idea of showing added sugars on the food label separately is evaluated positively as well as the use of mass media for educational purposes.",0
156,C reaktīvā proteīna koncentrācijas izmaiņas bērniem ar lieko svaru: saistības ar uzturu un fizisko aktivitāti,"Obesity is common risk factor for cardiovascular, metabolic and oncological diseases. Disease and obesity frequency is increasing, including children. Therefore it is important to find ways to early diagnose potential risks and prevent them. Purpose of the work is to evaluate hs-CRO (found in the blood serum test) connection with participants anthropometric parameters, physical activity and dietary habits. Methods. Participants of the study - 105 children (56.2% girls, 43.8% boys), age 9.5±0.5, average weight 35.1±9.1 kg, height 140.2±6.2 cm, waist circumference 60.7±8.0 cm. Blood serum was evaluated for hs-CRO, anthropometric parameters were measured, questionnaire about physical activity and nutrition habits, and physical activity test was completed. Results. Obesity was found in 30% of all participants. Hs-CRO was importantly higher in group with obesity. Hs-CRO statistically correlated with BMI, waist circumference and fitness level. BMI correlated with waist circumference, in the same time waist circumference increased in overweight children and those with lower physical activity. Relevance between dietary habits was not found. Conclusions. Hs-CRO is usable marker for cardiovascular diseases in children.",0
157,Parvovīrusu genoma secību noteikšana indivīdiem ar encefalopātiju,"In Latvia parvoviruses B19V, HBoV, hPARV4 are not sufficiently studied. There is some research that links encephalopathy and B19V, HBoV, hPARV4, although precise mechanisms of disease etiology are unknown. Parvoviruses are small Parvoviridae family members that have singlestranded DNS that is 5-6 kilobases long. These viruses don’t have an envelope, but only a capsid. The aim of this study was to analyse B19V, HBoV and hPARV4 possible role in pathogenesis of unspecified encephalopathy. Blood and plasma DNA from 28 patients with unspecified encephalopathy were tested for B19V, HBoV and hPARV4 genomic sequences. 6/28 (21,43%) patients were positive for B19V, 5/25 (20%) – for HBoV, none for hPARV4. DNA from blood and plasma samples of 7 patients with post-traumatic encephalopathy (control group) were tested for B19V, HBoV and hPARV4 genomic sequences. 4/7 (57,14%) were positive for HBoV, B19V and hPARV4 was not detected. Blood and brain tissue (also temporal and frontal lobe) DNA from 56 post-mortem individs were tested for B19V, HBoV and hPARV4 genomic sequences. 24/59 (43,86%) patients were positive for B19V, 3/24 (41,67%) – for HBoV, but 3/56 (5,36%) – for hPARV4. DNA from blood and brain tissue of 59 post-mortem individs without encephalopathy (control group) were tested for B19V, HBoV and hPARV4 genomic sequences. 18/59 (30,51%) of patients were positive for B19V, 6/25 (24%) – for HBoV and 2/59 (3,39%) – for hPARV4. To make general conclusion on involment of parvoviruses in the etiology/development of encephalopathy more analyses with increased sample size are needed.",0
158,Hepatīta B serdes antigēna vīrusveidīgajās daļiņās spontāni iepakoto RNS noteikšana un raksturošana dažādu E. coli producentu celmos,"In this paper, HBcAg VLP packed RNA was analysed, depending on HBcAg expression plasmid used and their monomer or dimer form, chosen E. coli strains and cultivation medium. 12 different combinations of these parameters were analysed. Culture growth parameters (culture optical density and their specific HBcAg production) were examined, as well as VLP packed RNA fragment length and composition. For three experiment variants NGS RNA sequencing data analysis was performed. Results show, that all 12 of variants differ in VLP packed RNA quantity and composition, but further research is needed to thoroughly establish packaging differences between experiment variants. Several repetitions of experiment would also be helpful to prove regularity with good statistical significance.",0
159,HHV-6 un CCL5 iekaisuma hemokīnu iesaiste autoimūnā tireoidīta attīstībā,"The aim of this study was to evaluate the potential role of human herpesvirus 6 (HHV-6) and CCL5 involvement in AIT development. This study included 60 AIT patients, 30 autopsied subjects without thyroid pathologies and 30 healthy donors as controls. HHV-6 genome sequence was detected in 59 (98%) AIT patients’ thyroid gland tissue and blood DNA samples and 23 (77%) in control group.  Active infection was detected in 35/59 (59%) AIT patients’ thyroid gland tissue. Higher median viral load was found in patients with active viral infection than in patients with latent infection (median 1206 IQR: 455-2804 active and 544.5 IQR: 155-1589 copies/1x106 cells latent infection). AIT patients’ RANTES level was statistically lower (median 9.267, IQR: 3.489-16.93)  compared to blood donors (median 56.6, IQR: 30.71 - 101.5) AIT patients who were positive for HHV-6 U12 and/or U51 gene expression, showed much lower RANTES level, compared to patients with active viral infection without the expression of U12 and U51 genes. RANTES and HHV-6 (gp116) was visualised in AIT patients’ tissue and blood, as well as control groups blood samples with immunohistochemistry. RANTES and was detected in control groups’ blood donor samples and AIT patient samples. HHV-6 gB (gp116) expression was detected in AIT patients’ PBMC samples, however RANTES expression was relatively low.",0
160,N-galā ieviestas hemaglutinīna iezīmes ietekme uz melanokortīnu receptoru daudzumu šūnas membrānā,"During this study construction of expression plasmids containing sequences of the N-terminal hemaglutinin (HA) tagged melanocortin type 2 (MC2R) and type 4 (MC4R) receptors with fused green fluorescent protein (GFP) in the C-terminus was performed.The functional activity of these receptors was tested in CHO (Chinese Hamster Ovary) cells and confirmed. Goal of this thesis was to use these receptors to measure the effects of the HA tagand the GFP on receptor membrane turnover by carrying out enzyme-linked imunosorbent assay and confocal laser scanning microscopy imaging accordingly. Due to technical complications the effects of GFP was not determined, but observed effect of the HA tag diminishes the possibilty of it. Statistically signigicant effect of HA tag was measured as it increased the MC2R surface expression, while it did not affect membrane turnover of MC4R. The stimulatory effect of the N-terminal HA tag exceeded the one of elevating the membrane turnover of MC2R associated protein (MRAP) in CHO cells. Tagging N-terminus with the HA peptide creates an artifact, because it abnormaly increases the membrane turnover of the MC2R, in this system it can not be used to characterise this parameter as in normal conditions.Methods for measuring membrane turnover using epitope tags should be validated with different techniques.",0
161,"Dendrimēri kā luciferāzi saturošas plazmīdas transfekcijas vektori, in vitro un in vivo pētījumi","Gene therapy is a powerful method for treating various genetic diseases and DNA vaccine development, yet, lack of safe and efficient DNA delivery methods still remains the limiting obstacle to human gene therapy. Various synthetic gene delivery agents that are safer than recombinant viruses have been developed, however, they do not possess the required efficacy. Dendrimers are type of synthetic delivery vehicles that exhibit several advantages over other delivery agents, and these nanoparticles have been investigated over past few years for in vitro and in vivo genetic material delivery. In this study, four different dendrimers – generation four poly(amidoamine) dendrimer PAMAM G4, generation four cationic phosphorous dendrimer CPD G4, generation four cationic phosphorous dendrimer AE2 G4 and generation two cationic carbosilane dendrimer CBD-CS G2, were studied to characterize their ability to interact with plasmid DNA (pDNA) and form dendrimer-pDNA complexes. Furthermore, in vitro transfection efficiency and cytotoxicity experiments were performed. Also, the ability of two dendrimers – CPD G4 and CBD-CS G2 – to introduce DNA in vivo in murine animal model was examined using bioluminescence imaging. The results of the biophysical characterization studies indicate that all four dendrimers efficiently bind pDNA and form stable complexes. Dendrimer CBD-CS G2 was the most efficient for cell transfection, and no significant cytotoxicity was observed. In vivo bioluminescence studies showed that CBD-CS G2 dendrimer is not an efficient genetic material delivery vehicle. In contrast, mice treated with pDNA complexed to increasing concentration of CPD G4 dendrimer, displayed bioluminescence in concentration dependent manner, and the highest photon flux was obtained in mice treated with 50 µg of CPD G4. These results indicate that phosphorous dendrimer CPD G4 is the most suitable one of the four investigated dendrimers for in vivo gene delivery, however, increase of transfection efficacy requires further optimization of DNA-dendrimer formulations.",0
162,2-feniletanola biosintēze ar raugu Kluyveromyces lactis laktozi saturošos substrātos,"The yeasts are capable to synthesize aromatic compounds, therefore fermentation by yeast is an alternative method for the production of natural 2-phenylethanol.  The aim of this work was to investigate the use of yeast Kluyveromyces lactis in the biosynthesis of 2-phenylethanol in lactose containing medium. We determined the most suitable K. lactis strain for 2-phenylethanol biosynthesis, investigated the effect of medium composition on 2-PE production, dinamics of 2-PE synthesis during fermentation, K. lactis DSM 70799 2-phenylethanol tolerance, and two-phase extractive fermentation with rapeseed oil was performed.  In this work three industrially used K. lactis strains were used. From these strains K. lactis DSM 70799 produced the highest 2-phenylethanol concentration. The higher 2-PE concentration was obtained in lactose medium, therefore, as a substrate for the production of 2-phenylethanol, can be used lactose containing cheese whey and milk permeate. Phenylethanol is toxic to yeasts and inhibition of cell growth begins by adding 2,04 g/L of 2-PE. To reduce the toxicity and increase the amount of produced 2-PE, two-phase extractive fermentation with the addition of oil can be performed.  Methods mastered during the research: yeast cultivation methods, two-phase fermentation, biomass determination with spectrophotometer and multimode micro plate reader – incubator, determination of 2-PE with HPLC chromatograph and enzymatic determination of sugars.",0
163,Abdominālo taukaudu relatīvā daudzuma salīdzinošs izvērtējums ar bioimpedances analīzes un antropometriskām metodēm,"One of the cardio-metabolic diseases risk factors is weight, which is connected with high levels of fat mass, especially in abdominal region. Beside the anthropometry methods for cheaper and easier unhealthy metabolic weight diagnosis there is bioelectric impedance analysis methods popular. However, the preciseness of these methods is still debatable. Therefore the task was to evaluate the validity of the abdominal fat tissue bioimpidence analysis method in comparison to anthropometry methods. Total number of participants in research was 78 (48 women; 30 men).           To determine participants parameters for body tissue composition such methods as anthropometry and bioimpidence were used which entail: waist circumference, sagital abdominal diameter, total relative fat mass, abdominal and visceral fat level. In research it was concluded what it is necessary to use as many risk indicators as possible as well as their combinations when evaluating the health risks associated with obesity, as inclusion of one or more indicators in the assessment may lead to a misleading picture of the health risk.",0
164,Lielais laimiņš (Sedum maximum) kā modeļsuga smago metālu ietekmes un uzņemšanas fizioloģijas pētījumos,"In this paper the information on the abilities of plant hyperaccumulation is summarized. The aim was to examine the possibility to use tallest stonecrop in research of heavy metal influence and uptake in controlled conditions and experimentally determine the accumulation of biogenic metals, - copper, zinc, manganese and sodium in plants, which were grown in the presence of different metal concentrations. To check the physiological reaction, chlorophyll content and chlorophyll a fluorescence was measured, in the end metal content in differerent parts of plants was determined. The results showed that the tallest stonecrop is able to effectively accumulate manganese and zinc in shoots, big amount of manganese was accumulated. Copper and sodium were accumulated too, but the plants’ growth and development was inhibited at the higher concentrations of sodium. Chlorophyll content and chlorophyll a fluorescence in leaves also was influenced, but the plants were able to adapt. Tallest stonecrop is the potential candidate in phytoremediation.",0
165,Dažāda garuma bakteriofāga izcelsmes dubultspiralizēto RNS ietekme uz perifēro asiņu mononukleāro šūnu aktivāciju,"Double-stranded RNA (dsRNA) is a structure associated with viral infections and it is involved in the modification of immune response. Larifan is a bacteriophage derived heterogenous dsRNA that is produced in Latvia, however poly(I:C) is a synthetic dsRNA. The aim of the master thesis was to compare the effect of poly(I:C), Larifan and dsRNA of different lenght effect on lymphocyte subpopulations, dendritic cell maturation and the produced cytokines and chemokines. Using flow cytometry, dsRNA effect on lymphocyte subpopulation markers were described and with Luminex xMAP analysis biologically active molecule prodoction were analyzed. An increase of CD38, IFN-γ, CD95 and CD25 marker expression, as well as CD28 marker deficiency, a strong TNF-α, MIP-1α and MIP-1β production and dendritic cell maturation was observed.",0
166,Priežu mežu zemsedzes atjaunošanās pēc kontrolētās dedzināšanas un ugunsgrēkiem Natura 2000 teritorijā “Ādaži”,"Fires are natural boreal forest ecology disturbances that change different forest ecosystem parameters and biological diversity, and in Natura 2000 site “Ādaži” that kind of disturbance is imitated using prescribed burning. In this research groundcover restoration after prescribed burning and fires was studied in dry scots pine forests of Ādaži by establishing plots and assessing species projective covers using Braun-Blanquet method. Species composition changes after prescribed burning and fire are similar, because in both cases after burning number of species increased which is explained by introduction of pioneer species which/whom dispersal mainly was by seeds. Most of species projective covers decreased after fires and that made open substrate and suitable conditions for sun-loving plants. Year after fires ground lichens disappeared and three years after fire they still haven’t regenerated.",0
167,Parastās mellenes Vaccinium myrtillus (L.) rametu vecuma un izmēru struktūras salīdzinājums dažāda vecuma mētrāju audzēs Slīteres nacionālā parka teritorijā un tā apkārtnē,"Bilberry is a dwarf shrub that is one of the most abundant species on ground vegetation in boreal forest ecosystems, however it is not enough valuated. It has a positive impact on species biological diversity and its presence is one of the indicators for enrichment in growing conditions (Bryant 1983). Similar to trees bilberry annual rings provide information about conditions in specific territory, nevertheless about shorter period of time (Schwingruber, Poschold 2005). Slitere national park and its surrounding was chosen as a study area because of the various aged Vacciniosa stands found in this territory. Also because of the forest fire which affected part of its territory. In total 21 plots (10 x 10 m) were made. Six of them were established in Vacciniosa young stands (13 – 21 years old), the rest of them were established in Vacciniosa stands with age ranging from 42 to 257 years. In each of the sampling plots five subplots were made based on specific scheme. In each subplot vegetation cover (%) and specie composition was determined. Diagonally three bilberry ramet samples were collected. Samples were processed in laboratory, measured the diameter, height and determined the age. DCA ordination analysis was used to determine differences in vegetation between sites. Generalized mixed linear model was made, to determine forest age influence on bilberry ramet parameters. This study finds that vegetation between different aged Vacciniosa stands do not differ. Whereas bilberry cover (%) differs and has a positive correlation with the stand age. Likewise forest stand age positively affects bilberry ramet parameters – diameter, height, age. Yet increased forest stand age decrease presence possibility of three to five year old bilberry ramets which have the most intensive formation of new clones. In young stands vegetation groups into two parts, respectively vegetation in burned and unburned stands. Significant differences in bilberry cover between both stand types were not observed. Master's Thesis was established in University of Latvia, Faculty of Biology, at the department of Botany and Ecology and in Latvian State Forest Research Institute “Silava” from May 2016 till May 2018.",0
168,Līderisms putnu daudzsugu grupās un tā noteikšanas metodes,"The aim of the research was testing a novel approach to find leading species in bird social groups – species, whose generated acoustic information (mobbing calls) are actively used by other participants of the group. The acoustic mobbing call recording and playback methods were used. Responses of members of wintering mixed-species bird flocks to the willow tit Poecile montanus and the crested tit Lophophanes cristatus mobbing calls were analyzed and discussed. Willow tits, crested tits, coal tits and nuthatches attended playbacks of mobbing calls. The results of this study show that the majority of the participants attended playbacks by willow tits. This suggests willow tit as the leadering species in the bird mixed-species groups.",0
169,ABC saimes gēnu ekspresija un vēža cilmes šūnu fenotipiskās izpausmes pret doksorubicīnu rezistentā MDA-MB-231 apakšpopulācijā,"Resistance to cytotoxic chemotherapy compounds is a significant problem in cancer treatment resulting in tumor regeneration and relapse. Chemoresistance can be mediated by various cell mechanisms, of which ATP binding casette (ABC) transporter overexpression is the most studied. Resistance often is mediated by selection of chemotherapy resistant subpopulations. Cancer stem cells (CSC) have the ability to avoid chemotherapy effects and to renew tumor cell population. The aim of this study was to determine ABC family gene expression and CSC characteristics in a doxorubicin resistant subpopulation of triple negative breast cancer cell line MDA-MB-231. After pulsed treatment with doxorubicin in MDA-MB-231 cells higher ABC transporter gene transcriptomic expression of most ABC family genes tested both after exposure and the following passage was determined. Overexpression of several CSC marker genes was found, and also other CSC characteristics were identified – ability to renew cell population and higher colony formation ability. The restored population had higher resistance to doxorubicin, compared to control culture.",0
