id,title,abstract,is_generated
94,"Brūklenes Vaccinium vitis-idaea (L.) sastopamības, seguma un vecumstruktūras salīdzinājums dažāda vecuma sila audzēs Ropažu un Upmales līdzenumos","Cowberries are common in the whole of Latvia. Therefore, it is important to study the relation between vegetation, age of the stand and the factors influencing the density with relatively ecologically tolerant cowberry.  In August and September of 2018, 24 stands in eight sites were set up to find out how the occurrence, cover and age of cowberries varies in different aged stands in the plains of Upmale and Ropaži.  The practical part of the study was developed in a forest type such as Cladinoso-callunosa. In order to characterize the occurrence and coverage of cowberries, in forest stands transect was constructed. In it, vegetation characteristics were taken, samples of three lingonberry ramets were collected, canopy pictures were taken. A plot of 510 m2 around the transects was installed to characterize the density of the forest stand. With sledge-type microtome stem and root samples were cut, processed in the laboratory. Annual tree rings were counted. With WinScanopy program canopy images were processed to get a percentage of canopy opening. In order to explain the occurrence of vegetation in different aged stands, DCA analysis was performed, but in order to assess how the age of the stand, stand density and crown opening affect the cowberry and how it changes in stands, analysis was performed in the program R.  The study concluded that the parameters of the cowberry differ significantly between the plains. Among the age groups of the stand, statistically significant difference in cover is only in the Upmales plain. Coverage is significantly related to the age of the stand, the canopy opening and thickness of the stands (old and medium-old stands), and age with the canopy opening and the age of stand. Bachelor's thesis was developed at the Department of Botany and Ecology, University of Latvia, Faculty of Biology. Work was completed from January 2018 to May 2019.",0
95,Saldūdens dūņu mikroorganismu populāciju dinamika jēlglicerīna fermentācijas laikā,"Anaerobic fermentation can be a practical way of utilizing crude glycerol, a byproduct of biodiesel production, by producing value-added products and making biodiesel production more economically viable. This work studied microbial population dynamics of anaerobic crude glycerol fermentation with freshwater sludge used as an inoculum. Fermentation was carried out at 20°C and 37°C for 4 and 8 days. The volume of produced gasses was determined as well as the quantity and content of organic compounds in growth media by evaluating the chemical oxygen demand and performing liquid chromatography. Microbial population dynamics was studied by performing qPCR using taxon specific 16S rDNA primer pairs as well as by determining the amount of cultivable microorganisms and identifying them. After 4 days of fermentation almost full utilization of glycerol in the growth media was determined with production of gasses, organic acids and alcohols. The highest volume of produced gas was found at 37°C. Ethanol yield of 0.23 g/g glycerol was calculated. During fermentation of crude glycerol a huge increase of Firmicutes phylum bacteria was observed with dominance of Clostridia and Bacilli classes.",0
96,Sēņu sugu sastopamība ar akūtās ozolu kalšanas slimību (AOK) inficētā parastā ozola Quercus robur L. koksnē,"New, worrying oak disease – acute oak decline (AOD) was discovered 20 – 30 years ago in UK, and it keeps spreading throughout the Europe. In 2017, it was first discovered at Latvia, and research has been started to look for the solutions to understand its distribution. Is is considered that main cause of disease could be bacteria, but oaks with AOD are affected by set of biotic and abiotic factors One of the potential disease agents could be pathogenic fungi, which can potentially weaken diseased oak. It is important to understand if there is any pathogenic fungal species in diseased trees that could possibly lead to oak decline. Comparison between fungal species occurrence in diseased and heathy oak trees could possibly provide useful information for deeper understanding about this disease.  Research took place in four circular sampling plots at Kurzeme. Wood samples had been taken from diseased oak root collar and wounds and also from healthy tree root collar for comparison. Total of 27 fungal species where isolated from all wood samples.  Significant difference between fungal species occurrence in diseased and healthy oaks was not observed. Pathogenic fungal species were found in two of the healthy oaks, which leads to the consideration that healthy oaks nearby diseased oaks might also be already diseased, but visible AOD symptoms haven’t appeared yet.   33 samples from diseased trees and 32 samples from healthy trees were taken. Total of 9 fungal species where isolated from wood samples which had been taken from wounds of diseased oaks, and only 3 of them turned out to be weak plant pathogens, which could possibly cause faster oak decline.  Bacteria occurrence in oaks are statistically significant (p=0,019), which means, that there is a need for further investigation about bacteria role in AOD.",0
97,Litorāles mikrobiotopu ietekme uz Pierīgas brūnūdens ezeru makrozoobentosa sabiedrībām,"Master's thesis „Influence of littoral microbiotopes on macrozoobenthos communities in brownwater lakes in vicinity of Riga”development and material collection took place (from 17.07.17. To 25.05.18.) in four lakes situated in Garkalne County - Līņezers, Piekūnītis, Maku Lake and Lielais Jūgezers. Analyzing the results, it can be concluded that zoobenthos organisms are associated with microbiotopes with aquatic plants and muddy soil. In other microbiotopes the number of individuals and species of zoobenthos is significantly smaller by confirming the hypothesis. In lakes samples, 14 different macrozoobenthos taxa were detected. The most frequently represented orders are beetles and heteroptera. All investigated lakes belong to the brown water lake type, microbiotopes were different due to plant species composition, substrate and physico-chemical parameters. Keywords: microbiotopes, forest brown water lakes, macrozoobenthos",0
98,Vetīvers Chrysopogon zizaniodes kā modeļsuga ūdenstilpju fitoremediācijas pētījumiem Latvijas apstākļos,"Phytoremediation is an effective technology for environmental treatment of pollution. The aim of this study was to evaluate the possibility of using vetiver Chrysopogon zizanioides for studies in phytoremediation of water bodies in conditions of Latvia by comparing their morphological parameters and accumulated chemical elements in roots and shoots for vetiver grown under outdoor and greenhouse conditions. C. zizanioides showed signs of accumulating several elements (Fe, Mn, Zn, Cu, Pb, Ni and Cr) but no correlation between the concentration of the elements present in the solution and the plant biomass was observed. The pontoon groups showed the lightest root and shoot dry mass, though the accumulated element concentration was higher than that of greenhouse groups in most cases. These findings indicate the impact of different environmental factors on the growth of vetiver which have not yet been studied in the climatic conditions of Latvia.",0
99,Veģetācijas sastāva raksturojums Saklaura purva degumos,"Saklaura Mire has burned twice. Human-caused ignition was fixed in late summer/autumn in 2001 in degraded and drained area near Lake Ramatas Lielezers in northern part of the mire. Another fire was caused by lightning in summer 2018 in active raised bog in south part of the mire. Aim of this study was to compare vegetation composition in Saklaura Mire between both burned sites to analyse different after-burn successions, using natural undamaged area as control. Two transects were established in all three sites. In each transect, three sample plots (size 10 x 10 m) were located with 10 m distance from each other. Five smaller sample plots (1 x 1 m) were established in each large plot to observe species occurrence and percentage cover. In total, 31 species including 14 vascular plant, 14 bryophyte and three lichen species were recorded in all sample plots in Saklaura Mire. Vegetation composition was similar between studied transects, still minor differences were observed in species cover between vegetation layers. In the old burning dominated dwarf shrubs and lichens, while in the recently burned site cover of Sphagnum spp. was much larger. Herbs and bryophytes dominated in the control site.",0
101,Phlebiopsis gigantea ietekme uz Heterobasidion spp. augļķermeņu attīstību skuju koku koksnē,"Heterobasidion spp. is an important pathogen of coniferous forests; it causes a living tree rot and causes economic losses. Decayed tree stumps and CWD (coarse woody debris) play an important role in the development and spread of infection, as they are the substrate for fungi development and spore dispersal. Various preparations and management methods are used to limit distribution of Heterobasidion spp. One of the most effective and environmentally friendly preparations used for treatment of freshly cut conifer stumps in European and Latvian forests contains spores of Phlebiopsis gigantea,. The aim of this work was to evaluate the development of Heterobasidion spp. in large-scale CWD and stumps after treatment with P. gigantea spore suspension. In the work a total of 431 large spruce log fragments and 120 spruce stumps were analyzed and studied. Six years after the experiment, the effect of P. gigantea spore suspension on the development of Heterobasidion spp. fruit bodies was evaluated in decayed and healthy stumps and logs, as well as on logs with and without bark damages. The results showed that treatment with P. gigantea spore suspension was effective for treated non-decayed logs without bark damage and stumps, but did not significantly affect the development of Heterobasidion spp. fruit bodies on decayed logs. Bark damage to logs did not significantly affect the formation of Heterobasidion spp. fruiting bodies, irrespective of their treatment with the P. gigantea spore suspension.",0
103,Latvijas virszemes un notekūdeņos izplatītāko farmaceitiski aktīvo vielu ekotoksikoloģiskā ietekme uz vienšūnas zaļaļģēm Desmodesmus subspicatus,"Pharmaceuticals are chemical compounds that are widely used in human and veterinary medicine. Due to increasing production and use of pharmaceuticals, also increases presence of active pharmaceutical ingredients (APIs) in aquatic ecosystems, creating potential threat to environment. Aim of this study is to detect effect of individual APIs surface water and waste water concentrations on Desmodesmus subspicatus growth inhibition. Wastewater effluent and surface water samples were collected in Lielupe River catchment area and API concentration were detected. After data analysis six APIs with increased concentrations from three therapeutic groups – antibiotics, anti-inflammatory agents and antiepileptics, were selected for individual API effect determination on Desmodesmus subspicatus growth inhibition. Results showed that surface water and wastewater API concentration improved (ketoprofen, levetiracetam, gabapentin) or did not affect (diclofenac, trimethoprim, clarithromycin) growth of  Desmodesmus subspicatus.   Nevertheless, the increasing presence of API in the environment must be taken in consideration and further studies are needed to obtain better understanding and knowledge of environmental impact of APIs.",0
104,Laimas slimības ierosinātāja Borrelia burgdorferi ārējās virsmas proteīna BB0663 iegūšana un struktūras analīze,"The aim of this study was to produce the Lyme disease causative agent’s Borrelia burgdorferi (B. burgdorferi) strain B31 outer surface protein BB0663 and to analyse this structure in order to increase knowledge about Lyme disease. As the result of the study, BB0663 protein was produced in Escherichia coli cells, crystallised and the diffraction data were collected by using X-ray crystallography. The protein’s 3D structure was revealed by using the diffraction data. The structural analysis of this protein showed that B. burgdorferi BB0663 protein is similar to Novosphingobium aromaticivorans (N. aromaticivorans) protein with similar structure but unknown function. The research was carried out at Latvian Biomedical Research and Study Centre under the supervision of Dr. biol. Kalvis Brangulis.",0
105,"Streptococcus Mutans sortāzes A  ekspresija, attīrīšana un raksturošana zāļu vielu skrīningam","It is necessary to combat diseases, caused by pathogens, especially multiresistants like Streptococcus mutans. Determination of enzymatic activity and inhibition of transpeptidase - sortase A - targetprotein reduces patogene potency of  binding – virulence - and therefore also prevents the development of resistance. Streptococcus mutans sortaze A in the bachelor’s work is used as a tool to examine innovative, selected chemical compounds, which have the ability to inhibit sortase A. Main objective was to use drug substance screening method to sort chemicals with sortase A inhibition sortase A inhibitors with inhibitory properties and which could be used to combat multi-resistant gram-positive pathogens. The sortase A protein was expressed with the Streptococcus mutans sortase A 40 N-terminal domain deletion recombinant construct obtaining protein which was purified and whom enzymatic activity was tested. The resulting protein was purified and concentrated. The construct with additional six histidines was used for the screening of drug substances, because of its expressional properties. Two substances of the eventual previously selected in drug substance screening method 14 inhibitors with the best Streptococcus mutans sortase A delta 40 inhibitory properties were selected by detailed testing. These substances are: 4-(dimethylamino)-2-fluoro-N-[4-(pyrrolidin-1-yl)pyrimidin-5-yl]benzamide (C17H20FN5O) [7. substance] and 3-(1,3-dihydro-2-benzofuran-5-yl)-1-(4-hydroxyphenyl)urea (C15H14N2O3) [10. substance]. From the two selected substances the most specific one for the Streptococcus mutans virulence limiting was the number 7. because it has a high inhibition, which practically does not inhibit bacterial growth and is little toxic to eukaryotic cells. Bachelor’s thesis was developed in Latvian Biomedical Research and Study Center, A. Leončika Structural biology research group.",0
106,Apaļā jūrasgrunduļa Neogobius melanostomus populācijas bioloģisko parametru raksturojums Latvijas piekrastē,"The paper analyzed the changes of round goby biological parameters on the coast of Latvia based on the analysis of commercial and industrial fishing data from 2014-2018. Round goby living in the open sea of the Baltic Sea are larger in size than those living in the Gulf of Riga (about 2 cm longer). However, in recent years the average length of individuals in both regions, as well as the weight of the smaller individuals, have decreased. In addition, the analysis of changes in age structure and gender structure in the open part of the Baltic Sea shows an increase in the number of males as well as population aging, reaching the average age of 3.6 years. There were also relatively fluctuating fattening indices showing better condition of individuals in the open part of the Baltic Sea. Such changes in biological parameters indicate a change in the dynamics of the development of round goby living on the coast of Latvia, which has been significantly influenced by the increase in population density.",0
107,Audžu apsaimniekošanas ietekme uz zemsedzi pēc ugunsgrēka Slīteres Nacionālajā parkā,"Annija Kārkliņa (2019): Effect of forest management on understory vegetation in the Slīteres National park after fire. Fires are a boreal and hemiboreal forest natural disturbance agent, which change ecosystem landscape and biological diversity. Intensive forest management has limited fire outbreaks to a minimum, but the fire-affected forest will increase in northern Europe due to global changes. Therefore, it is necessary to understand how management (natural regeneration vs salvage logging with or without planting) affects ecosystems, including understory vegetation diversity. Data were collected in Slīteres National park and in neighbouring managed forest in 2017 and 2018 to determine effect of forest management on understory vegetation. Sample plots (10 large plots each containing 4 small plots) were established within a design including four forest types and three management types. Understory vegetation composition and diversity were described in the sample plots. Ellenberg weighted values and the Shannon-Wiener diversity index were calculated and tree stand canopy openness was estimated.  Results show that management effect has a significant effect on understory vegetation cover, however, Calluna vulgaris was the dominant species in all forest and management types, which affected regeneration in Slīteres National park.",0
108,Prostatas vēža pacientu audzēju un bioloģiskos šķidrumos atrodamo ārpusšūnas vezikulu transkriptomu salīdzinājums,"Extracellular vesicles (EVs) are released by various types of cells and are shown to play a role in prostate cancer (PCa) development by transferring a variety of biological molecules, including RNAs from one cell to another. This work focuses on analyzing the transcriptome of plasma and urinary EVs and matched tumor and normal prostate tissues by using RNA sequencing (RNA-seq) technology. Results showed that in total 1868 protein-coding genes and 1108 long non-coding RNAs (lncRNA) were overexpressed in tumor tissues versus normal tissues. However, only 6% to 31% of overexpressed protein-coding genes and 1% to 5% of overexpressed lncRNAs were present in EVs, suggesting that EV-enclosed RNA content only partially reflects the tumor content. Nevertheless, PCa patient plasma and urinary EVs did contain a fraction of PCa-derived RNAs.",0
109,Baktērijas Borrelia burgdorferi virsmas lipoproteīna BBA03 strukturālie pētījumi,"Lyme disease is the most widespread vector transmitted disease in Northern hemisphere. Despite its prevalence and severe symptoms, its causative agents (Borrelia burgdorferi) immune system evasion strategy is not fully understood as of yet. The aim of master's thesis was to produce B. burgdorferi outer membrane lipoprotein BBA03 and determine its structure using nuclear magnetic resonance. BBA03 consists of a 38 amino acids long N-terminal tether peptide, followed by a seven-helix bundle. A search of structurally similar proteins against the PDB using Dali server revealed that mlp family member BBP28 is the closest structural analogue to BBA03. Despite this, previous studies indicate a different function for both proteins. The study was carried out at Latvian Institute of Organic Synthesis, from June 2017 to May 2019.",0
110,"Stepes strupastu galvas smadzeņu morfometriskā mainība guentheri grupā (Arvicolinae, Sumeriomys apakšģints)","The purpose of this work is to investigate the divergence of the brain by its size and geometric shape of three vole's taxa of ""guentheri"" group with linear and geometric morphometric. The obtained data show that the sex as a factor does not affect the linear parameters and brain's shape of the studied taxa, which indicates a weak effect of the sex on morphological adaptation and variability of the brain structure in the selection process. Significant differences in the absolute and relative mass of the brain (cephalization indeces) are found: the smallest one for M. guentheri is noted, greater for M. hartingi. The indeces of the M. hartingi and M. h. lydius populations are noticeably diverged. The linear measurements of the investigated taxa also differ significantly. The subspecies M. hartingi differ in the brain height as well as M. guentheri and M. hartingi species differs in height, width and length of the brain. The lateral length of the hemisphere in M. h. lydius is longest, followed by M. h. hartingi and in the M. guentheri the length is smallest. The obtained data indicate that the divergence of M. guentheri is deeper (16 parameters), which is obviously related to the older isolation of this species by the mountain range ""Anatolian diagonal"". The isolation of the M. hartingi population occurred later by the Bosporus Strait, so the difference in brain structure is slightly less (11 parameters). Geometric deformities of the brain in all taxa are found. Analysis of canonical variations showed that all three taxa differ significantly, both laterally and dorsally. Comparing the taxa DFA lateral view are found differences in brain form, M. h. harting cerebellum hemisphere and brains hemisphere are expanded from above, while M. h. lydius have a small olfactory bulbs. By dorsal view DFA M. h. harting have a slightly longer olfactory bulbs than M. h. lydius. M. guentheri cerebellum hemisphere and worm are wider than the M. hartingi.",0
111,Sakņu piepes Heterobasidion spp. izplatība parastās egles (Picea abies) audzēs uz bijušajām lauksaimniecības zemēm,"Root rot that is caused by Heterobasidion spp. creates significant damage in coniferous forests while also generating major financial losses in forestry. Root rot mostly infects spruce through tree stumps, left after forest tinning, further spreading through root contacts. As the amount of former agricultural lands being afforested is growing, it is important to determine how Heterobasidion spp. will spread in spruce stands on former agricultural lands which were afforested. During the study 15 spruce stands were surveyed in eight of which Heterobasidion root rot was found. Two of these stands (Tirelu and Zemgales forestry’s) were chosen for more detailed research on spread of butt rot. 297 wood samples were gathered from stands in Tireli 27,6 % of which were infected with Heterobasidion and 184 wood samples were taken in Zemgales forestry, of which infected were 28,6 %. Results show that there is a significant difference between data about root rot’s spread on former agricultural lands reported in literature and data recorded in this study. Study was done in Latvian State Forest Research Institute „Silava”.",0
112,Latgales reģionā cirkulējošo Mycobacterium tuberculosis genotipu raksturojums,"Tuberculosis is a world-wide infectious disease caused by mycobacterias belonging to the M. tuberculosis complex. Work was carried out to identify and describe the circulating genotype of M. tuberculosis in Latgale region. The work is based on using two molecular genotyping techniques: spacer oligonucleotide typing method based on polymerase chain reaction and amplification of the DR region; restrition fragment-length polymorphism method where the M. tuberculosis genotype is determined by differences in the number and placement of the number of copies in IS6110 insertion region of chromosome. The results reflect what lineages and sub-lineages were found in Latgale region, as well as spoligotypes comparison with Latvian and neighbour countries population.",0
113,Rietumu medusbites (Apis mellifera L.) būtiskāko parazītisko mikrosporīdiju (Nosema spp.) un ērču (Varroa destructor) izplatību un sastopamību ietekmējošie faktori Latvijā,"In Europe and worldwide decrease of Honey bees alongside other pollinators are affected by parasitic diseases. The aim of present study was to analyse the occurance of most important Western honey bee (Apis mellifera L.) parasites (Nosema spp., Varroa destructor) and factors associated whit the infection in Latvia. During year 2012-2014 bees samples from 274 apiaries where collected to observe the occurrence of bee parasites in Latvia. Overall, Nosema spp. prevalence was observed 49.5% with mean intensity 8.5x105 spores per bee. While Varroa destructor prevalence was 52.3% and mean intensity was 3.0 mites per 100 bees. The significant factors associated with the parasite`s presence in Latvia was seasonality, accompanying diseases, chemical treatment and biotechnical methods used in apiaries. The presence of mites were also associated by mobility of apiary.",0
