id,title,abstract,is_generated
1,MUSKUĻAUDU OKSIGENĀCIJAS PARAMETRU IZMANTOŠANAS IESPĒJAS ANAEROBĀ SLIEKŠŅA NOTEIKŠANĀ BMX SPORTISTIEM,"BMX (Bicycle Motocross) is a specific type of cycling and became more popular when it was included in the 2008 Olympic Games program. The sport is sprint-type and very explosive and requires versatile training from athletes. The main goal of the study is to evaluate the functional parameters of BMX cyclists' physical performance by comparing the results of muscle oxygenation change in the increasing load test obtained with the Moxy device with the results of the cardiopulmonary exercise test.. A group of BMX athletes was selected to perform the VO2max test with increasing load to failure. The results showed the athletes' heart rate and blood pressure at exercise, as well as the athletes demonstrated their aerobic and anaerobic abilities. Information was collected and BMX sports were characterized and compared with the results of other types of cycling, such as MTB (Mountain Bike) and road cycling athletes. The study highlights the uniqueness of BMX in athletes' physical fitness and competition. The data show high anaerobic performance and good performance after the anaerobic threshold. The study concluded that BMX athletes have good recovery abilities and that they can develop maximum power in a shorter period of time much better than other cycling athletes. Gear transmission is very important for developing and maintaining maximum power. However, due to the specifics of the load in BMX sports, it is difficult to make accurate measurements and adapt the laboratory experiment all close to BMX sports conditions, so finding and using an alternative device in the real environment could give us a much deeper understanding of BMX athlete physiology.",0
2,Dzīvesveida paradumu ietekmes izvērtējums uz kardiometabolo saslimšanu risku pieaugušiem cilvēkiem.,"Cardiometabolic diseases are among most significant causes of mortality in the world, and, since they are largely preventable, widely accessible methods for reducing cardiometabolic risk and identifying the risk factors are needed in order to ensure effective prevention measures. The aim of this bachelor’s thesis was to evaluate the significance of the effect of lifestyle factors on the development of cardiometabolic risk development. This study involved 65 adults within the range of 30 to 54 years old. Anthropometric measurements were acquired via self-reported anthropometry and the evaluation of lifestyle factors was based on a survey, which was sent to every respondent individually, following an invitation to participate in this study. Anthropometric data was used to calculate the values of cardiometabolic risk factors. The statistical analysis of the data consisted of correlation and covariation analysis. The obtained results allow to conclude that lifestyle factors, which show significant adverse effects on the development of cardiometabolic risk in a relatively small study population (n=65), are smoking and consumption of alcohol.",0
4,Pesticīdu izplatība hidroekosistēmās un to potenciālā ietekme uz ūdens organismiem,"Global consumption of  pesticides is very high. Due to their widespread use, pesticides enter the aquatic ecosystems and are common in the environment. Pollution from pesticides attracts the attention of researchers, as these pesticides can have a significant impact on aquatic ecosystems and consequently animal and human health.  The objective of this study is to determine the potential effects of widespread pesticides on aquatic organisms. Using two biotesting methods: the microalgae growth inhibition test and the acute crustacean immobilization test. In addition to biotesting, survey was conducted to interview farmers, to learn their used pesticide use justification and storage. During the experiment, the EC50 – effective medial concentrations and LC50 – sublethal concentrations, LOEC - the lowest exposure concentrations at which inhibition of test organisms was observed and the NOEC - the highest concentrations at which no effects on test organisms were observed were determined during the tests.  Experimental results show that all selected pesticides have high toxicity. Highest toxicity in daphnia tests was shown by the insecticide “Proteus OD”, which unfortunately is widely used in the fight against insects, and in the algae tests the herbicide “Broadway Star” (see conclusions).  Pesticides with several active substances were found to contribute more rapidly to the inhibition of aquatic organisms than pesticides with only one active substance. Tested zooplankton organisms showed greater sensitivity to pesticides than phytoplankton organisms. Pesticides that enter water bodies can cause both microalgae un crustaceans’ demise, especially in waters bodies near agricultural land. Farmers emphasize that the use of pesticides is necessary to increase production efficiency and promote farm development.",0
5,Brūnkakļa Aythya ferina izplatības un skaita izmaiņas Latvijā 1958-2019,"The assessment for the European Red List of Birds 2015, has indicated that in the last 20  years there has been serious reductions in the distribution and abundance of breeding Common  pochard Aythya ferina, resulting in the European population being upgraded from IUCN Least  Concern status to Vulnerable. In this study we created an overview of the pochards distribution  changes in Latvia by using bird atlas data from three time periods: 1980-1984; 2000-2004;  2013-2017. To evaluate changes in abundance we used data from two long term waterbird  studies in Lake Engure (1958-2019) and Lake Kaņieris (2005-2019).  Our atlas analysis indicate that in in the last 33 years species distribution has lessered  signifficantly. Also the breeding population in Lake Engure since the end of nineties has  experienced a dramatic decrease. Reason for it is a mix of factors – loss of breeding habitat,  decrease of black-headed gulls Larus ridibundus colonies, and increase in predator, especially  American mink Mustela vison, numbers. In our opinion, it is valid to asses these limiting factors  to the general breeding pochard population in Latvia. Meanwhile, in the last 14 years breeding  population of pochards in Lake Kaņieris has stayed relatively small, but stable.",0
6,Ekstracelulārās vezikulās ietvertās mikrobiālās RNS atklāšana cilvēku asins un urīna paraugos,"According to numerous studies, extracellular vesicles (EVs) are released by almost all cell types within human body and act as mediators of various biological processes via cell-to-cell communication. Recent studies show that intercellular communication is possible between human microbiota and host cells as well. In this study, we show that EVs isolated from human blood and urine contain RNA fragments derived from various microorganisms. The most commonly represented phyla and superphyla in blood and urine were Proteobacteria, PVC group and Terrabacteria. To determine if the major source of these microbial transcripts is gut microbiome, we developed a method for the isolation of EVs from human stool samples. Next, we plan to perform RNA sequencing (RNA-seq) analysis of EVs isolated from plasma, urine and stool from the same individuals.",0
7,Cilvēka herpesvīrusa-6 U12 un U51 gēnu kodēto proteīnu iespējamā loma autoimunitātes attīstībā,"HHV-6 is an omnipresent pathogen which can establish lifelong persistency in its host and is linked to the development of multiple diseases, among them – autoimmune. Although the link between HHV-6 and autoimmune thyroid disease has been shown, mechanisms elucidating how HHV-6 influences the onset of autoimmunity remain unclear. HHV-6 possesses a number of immunomodulating properties, which are used to manipulate the host immune system for viral evasion and dissemination.  The role of HHV-6 encoded viral chemokine receptors U12 and U51 in the development of autoimmunity was evaluated by using potentially immunogenic synthetic peptides designed from viral amino acid sequences. Peptide immunogenicity and antibody cross reactivity was evaluated using suspension multiplex immunological assay. HHV-6 was detected in all of the patient’s thyroid gland samples (64/64, 100%) and in 37 of them an active HHV-6 infection was found (37/64, 58%). The expression of HHV-6 chemokine receptors U12 and U51 was detected in 23 of the patient’s thyroid gland samples (23/64, 36%). Samples positive for viral chemokine receptors expression had significantly elevated viral loads (p=0,0155). HHV-6 peptide specific IgG and IgM antibodies were found in patient’s samples, with higher signals for IgM antibodies, which is indicative of reactivation and active HHV-6 infection. No cross reactivity between HHV-6 peptide specific antibodies and human recombinant CCR1, 3 and 5 was found. Further research is necessary to determine the immunogenicity of HHV-6 gene U12 and U51 encoded proteins.",0
8,Celmu augstuma ietekmes novērtējums uz sakņu piepes Heterobasidion spp. un lielās pergamentsēnes Phlebiopsis gigantea attīstību maza diametra priežu koksnē,"Heterobasidion annosum (Fr.) Bref s.l. root rot causes serious economical losses in European Union, about 790 million euros per year. To limit the spread of root rot in Latvia coniferous stumps over 10 cm in diameter are being protected from Heterobasidion spp. infection using biological control agent containing P. gigantea spores. Previous studies have shown that natural P. gigantea infection is not sufficient to effectively control Heterobasidion spp. prevalence in pine stumps. To determine Heterobasidion spp. and natural P. gigantea development in small diameter, different height pine stumps, in three plots 300 pine stumps were analysed, half of them 15 cm high and half – 50 cm high. 120 stumps in two sample plots were treated with Heterobasidion spp. spore suspension and 180 stumps were left untreated for natural Heterobasidion spp. and P. gigantea infections. To analyse mycelial growth all stumps were cut into 2 to 4 cm thick discs (down till root collar).  We determined that in this study P.gigantea natural infection was significantly more prevalent than Heterobasidion spp. natural infection – in only 3% of both treated and untreated stumps after 22 month long incubation period viable Heterobasidion spp. mycelium could be found, but P. gigantea had spread trough 39% stumps. Therefore natural P. gigantea is a significant factor to control Heterobasidion spp. infection in small diameter pine stumps.  Stump height did not significantly influence the development of natural P. gigantea in small diameter pine stumps, but the incubation period did. Compared to results obtained after 22 months, after 28 months the average area colonised by P. gigantea was significantly lower. From all stumps infected by P. gigantea (n=115) in 62,5 % of analysed 50 cm high stumps and in 76,0% of 15 cm high stumps mycelium had spread untill the root collar of the stump. In further reasearch stumps containing viable P. gigantea mycelium could be excavated and their root system analysed to determine the importance of natural P. gigantea in limiting Heterobasidion spp. secondary spread.",0
9,Fizioloģijā balstīta metformīna matemātiskā modeļa izveide pelei un cilvēkam,"Physiology-based mathematical modelling of metformin for mice and human. Author Dārta Maija Zaķe, supervisor, the director of University of Latvia Institute of Microbiology and Biotechnology, Dr.sc.ing. Egils Stalidzāns. Master’s thesis, 68 pages, 83 sources of information, 1 annex, 12 figures and 10 tables. Language – Latvian.    The purpose of the thesis was to find out the concentration dynamics in major compartments of metformin action in the human body. To achieve this goal a physiology- based pharmacokinetic model of metformin was developed using experimental data from mice. Using parameter estimation techniques and the mouse model, plasma-tissue partition coefficients (Ktp) of the major compartments of metformin action were established. A physiology based pharmacokinetic model of metformin in humans was developed by using 10 tissue-specific Ktp values concentration dynamics in the major compartments of metformin action were determined.",0
10,HHV-6 INFEKCIJA UN IEKAISUMA CITOKĪNU IESAISTE AUTOIMŪNĀ TIREOIDĪTA ATTĪSTĪBĀ,"The aim of this study was to evaluate the potential role of HHV-6 (human herpesvirus 6), RANTES chemokine and IL-6, INF-γ, TNF-α proinflammatory cytokines involvement in AIT development. This study included 63 AIT patients and 27 blood donors as control. HHV-6 genome sequence was detected in 58 (92%) AIT patients’ thyroid gland tissue, 10 (16%) blood samples and 3 (11%) in control groups’ blood samples. Active infection was detected in 25/58 (43%) AIT patients’ thyroid gland tissue.  Immunfermentative method based on Luminex technology was used for RANTES chemokine and proinflammatory cytokines detection. Cytokines level in AIT patients’ blood samples was higher compared to blood donors. AIT patients’ RANTES level was lower (median 418,2 [IQR 113,1 – 803,1] pg/ml) compared to control group (median 1346 [IQR 645 – 2503] pg/ml).      This study contains 7 chapter with subdivisions. The totals amount of 42 references, 12 figures were used in this thesis which has 47 pages. This work was done in Rigas Stradins University Institute of Microbiology and Virology.",0
11,Tetrazola analīzes izmantošana orhideju un ziemciešu dzimtas augu sēklu dzīvotspējas noteikšanai,"The determination of the viability of seed with non-differentiated embryos (dust seeds) is complicated due to the small size of seeds and the dependency of seed germination on symbiotic microorganisms. The aim of this work was develop optimal viability testing method using tetrazolium chloride for seeds of different species with non-differentiated seed embryos. According to the purpose of the work, the tasks we-re: to determine the viability of the seeds of certain species of the Orchidaceae family and Pyroloideae subfamily  using tetrazolium chloride test, to examine the effect of pre-incubation in sucrose solution on the activation of the metabolism of the seeds pri-or to the tetrazolium test, and to determine the proportion of germinating seeds in in vitro conditions. The tetrazolium chloride seed viability test is based on the colouring of viable seed cells as a result of the activity of dehydrogenase enzyme. Before colou-ring the seeds with tetrazolium chloride, they were disinfected in sodium hypochlorite (NaClO) solution, which is at the same time chemical scarification of the seeds, with or without prior incubation in sucrose solution. In order to check the effects of chemi-cal scarification on the test results, the duration of disinfection was modified. A spe-cialised N1 medium and Murashige & Skoog medium, supplemented with yeast extract, was used to test seed germination in vitro. Scarified seeds were incubated on the nutrient medium in aseptic conditions. The seeds were germinated at +22 °C with or without prior incubation at +5 °C. The seed activity was determined once a week for 16 weeks by counting the protocorms and separately counting protocorms with developed rhizoids. The percentage of viable seeds determined by the tetrazolium test in different scarification treatments was compared with the protocorm count on the medium. The effects of yeast extract concentration on the protocorm development was tested .",0
12,NaCl un smago metālu sāļu ietekme uz piekrastes mitrāja auga krastmalas skābenes Rumex hydrolapathum augšanu un jonu uzkrāšanos,"The aim of the study was to determine tolerance and ion accumulation of Rumex hydrolapathum plants in the presence of NaCl and heavy metal (cadmium, chromium, nickel and lead) salts. The plants were cultivated in an automated greenhouse where they were treated with different concentration of the respective substances, and leaf chlorophyll concentration and chlorophyll a fluorescence was measured. After harvesting ion analysis was performed in dried plant parts. R. hydrolapathum avoided ion accumulation in young leaves in all treatments. However, the maximum ion accumulation occurred in old leaves for Na, Cd and Ni, but for Cr and Pb in roots. From the changes in leaf chlorophyll concentration and chlorophyll a fluorescence the growth of plants could not be predicted. R. hydrolapathum could be potentially used for soil remediation polluted with NaCl, cadmium and lead.",0
13,Miega kvalitatīvo rādītāju novērtējums pēc sirdsdarbības frekvences miegā un kortizola koncentrācijas dinamikas.,"Sleep deficit and disruption can lead to multiple negative outcomes on human health. While self-reported sleep quality assessment is subjective, it can be assessed by sleep stages and hormone concentration changes. Sleep stages have qualities reflected on continuous heart rate measurements. Cortisol is one of the hormones which diurnal cycle is influenced by sleep processes. The aim of this work was to find out heart rate and cortisol dynamics’ connection with sleep quality. The study had 10 voluntary participants within ages 20-23. They filled Pittsburgh Sleep Quality Index and chronotype questionnaires. Each participant measured their heart rate for three nights, with addition of collecting urine samples for determination of cortisol concentration for each night. Results show a connection between high and low heart rate variability interval length ratio and sleep quality, that could be explained by slow wave sleep stage effect on sleep quality. Morning cortisol levels and higher evening cortisol levels tend to be in association with lower sleep quality values.",0
14,Pericentriskā heterohromatīna loma genoma telpiskajā organizācijā un regulācijā krūts vēža diferencēšanās komitācijā,"The aim of the study was to define possible structural and transcription changes of pericentromeric heterochromatin (PHC) at early stage of the differentiation in MCF-7 breast cancer cells activated with heregulin (HRG). In activation model the changes of transcription dynamics of early stress response genes and pericentromeric satelite DNA were determined in MCF-7 cells after HRG treatment by using qPCR. PHC topology and organization were defined with immunofluorescence and confocal microscopy and image analysis methods. It was discovered that PHC clustering is proportional to count of centromeres and their layout is defined by power-law. HRG causes rapid de-clustering of PHC. From collected data a hypothesis was posed that PHH de-clustering in cells committed to differentiation cancels its negative position effect, allowing the whole genome transcription activization.",0
15,"Oksidatīvās fosforilēšanas sistēmas funkcionalitātes novērtēšana, izmantojot citoplazmātisko hibrīdu šūnu modeļus","Five enzyme complexes that are located within the inner membrane of the mitochondria compose oxidative phosphorylation (OXPHOS) system. The OXPHOS system produces up to 90% adenosine triphosphate in cells. OXPHOS system disorders caused by mitochondrial DNA (mtDNA) mutations can lead to severe mitochondrial disorders. There is no single specific method for mitochondrial disease diagnostics. The effects of pathogenic mtDNA mutations can be studied using cytoplasmic hybrid cell models. The aim of this work was to evaluate the functionality of OXPHOS system in the cytoplasmic hybrid cell line control group and in a patient cell line with a possible pathogenic mtDNA mutation. A group of control cell lines was established and the OXPHOS enzyme activities were determined, the protocol of cell viability measurements was optimized and the control group cell viability was determined, a cell line harbouring the m.14894T>C mutation was characterized and analyzed, and the frequency of mutation m.14894T>C in the healthy Latvian population was determined.",0
16,Drosophila melanogaster cerebrālās asimetrijas attīstība un organizācija,"Right-left asymmetry is a common feature of the nervous system in vertebrates and invertebrates. Cerebral lateralisation are essential for animal cognition, its disruption can cause neurological disorders such as speech impairment in humans. Several genetic and environmental factors play an important role to its origin, however, the underlying mechanisms of asymmetrical organisation is unknown. This study shows the developmental and circuit organisation of asymmetrical body (AB) in the nervous system of Drosophila melanogaster. Single cell clones and activity dependent synaptic connections generated in this study demonstrate anatomy of various AB neuronal types and constitutes their precise wiring circuit. During early pupa development occurs break in symmetry and then the AB establishes anatomical asymmetry which persist throughout adulthood.",0
17,Fosilās kladoceras (Cladocera) kā vides izmaiņu indikators Sekšu ezera ekoloģiskās kvalitātes novērtēšanā,"Anthropogenic pollution accelerates eutrophication process and is one of the main reasons for reduced ecological quality. This research was performed in order to evaluate how anthropogenic eutrophication has affected the lake’s cladoceran composition and owerall ecological quality by using subfossil cladocera and data from literature. Results show loss of oligotrophy indicating species, decrease of overall diversity, increase of eutrophication indicationg species during and after the pipe between lake Sekšu and Mazais Baltezers was  operational. However, the situation has improved over the last 10 years and lake Sekšu has a good restoration potential.",0
18,Sterilu jaunu radioaktīvu peptīdu sintēze un to pretvēža aktivitāte in vitro sistēmās,"NET tumors are the most common oncologic disease out of all cancer types. Brest cancer, which is one of NET types, is the most common oncological disease amongst women with hundreds of thousands of new cases every year. Since the end of last century radiopharmaceuticals are used for diagnostic of tumours and their metastases in clinical practise. In the last few years a new approach have arised in ocology – theranostics – diagnostic and therapy with tumor specific peptide that is labelled with radionuclide.  HA-DOTA-TATE (somatostatin analoge) labelled radionuclides opens door for affordable theranostics for patients. But there are lack of studies about how good or bad HA-DOTA-TATE affinty to SSTR is. That is why this study was performed. Using three cancer cell lines (MDA-MB-231, SkBr3 and MCF-7) and dermal fibroblast cell line HDFa as control 68Ga and 177Lu labelled HA-DOTA-TATE affinity was measured in those cell lines. Results show that radiolabelled HA-DOTA-TATE have potential to be used in both therapy and diagnostic of NET tumors.",0
19,Dendroloģisko parametru un mēslojuma ietekme uz veģetāciju kokaugu stādījumā lauksaimniecības zemē un tās sniegtie ekosistēmu pakalpojumi,"Kreslina V. The effect of dendrological parameters and fertilization on vegetation and its provision of ecosystem services in short rotation coppice. The aim of the study was to determine the effects of fertilizer (sewage sludge and wood ash) on birch and grey alder height and diameter, vegetation and ecosystem services in birch and grey alder stand provided by short rotation coppice. The plantation is located in Skrīveri district in “Pardenči”. Trees were planted in 2011. Four blocks were created. Each of them consisted of control plots and plots fertilized with sewage sludge and wood ash. Vegetation was described in plots. Data about plant species found in birch and grey alder stands were summarized for each sampling time. The survey was conducted from the third to seventh year after planting. The height and diameter of trees was measured to estimate the effect of fertilizer type on tree growth. In the fourth year after planting there were no significant difference between the number and cover of herbaceous plant species and the type of fertilizer (analysis of variance p values 0.08 and 0.09). In the seventh year after planting, fertilizer (sewage sludge) influenced birch and grey alder height and diameter. Species diversity in the plantation decreased from the third to the seventh year after planting. Birch stands had higher number of herbaceous plant species.  In both of the studied tree species plots, two natural grassland indicator species were found: Dianthus deltoides L. and Dactylorhiza maculata. (L.) Soó. There were found also two invasive plant species: Lupinus polyphyllus Lindl. and Solidago canadensis L. The highest number and cover of leguminous plant species were found in the birch stand. Using data from literature the amount of sequestered nitrogen from the atmosphere by Trifolium pratense L. was estimated to be 79,968 kg N2/ha in the third to seventh year after planting, respectively. Also, the number of nectar plant species was higher in the birch stand, reaching the highest level in the fourth year after planting (13 species). In the seventh year after planting there were eight nectar plant species.",0
