id,title,abstract,is_generated
78,"Projekts: Uzņēmuma SIA ""Zeltnamiņš"" izveidošana","The idea of the project is to create a limited liability company  „G&K STONE”. The company's core business will be to offer granite and quartz stone processing and assembling up to a fully finished product as per customer's wishes. The company's core business will be  twinkled directly to stone surfaces for kitchens, bathrooms, bars and table tops, windowsills, etc. The future plans of the newly created company are to gain a stable market place in the Latvian market, and then start offering their products for export outside Latvia, in neighbouring countries. For a successful, earning and innovative company, the most important is a business idea capable of bringing development opportunities in the future. The product that the company intends to offer is a very high-end quality from granite or quartz material, that gives a new and fresh view to housing. The high quality of the product is provided by the material itself as a raw material from which work and decorative surfaces will be constructed, as well as by manufacturers' professional handiwork during the material processing phase. The idea of the project is based on the creation of a small workshop with materials, tools and all the necessary conditions for quality work and material processing. In recent years, demand for production offered by G & K STONE has increased, which could be explained by increased welfare levels as quality of life indicators improve. This is: the average income of the population increases, material deprivation decreases, the working conditions of Latvian residents and housing conditions improve. Statistics show that the average income of the population is gradually increasing over the last few years, so that the purchase of such high-quality and high-quality products is becoming real for a larger number of consumers. It should also be mentioned that this business idea is largely related to the real estate development sector. Mostly, consumers are eager to install new work surfaces of a kitchen installation in their new housing. In the light of all the above information, the author of this business idea seems realistic, possibly with a potential view in the future. In author's opinion, this is a modern product with high growth opportunities. Demand for this type of product will only become more popular and more in demand over the years. As well as over time, the company's development will make it possible to offer a lot of different products from this material. The production site of the G & K STONE product will be in Gulbene, Lika Street 16. This will also be the company's legal address, at this location will be managed company's core business, the production process, and all production resources. Finished products will be stored for the customer until the product is installed at the customer's facility. The company's registered office will be set up at this location because it is located at the company owner's private property.",0
79,"Projekts: SIA ""G&K STONE"" dibināšana","The dissertation “Project: Establishment of the company “RN Meistars” Ltd.” describes a plan how to create a company that will deal with small repairs and household problems.The company's activities are attributed to the construction industry - completion of construction works and other specialized construction works. The company ""RN Meistars"" Ltd. will provide its customers with minor repair services, more commonly known as ""handyman"" services. The company will offer its customers such services as: plumbing works, electrical works, repair cosmetic works, carpentry repair works, furniture assembly and installation, etc.",0
80,"Projekts: Uzņēmuma ""VICIZOO""dibināšana","The aim of the master's thesis is to establish the project ""ViciZoo pet store in Olaine"". The author has chosen this project theme because there is a lack of pet stores in Olaine, but the number of pets in Latvia is increasing and there is a demand for pet store goods. A large part of the Latvian population has at least one cat or dog. These statistics do not include other domestic animals such as rodents, fish or birds, nor do they include the actual number of domestic animals, as one household listed in the above statistics could have a cat and a dog together or more than one cat and more than one Dog. The above statistics also only apply to registered pets, but many households do not register their pets. The statistics also do not include animals that live on the street and are often cared for by people buying them cat and dog food. It can therefore be concluded that the actual proportion of households and people caring for animals is much higher than in official statistics. This indicates a high demand for pet and zoo goods in Latvia. This business is attractive for the following reasons. People love animals very much, and now in Latvia the majority of the population has a favorite pet, but in addition to home, people also take care of animals at work (for example, guard dogs) and street animals. A pet store is a business that sells several types of goods, and the person who bought the animal in the store immediately becomes a regular customer, because this pet needs food and other accessories. This type of business does not require a large investment to open a store and do business.",0
81,"Projekts: Konditorejas ""Pujenes"" dibināšana","The idea of the project is to establish a cafe – cake shop, which will produce both confectionery products as well as customer service, by offering the municipalities of Kekava a range of quality confectionery products and beverages, as well as a unique design concept, by setting up light and cozy cake shop space, thus stand out from the public catering companies the municipalities of Kekava, which are mainly in the style of fast-food restaurants, canteen type restaurants, as well as pub type restaurants. Within the project, a cake shop „Pujenes” Ltd was established, which plans to carry out its business in the municipality of Kekava, based on the following arguments: •demand for natural and individualised products is increasing on the market for confectionery products; •the municipality of Kekava is a high-income densely populated region; •there is a small and uniform supply of confectionery products in the municipality of Kekava; •there is a small and uniform supply of catering companies in the municipality of Kekava. The share capital of „Pujenes” Ltd amounts to EUR 30000, paid by 2 owners with the same number of shares, as well as the owner's loan in the amount of 10000 EUR for 3 years with an interest rate of 4% per year will be attracted. „Pujenes” Ltd will carry out business in Purva Street 1, Balozos, Kekava, renting premises that have already been adapted for the provision of catering services with a total area of 174 m2 and a rent of EUR 870 per month. During three years „Pujenes” Ltdwill purchase fixed assets for the furnishing of the kitchen and cake shop space to a total value of EUR 29795, as well as perform cosmetic repairs in the value of EUR 5000. „Pujenes” Ltd will be managed by the Board, which will consist of the Chairman of the Board and a member of the Board. 6 employees will be employed in the first two years of operation, but 8 employees starting from the third year of operation. Based on the analysis of past trends trends of the confectionery and flour products industry and experts views on future prospects, the confectionery market is expected to remain stable, with a growing number of companies engaged in commercial activities directly in the sector.  According to financial assumptions, the financial framework for „Pujenes” Ltd was developed for the period from 2021 to 2023. In the first year of business, „Pujenes” Ltd will operate with a loss of EUR 15633, with a profit of EUR 9450 in the second year of operation, and a profit of EUR 20997 in the third year of operation. The first year's negative cash flow of EUR -18096 will be covered by fixed capital and borrowing funds, while cash flows are positive in the second and third years of operation. An assessment of the potential risks of „Pujenes” Ltd identified eleven risks to which cake shop could be exposed.",0
82,Projekts: Skaistumkopšanas kopstrādes uzņēmuma dibināšana,"In the master's thesis “Project: Establishment of a beauty co-processing company” a business plan has been developed for the establishment of a company, the main economic activity of which is the rental of premises for beauty specialists. Nowadays, non-traditional choice of workplace and office plays an increasingly important role. The so-called coworking spaces, which are based not only on shared physical office space between employees of different companies, but also on social interaction - exchange of ideas and knowledge - have gained great popularity. Shared office space also means shared costs, which is a factor that is turning even more interest in coworking space nowadays. At the moment, it can be said that co-working offices are not just a workplace for the self-employed and new IT companies, as most of the public might think so far. It can be a place for anyone who appreciates the benefits of shared space - a workplace that provides shared resources, costs and convenience for one or more companies, which in turn encourages both collaboration and focus on the growth of their company.",0
83,Produktivitātes konverģences tendences Latvijas uzņēmumu līmenī,"The Master's work is devoted to a Latvian firm level productivity convergence in the period from 2010 to 2018. The main source the data is ORBIS database, which on average compiles micro data for around 145 121 companies each year. Within the research firm level productivity defined as gross value-added per employee. By using the cross-sectional and panel data types the existence of productivity absolute beta convergence has been approved among the Latvian firms. The speed of convergence depending on cross-sectional data models has been identified between 2.56% and 2.79% per year, however at the same time the distribution increase among companies' productivity levels was observed, which has been indicating the existence of Sigma divergence. Addition explanatory variables were applied to regression models for unconditional convergence, such as the sector, firm size, region of registration, age and age squared, foreign capital, number of directors and advisors and their gender composition. The unconditional productivity convergence among Latvian firms has been comfirmed as well.",0
84,Klientu attiecību pārvaldības sistēmas implementēšana uzņēmumā,"The theme of the Diploma Paper is Implementation of customer relationship management system in a business. The aim is to define the problem of customer service in a business. Author researches for ways of improving customer experience and quality of customer service. To reach the goal author researches information sources about advantages of customer realtionship management systems over regular client database systems. Comparison analysis is made to determine the most appropriate system for the company. Author takes part in implementing customer relationship management system in a business and documented the progress. The Diploma Paper concludes that customer relationship management is one of the most important systems to optimize process of sales. It is concluded that the implementation process must be carried out in a structured way so that there are no complications and the information systems, business processes and employees of the company are adapted to the implementation of the system.  Diploma Paper consists of 4 chapters, 58 pages, 23 images and 1 table.",0
85,Apvienošanās darījumu ietekmes analīze,"Understanding the impact of merger and acquisition deal on companies’ performance and the market is important for entrepreneurs and competence regulators to make long-term decisions on possible mergers. But the researchers draw opposite conclusions as to whether the mergers promote or hinder development, and there is no consensus in the scientific literature as to whether and what other factors affect the stability of companies during the merger. Therefore,  the thesis aims to examine, using econometric analysis and other methods, whether the effects of mergers on companies exist, whether they are positive or negative. By analysing 24 ordinary least squares linear regression models in two different industries, it is concluded that mergers have an overall positive effect on firms, but it is not statistically significant.",0
86,"Bauskas novada Gailīšu pagasta Norvēģijas valdības divpusēja finanšu instrumenta atbalstītā projekta ""Uzņēmējdarbības aktivitātes veicināšana Zemgales reģiona pierobežas teritorijās"" izvērtējums","The purpose of the this work is to analyze the quantitative results of the project “Promotion of Entrepreneurship in Zemgale Region Border Areas” supported by the Norwegian government bilateral financial instrument on the basis of theoretical and practical materials, compare the analysis results with the project's initial goals, as well as assess future implementation opportunities. The study consists of three parts. Chapter 1 discusses the need for business development, support mechanisms and both Latvian and European Union support for business and a vision for its development. Chapter 2 examines in detail the EEA and bilateral financial instrument of Norwegian government, while the final chapter examines the project “Promotion of Entrepreneurial Activity in the Border Areas of the Zemgale Region”. As a result of the research, the achievement of the project objectives and the project's contribution to the region and local residents were evaluated. The volume of the bachelor's thesis is 73 pages, it includes 15 figures, 3 tables and 2 appendices.",0
87,Mašīnmācīšanās algoritmu izmantošana mājās automatizācijā,"The smart device market is currently growing rapidly and automation systems are needed for the management and control of smart devices. Automation systems collect huge amounts of data from the devices and sensors connected to them. Due to the large amount of data in these systems, machine learning algorithms must be used for data processing. The aim of the work is to examine the market of automation systems, choose one of the offered systems and setup home automation project using it. Then analyze the system data and solve the problems using machine learning algorithms. As a result, smart home system was installed, and three tasks were performed - data analysis, object recognition from the camera, and model creation which links the CO2 level to the window opening state.",0
88,Interneta mārketinga komunikācijas instrumentu izmantošana jaunu un esošo klientu piesaistē un noturēšanā.,"The aim of the master’s thesis is to identify the importance of using Internet marketing communication tools to retain and attract existing and new customers in a telecommunications company and to give proposal on more effective usage of the Internet marketing communication tools based on the theoretical aspects and the data obtained through the study. The first part of the thesis looks at the role of the internet as a marketing communications channel in attracting and retaining new and existing customers. The second part deals with the telecommunications company and the internet marketing communication tools it uses. The third part describes the design of the study and analyses the results of the research. The amount of master’s thesis is 82 pages that include 34 images, 7 tables, one formula and 5 attachments.",0
89,Laika rindu analīzes metodes akciju cenu prognozēšanā,"The purpose of this bachelor thesis is to research possibilities of the applications of time series analysis methods for stock price analysis and forecasting, as well as to evaluate the potential for using different models by forecasting a specific company’s stock prices.  The work provides an overview of times series analysis and forecasting methods and review of common issues in time series forecasting. The methods reviewed, such as ARIMA, ARIMAX, SARIMAX and VAR, where applied in forecasting Volkswagen stock prices exploring the data for a time period from year 2009 to year 2019. In order to take into account market trends, models where adjusted and supplemented with two exogenous variables – company’s Porsche and company’s BMW stock prices for the above-mentioned period. The accuracy of the forecasts was assessed by calculating the mean average percentage error.  Results show that none of the reviewed models was able to show forecasting precision of less than 6.5% in absolute value without additional improvements. Forecast with the lowest mean absolute percentage error was produced by the model SARIMAX. It was concluded that none of the models considered was good enough to achieve an effective forecast of the future value of the selected stocks.  This could mean, that it is necessary to supplement time series models with parameters representing qualitive information about market changes (e.g. changes in product demand, customers’ purchasing power, general market conditions, as well as operational changes – inovations    new markets, new production facilities, etc.)",0
90,Ražošanas vadības sistēmas lietojamības un darba efektivitātes uzlabošana,"Nowadays when technologies are a big part of not only our lives, but also of managing a company, the competition in digital market grows. It becomes harder to make a website differ from other ones, but it’s important to keep in mind that more focus should be put on how to improve the sites usability than adding new design element or functionality. Whether the usability is good or bad can be evaluated by different testing methods and some of them are used and described in this work. Also, the guidelines that should be followed when developing a website are described. The author did a research to find out whether changing a systems layout can improve the usability and user experience. For this purpose, a prototype was made, and several testing methods were used.",0
91,Darbinieku motivācijas sistēmas attīstīšana Wellton Hotel & SPA.,"Rihards Pētersons. Bachelor Thesis. Development of employee motivation system at Wellton Hotel & SPA. Riga, University of Latvia, 2020. The Bachelor Thesis is written in Latvian. The volume of the bachelor's thesis is 60 pages (excluding appendices). The work contains 3 appendices on 13 pages. The bachelor's thesis consists of an introduction, a description of the nature of the motivation, a description of the hotel industry and the Mogotel market, a part of the research result, a part of conclusions and proposals and a list of used literature and information sources. It contains 4 tables, 15 pictures, 3 attachments and 23 information sources. The aim of the bachelor's thesis is to study the development of the employee motivation system at the Wellton Riga Hotel & SPA in order to provide motivation methods and prepare recommendations for the improvement of the hotel employee motivation system. The author evaluates the manager's interview with the aim to find out the existing motivation system. The semi-structured interview provided information from the hotel manager on the use of existing motivation systems. In turn, the employee satisfaction with the existing motivation system was determined by the questionnaire method.  At the end of the bachelor's thesis, conclusions were drawn and proposals were developed for the improvement of the employee motivation system in hotel companies. Keywords: hotel, motivation system, employees, manager",0
92,Eiropas Savienības sankciju un Krievijas pretsankciju ietekmes izvērtēšana uz Latvijas ekonomiku,"The topic of the bachelor's thesis and ""Assessment of the Impact of European Union Sanctions and Russian Anti-Sanctions on the Latvian Economy"". The aim of the thesis is to evaluate the EU sanctions’ and the Russian countersanctions’ effect on the economic situation in Latvia in the period from 2014-2018. Theoretical aspects of the sanctions, the procedure of application of the European Union sanctions and its types, the types of Russian countersanctions, as well as the impact of sanctions on the economy are looked at in this bachelor thesis. Based on the findings of the theoretical part, the research part consists of analyzing Latvia's macroeconomic indicators in the period from 2014 to 2018. There are 70 sources used, and this paper contains 14 images and 4 tables. Paper consists of 63 pages.",0
93,Valsts atbalsta sistēmas ietekme uz produktivitāti un konkurētspēju,"Most countries in the world have not made the distinction between productivity and competitiveness sufficiently clear and have not developed strategic plans to promote competitiveness and productivity. The contradiction regarding productivity and competitiveness, not only in the private but also in the public sector, is a lack of understanding and knowledge of the phenomenon that increasing productivity does not always increase competitiveness, and vice versa. The aim of the master's thesis is to study Latvian state support system and the Latvian business environment impact on productivity and competitiveness, and to provide recommendations for their improvement in Latvia. The hypothesis - a state support system designed deliberately and in accordance with the modern economy, which provides a favorable environment for entrepreneurs, is essential for raising the level of productivity and competitiveness in Latvia. Several factors are important for raising the level of productivity in Latvia - reforming the education system, improving the quality of the business environment, improving the availability and quality of labor, promoting higher value-added production, promoting export, ensuring sustainable development, ensuring a stable macroeconomic environment, stable tax policy, etc. Keywords - productivity, competitiveness, innovation, crisis.",0
94,Sabiedrisko attiecību loma tirdzniecības centru integrētajā mārketinga komunikācijā Latvijas tirgū.,"The topic of the master's thesis is ""The role of public relations in integrated marketing communication of shopping centres in the Latvian market"". The aim of this master’s thesis is, basing on theoretical knowledge regarding the specific nature of integrated marketing communications and public relations in shopping centres and building on conclusions from expert interviews and the results of a survey of Latvian shopping centre visitors, to evaluate the role of public relations in integrated marketing communication of shopping centres in the Latvian market, as well as to put forward proposals for improving public relations in shopping centres in Latvia. As a result of the Master’s thesis, it was concluded that public relations play an important role in the integrated marketing communication of shopping centres, since, in the competitive situation in the shopping centre industry in Latvia, effective use of public relations is very important, as it helps to reach a large audience by creating the relevant image of the company by association of credibility and reputation of the shopping centre. The volume of work is 97 pages, including 9 tables, 23 pictures, 4 appendices, 58 references.",0
95,E-demokrātijas loma atvērtas pārvaldības veicināšanā. Baltijas valstu salīdzinošā analīze,"In the 21st century the biggest part of society uses internet every day. The development of information technologies dictates the need to modernize public administration, introduce digital solutions both in public administration and ensurance of democratic processes. Citizens must be able to participate in state organized activities in electronic form. The aim of the Master’s thesis is to study the quality of e-democracy and its role in promoting open governance in the Baltic states, to identify it’s advantages and disadvantages as well as to develop proposals for its development. E-democracy in Master’s thesis is studied using the theory of three-dimensional concept of e-democracy by professor Marianne Kneuer. The concept consts of three dimensions: •free and equal access; •e-participation; •e-government.  The theoretical basis of the work consts of Steven Clift, Marianne Kneuer, Robert Krimmer, Tom Curran, Ravi Singh, Scott Aikens, Stephen Coleman, Jay Blumer and recommendations of the Committee of Ministers.  The Master’s thesis compares the development and results of e-democracy in three Baltic states. The Master’s thesis consists of an introduction, four chapters, conclusions and proposals, a list of references. The first chapter analyzes the commonalities and differences between the definitions of e-democracy. Chapter two to four analyze the dimensions of e-democracy in Baltic states. At the end of the work conclusions and proposals are summarized. The main text of the work is presented on the 81 page. The work includes 11 pictures, 7 tables. Bibliography contains 72 units.",0
