id,title,abstract,is_generated
136,Mārketinga  komunikāciju pilnveidošanas  iespējas uzņēmumā “CityBee”.,"Bachelors thesis ""Marketing communication analysis of the video game ""Black Desert Online"" "". The aim of the thesis is to analyse video game's ""Black Desert Online"" marketing communication based on theoretical knowledge and results of questionnaire and develop propositions to improve this video game's marketing communication in Black Desert Russia segment. The problem of bachelor's thesis is the need to improve marketing communication in the video game ""Black Desert Online"". As a result of the bachelor's thesis, the hypothesis put forward by the author of the thesis was confirmed and the author gave proper propositions to improve marketing communication in Black Desert Russia segment. The scope of the bachelor’s thesis is 85 pages, it contains 12 figures, 5 tables, and 19 attachments. 70 sources were used for the development of the thesis.",0
137,Videospēles “Black Desert Online” mārketinga komunikācijas analīze.,"The topic of the bachelor's thesis is the analysis of marketing communications in the company SIA ""ARKO EL"" The aim of the work is to analyze the marketing activities of SIA “ARKO EL” on the basis of the collected information of the theoretical part, as well as to develop proposals for the improvement of marketing communication of SIA “ARKO EL” based on the performed research. The bachelor's thesis consists of an introduction, five chapters, conclusions and proposals. Tasks are to compile scientific literature on modern marketing communication, analyze marketing communication theories with various literature sources, describe and study the company SIA ""ARKO EL"" as well as study its existing marketing communication application and find the optimal applications of the element with the help of research. To develop and conduct an interview with the manager of SIA “ARKO EL” and to find out the client's opinion about the company's marketing communication. Investigate the potential impact of social media on business development. As well as after all the research to develop conclusions and proposals for the improvement of marketing communication of the company SIA “ARKO EL”. The amount of work is 63 pages.  Keywords: Marketing communication, marketing, company, development, social media, word-of-mouth.",0
138,"Mārketinga komunikācijas analīze uzņēmumā SIA ""ARKO EL"".","The topic of the bachelors degree work theme is ""Analysis of Latvian commercial bank deposits"". This topic is relevant and will always be relevant, because deposits form the capital of banks. Thanks to the deposited funds, the bank can earn by investing it and receiving a profit. This topic shows what the current situation in Latvia is with deposit interest rates, volumes and what are the main groups of depositors. The bachelors degree work analyzes four Latvian commercial banks, AS “Swedbank”, AS “SEB”, AS “Citadele” and AS “Rietumu banka”. The aim of the bachelors degree work is to study and analyze the importance of deposits in the Latvian banking system, deposit market trends and to draw conclusions and make proposals for the improvement of deposits on the results of the analysis. In order to achieve the goal of the bachelors degree work, the theoretical basis of deposits was studied, which gave an idea of the importance of deposits in banking and an understanding of deposits as such. The paper analyzed the total amount of deposits by groups of depositors and interest rates on household and corporate deposits. Changes in the amount of deposits by years from 2015 to 2019 were evaluated. The paper evaluated the types of deposits offered, interest rates and deposit amounts for four Latvian commercial banks, AS “Swedbank”, AS “SEB”, AS “Citadele” and AS “Rietumu banka”.  The bachelors degree work consists of three chapters and eight subsections. The volume of the work is 55 pages. There are 23 figures and 12 tables in the work. Various literature sources have been used in the bachelors degree work, such as Internet resources, books, the Financial and Capital Market website, the website of the Bank of Latvia, the website of the European Central Bank and other resources. The author concludes that: 1. Deposits are a very important and necessary part of bank capital formation, it is the main source of attracted resources. 2. Latvia's total deposit balance has a negative trend and is significantly affected by the outflow of non-residents' money from Latvian commercial banks. 3. At present, banks offer very low interest rates, which discourage depositors from keeping funds in banks. 4. Banks offer a wide range of deposit options, as well as the opportunity to make deposits not only in euros, but also in other currencies.",0
139,Ziedojumi un sponsorēšana kā atbalsts Latvijas sporta organizācijām: attīstības tendences un problēmas.,"Ilze Nordena's Bachelor's thesis topic: Donations and sponsorship as support for Latvian sports organizations: development trends and problems. Today, the role of sport in people's daily lives is growing. As a result, the sports industry and its demand are growing. Active marketing activities are very important in promoting the activities of the sports industry. It is the financial and material assistance of sponsors and donors that allows these organizations to function fully. Therefore, the whole existence of an organization often depends on the activities of sports marketing specialists. It is important to attract not only young athletes and fans, but also sponsors and donors. Aim of the work: To study the development tendencies and problems of donations and sponsorships received by Latvian sports organizations in order to develop recommendations for increasing the number of donations and funds provided by sponsors and preventing related problems in Latvian sports organizations. The bachelor's thesis consists of an introduction, analytical review, practical part, conclusions and proposals. The volume of the bachelor's thesis is 63 pages with 9 pictures, 7 annexes.",0
140,Ar sauszemes transportlīdzekļu izmantošanu saistīto apdrošināšanas veidu analīze Latvijā,"The bachelor thesis purpose is, based on an analysis of Internet resources, analysis of laws and statistical data, to explore the activity of the insurance industry of road vehicle owners. Explore the types of analysis among insurance companies and insurance workers, to explore the types of insurance and the difference between insurance companies. Well as identify the advantages and disadvantages, and make proposals to improve the sector. The first part of the Bachelor examines the types and nature of vehicle insurance, analyses the regulatory base governing compulsory insurance of motor vehicles (OCTA) in Latvia. The second part analyses the performance of the OCTA and land vehicle insurance (KASKO) sectors. The third part of the work compares the comparison between OCTA and KASKO costs in different insurance companies, as well as the problems and possible solutions. Bachelor work capacity is 61 page, what includes 3 chapters with subchapters, as well as from 4 tables, 11 imagines and 1 annex. Key words: OCTA, KASKO, insurance, indemnity, premium.",0
141,"Pircēju rīcību ietekmējošie faktori, izvēloties ēdienu piegādes servisu SIA “Wolt Latvija”.","The purpose of the bachelor's thesis is to explore the factors influencing buyer behavior choosing food delivery service ""Wolt"", to reveal shortcomings and make proposals for their elimination, based on theoretical findings, the results of the survey of city residents and the results of the interview. The bachelor's thesis consists of three parts. In the first part, the author of the bachelor's thesis describes the buyer behavior model, the factors influencing buyer behavior and the customer decision-making process. Overall, it all helps the company to understand buyers, perform effective marketing activities and maximize profits. In the second part, the author of the bachelor's thesis describes the economic activity of the company SIA ""Wolt Latvija"", compares the company with the competitor ""Bolt Food"" and describes the company's buyers. In the third part, the author provides a justification for the methodology of the practical part, conducts a customer survey, describes the results and analyzes them. Third part also contains the interview with the company's marketing manager, the author summarizes the interview answers and analyzes it. The bachelor's thesis consists of 61 pages, 4 tables, 22 pictures and 2 appendices.",0
142,Valsts sociālās apdrošināšanas obligātās iemaksas,"The topic of the bachelor's thesis is State social insurance mandatory contributions. This issue is relevant because this tax affects every person involved in the labor market, and by paying it, a person can receive partial compensation for lost income in cases of social risks. The work consists of three chapters with subsections, the author's conclusions and suggestions. The aim of the work is, based on the available literature, to study the mandatory state social insurance contributions in Latvia, their calculation and application, as well as to provide possible solutions for the improvement of state social insurance mandatory contributions. The study finds that mandatory state social insurance contributions face various problems, including their insufficiency in the state budget to cover social benefits and public distrust of them. The bachelor's thesis is written in Latvian. The thesis consists of 73 pages, 13 tables, 17 pictures and 6 appendices.",0
143,Pirmspensijas un pensijas vecuma darbinieku attīstības iespējas Latvijas Nacionālajā arhīvā,"The master theses theme is „Development opportunities for pre-retirement and retirement employees in the National Archives of Latvia”.  Due to the aging of human resources, the average age of the labor force in European countries is increasing. Employers need to think about how to employ older workers effectively. The National Archives of Latvia is a direct management institution with a large proportion of older employees. The proposals and guidelines developed by the author as a result of the research are also applicable to other public institutions. The study is based on the analysis of statistical data on the aging of human resources in the EU countries, the latest trends in the field of human resource development, management and lifelong learning, as well as the regulatory enactments controlling the field of human resource development. Within the framework of the research, archive employees and experts were interviewed.",0
144,Patērētāju uzvedību ietekmējošie faktori Latvijas digitālā mārketinga vidē,"The topic of bachelor thesis – “Realizations of Marketing MIX elements in the hotel “Port Hotel”. Hotels as tourism service provider are currently facing unprecedented challenges, therefore it is significant to be aware of the company's strengths and weaknesses, in order to increase competitiveness and development, providing the company with a profit. The aim of this paper is to analyze realization of marketing MIX elements in the hotel “Port Hotel” and make suggestions for hotel development options. Within the framework of the paper, the author analyzes theoretical aspects of marketing MIX elements, describes hotel “Port Hotel” and analyzes how marketing MIX elements realizes in it. Within the framework of research author has interviewed the owner of the hotel and made a survey for hotel service consumers. As a result, author makes conclusions and makes suggestions for hotel “Port Hotel” development options. Bachelor thesis consists of 62 pages, it contains 18 pictures, 7 tables, and there is 1 attached annex.",0
145,"Mārketinga mikss elementu realizācija viesnīcā ""Port Hotel"".","The theme of The Bachelor's work of the author of the work is “Development of the company LPP Latvia ltd”. The aim of the work is to find out the company's development opportunities looking at the internal and external environment of the company LPP Latvia ltd, and to develop proposals for the company's development. The Bachelor's work consists of three chapters. The first chapter deals with theoretical aspects of the company's development capabilities, as SWOT analysis, PEST analysis theory. The second chapter deals with the development of the company's clothing retail industry. In the third chapter, the analysis of the economic activity of the company LPP Latvia ltd and the analysis of financial indicators are carried out. Bachelor's work consists of 84 pages containing 26 images, 11 tables and 10 attachments. Key words: external and internal environment, opportunities, threats, competition, financial indicators.",0
146,Uzņēmuma LPP ltd Latvia attīstība.,"The theme of the Bachelor`s thesis is “Management styles and their impact on employee motivation in organization “OC Vision””. In an organization, it is important for each manager to choose the right management style. Choosing the right style facilitates the operation of the organization and allows the manager with his team to achieve results faster and approach goals. The aim of the bachelor's thesis is to study, analyze and compare which management styles are for managers working in the company ""OC Vision"" and how their management style affects employee motivation, develop proposals for the choice of management style in this company so that their employees would be as motivated as possible. The Bachelor’s thesis consists of three chapters. In the first chapter, the author provides an insight into the theory of work on the role of managers in the organization, management styles, and the relationship between manager and employee. In the second chapter, the author provides an insight into work theory on motivation and motivation theories. In the third chapter, the author summarizes the data from the results of the survey. In the end are conclusions and proposals, a list of references and appendix The Bachelor`s thesis consists of 63 pages, 13 photos, 21 tables and 1 appendix.",0
147,"Vadības stili un to ietekme uz darbinieku motivāciju uzņēmumā ""OC Vision"".","Bachelor’s thesis “The impact of the global financial crisis on profitability of the Republic of Latvia banking sector” is designed to analyse the impact of the worst financial stability collapse of this century on the banking sector profitability, changes in the structure of assets and liabilities and the dynamics of the performance. This analysis is important because the financial crisis is nothing new and the banking sector is a major driver of the national economy. The aim of this bachelor’s thesis is, by reference to publicly available sources of information, to carry out an analysis of the overall profitability of the whole banking sector and related indicators from year 2005 to year 2017, in order to be able to draw conclusions at the end of the analysis and to make proposals for a more efficient management of future financial risks. The work consists of three chapters dealing with theoretical aspects of the banking sector, the causes and consequences of the global financial crisis, and a comprehensive analysis of the banking sector, on the dynamics of liabilities and assets, income and losses, trends in profit indicators. Keywords: global financial crisis, banking sector, profitability, share, dynamic",0
148,Globālās finanšu krīzes ietekme uz banku sektora pelnītspēju,"The topic of the bachelor's thesis is ""Opportunities to improve the efficiency of dental institution services"".   The work aims to create a suitable solution to improve the efficiency of the service in private dental practices, to develop a solution that could contribute to a successful start-up.   To achieve the goal, a general theoretic summary of the services of the dental industry, their availability and necessity, was made, as well as an evaluation of the current outpatient medical card system.   The thesis is organized into three chapters. The first chapter analyzes the concept of efficiency and its essence. The second chapter describes the industry and the variety of available services in Latvia, as well as describes the private dental practices under study.  At the end of the chapter, the current system is described - a handwritten outpatient medical card.  In the third chapter, all the data from the interview and the survey were collected and analyzed, and a solution for the electronic implementation of the system was developed.   At the end of the work conclusions and proposals for further development of the electronic system in the dental industry are offered.   The bachelor's thesis consists of 73 pages with 23 images, 4 tables, and 8 appendices. The bibliography contains 37 titles.   Keywords: information, efficiency, dentistry, dental services, patient, outpatient medical card, practice, visit.",0
149,Zobārstniecību izaugsmes iespējas Latvijā.,"In Latvia, according to the latest statistics, 1384 innovative companies were registered in 2016. Innovative companies in the industry create new goods or offer unprecedented services that benefit people.  The bachelor's work consists of 4 departments. The first chapter defines innovative business. The second chapter identifies the factors affecting innovative business. The third chapter summarises the factors contributing to the development of innovative companies. Chapter Four draws up directions that can be developed in Latvia.  Using theoretical materials and studying the current situation, it was concluded that innovative companies are developing and can develop in Latvia in all sectors of the economy.  The amount of bachelor's work is 58 pages, consisting of 9 images, 16 tables and supplement 1.",0
150,"Inovatīvā uzņēmējdarbība, attīstības tendences Latvijā.","The efficient operation of the company is not possible without a stable internal control system that determines the legality and effectiveness of financial and economic activities. The larger the company, the higher the requirements for the control system. The goal of the Bachelor's thesis is to develop recommendations for improving internal control system of the Accenture Latvia branch based on the literature review and analysis of the internal control system. The study analyzed the internal control system of Accenture Latvia branch. The author concludes that the elements of the company's internal control system have inconsistencies. At the end of the work, the author provides recommendations for the elimination and improvement of the internal control system.  Study consists of 78 pages, 14 pictures, 4 tables and 2 annexes.",0
151,Iekšējā kontroles sistēma un tās novērtējums ITuzņēmumā.,"The global consumption and demand of resources is increasing rapidly, resulting in large amounts of waste, which has a significant impact not only on the environment and climate but also on the human population. For these reasons the European Union has developed sustainability targets to be achieved by 2030. The aim of the work is to explore progress of Latvia’s towards these objectives. A part of the research is to determine the municipal waste sorting habits of Latvian residents and the various factors of motivation for citizens to sort in the day-to-day life even more continuously.  As a result it was concluded that citizens in Latvia are willing to sort waste, but the sorting bins are not always available. It shows that Latvia has established an extensive waste sorting infrastructure, but the placement of containers is not considered, because they are not accessible enough.",0
152,Eiropas Savienības izvirzīto ilgtspējas mērķu sasniegšana Latvijas kontekstā.,"In the bachelor's thesis is being studied employee job satisfaction at retail stores in Latvia. Its purpose is to develop a model of job satisfaction of retail store employees, based on a study of theoretical literature sources, analysis of retail trade indicators in Latvia and the results of the questionnaire. In the first part, the author explores theories of job satisfaction, assessment methods and definitions. In the second part is being analyzed trade, retail and shop development of characteristic indicators. The provision of employees in stores is also being studied. In the third part the author compiles the results of the questionnaire, analysis and the development of a recommended model. The work consists of 73 pages, including 11 tables, 38 figures and 7 annexes. Keywords: job satisfaction, employee, retail, shop.",0
153,Darbinieku apmierinātība ar darbu mazumtirdzniecības veikalos Latvijā.,"Bachelor's thesis - Human resource management analysis and its improvement in the children and youth center “Riga Skolenu Pils” The foundation of today's successful company is its employees or in other words the staff. Human resource management occupies a leading position in the company's management system and development. Human resource management ensures the efficiency of the organization and high results. The motivation process and motivation system play an important role in human resource management. This topic has become one of the most typical issues for organizations, because appropriately and properly motivated employees determine the efficiency of the company, readiness for some changes, development perspective, as well as the company's chances of survival. The aim of the bachelor's thesis is to study and analyze the human resource management process and staff motivation, satisfaction with work in the children and youth center ""Riga Skolenu Pils"", as well as to develop proposals for the improvement and development of human resource management. To achieve the goal and implementation of the work, the research of literature and analysis on human resource management (human resource management functions, tasks, motivation theories) were done, furthermore was made a quantitative research on personnel motivation and job satisfaction based on employee surveys, interviews with company administration and personnel representatives. As a result of the research, conclusions and suggestions have appeared, by following to which, the company will have the opportunity to improve and perfect the human resouce management of BJC “Riga Skolenu Pils”, as well as increase the motivation of the personnel.  The bachelor's thesis consists of 76 pages, 3 chapters. The work includes 6 charts, 19 pictures and 9 appendices.",0
154,Personāla vadības analīze un tas pilnveidošana bērnu un jauniešu centrā“Rīgas Skolēnu Pils”.,"The topic of the bachelor's thesis is ""Demand in the market of electric scooters"". The paper examines the factors influencing the current and potential demand for electric scooters, as well as the development trends of the e–scooter market in Latvia and abroad. The results obtained in the work show that the foreign market of electric scooters is saturated and in Latvia it is in the starting position of development. Research shows that it is important for consumers to travel outside the home daily, saving resources and taking care of the quality of the environment. In Latvia, demand is most negatively affected by the price of the product, as well as insufficient information among consumers about the types of electric scooters and the advantages of use. The work includes 76 pages, 14 tables, 17 images and 1 appendices.",0
155,Pieprasījums elektrisko skrejriteņu tirgū.,"The subject of the diploma thesis is “Latvian tax system and it’s influence on attraction of direct foreign investments”. The aim of diploma thesis is to investigate and evaluate the impact of Latvia’s tax policy on inward foreign direct investment. To achieve the diploma thesis aim was performed analysis of tax policy theoretical aspects, foreign direct investment theory, inward foreign direct investment in Latvia by countries and sectors and tax reform impact on the business environment in Latvia and inward foreign direct investment.  The diploma thesis consists of introduction, three chapters, conclusions and proposals. The contents of diploma thesis is laid down on 76 pages. The thesis contains 19 figures and 3 tables. Key words: foreign investment, investment climate, taxes, tax reform.",0
