id,title,abstract,is_generated
43,"Maizes ceptuves attīstība uzņēmumā SIA ""HRG LUX"".","Author : Anita Freiborne Topic of the Qualification Paper : Development of the bakery of the company SIA ''HRG LUX'' Study programme: 1st level professional higher education study programme ''Business Organiztion'', sub-programme ''Marketing and Trade Specialist'' Supervisor : Dr.sc.admin. Antra Līne Goal : To analyse the development of the bakery of the company SIA ''HRG LUX''  Objectives : 1. To describe the development of a company : it is external environment, marketing strategies, their usefulness and suitability. 2. To establish, understand and describe the general operation of bakeries in Latvian and Kurzeme. 3. To carry out an empirical research on the development possibilities of SIA ''HRG LUX'' bakery, describing the scope of activity of the company. 4. To analyse market segments and competitiveness of the company SIA ""HRG LUX'', as well as the commencement of operation in a new field, and to find out consumer bread buying habits, their wishes and needs. The Paper consists of : the introduction, 4 chapters with figures, conclusion and suggestions. The first chapter studies the external environment of the company, marketing strategies, and their efficiency. The second chapter describes the operation of bakeries in Latvia and Kurzeme. It includes the history of bakeries in Latvia. The largest bakeries in Latvia and Kurzeme are studied. The third chapter reflects practical research on the future development of SIA ''HRG LUX'' bakery. It focuses on the factors influencing microenvironment of the company, cultural environment and resources necessary for the operation. There is also an analysis of principles and criteria according to which costumers and segments, SWOT analysis. The fourth chapter provides the summary of the survey results on the purchase and selection of bread, and their analysis. Suggestions for the commencement of the operation are provided.",0
44,"SIA ""Optic Guru"" reklāmas darbības analīze un tās pilnveidošana.","Qualification paper topic “Analysis of advertising activity and its improvement for “Optic Guru” Ltd”. The problem or research is related with the fact that previously no analysis of advertising activity of “Optic Guru” Ltd. has been done. In addition, in 2020 because of COVID-19 infection, customer flow has decreased in the store and the volume of trade has dropped, therefore it was important to analyse advertising activity to stimulate reaching the previously introduced goals of advertising and marketing. The objective of qualification paper is to analyse advertising activity of “Optic Guru” Ltd. and to develop proposals for its improvement. In the first chapter definition of advertising, its essence, types and specificity for retail and optical stores has been provided. In the second chapter the characteristic of the company in research and its advertising activity has been developed, as well as customer survey has been conducted and proposals for improving company’s advertising activity have been developed.",0
45,Jauna produkta potenciāls īpašuma apdrošināšanā AAS Balta.,"The aim of this article “New Product Potential in Property Insurance AAS“ BALTA ”is based on  theoretical conclusions of new product introduction and development.  Survey results of respondents to explore the potential of a new product in the context of customer needs and to provide recommendations for possible development. The first chapter describes theory of the new product implementation process and research methods. Second - looks at insurance theory, insight into history and development of insurance industry in Latvia. Third part consists of empirical research data, impact of legislation, competition and analysis of competition rules as well as review of key differences and interpretation of empirical research results.  The total volume of this paper is 54 pages and it consists of 3 chapters, 4 images, 10 tables and 2 appendices. 30 sources of literature were used for research purposes of this work.",0
46,"Klientu apkalpošanas kvalitātes pilnveidošana restorānā SIA ""Superburger"".","Service is a significant part of a value for clients when they are rating a product that is offered to them. Quality of the service is a crucial when there exists such a great competition and many companies offer similar products and service with prices alike. Theme of qualification work is Service Quality Improvement to the Clients in Restaurant Ltd. Superburger. The goal is to identify client service defects in restaurant Hesburger relying on theoretical studies and survey data, to develop conclusions and suggestions to improve service in the future, to analyse Ltd. Superburger work. The results are conclusions and suggestions about the clients’ service in the restaurant Hesburger in Kuldīga, especially now when it is a great challenge for catering companies under these circumstances. Key words: clients’ service, loyalty, client, restaurant.",0
47,Tendences un izaicinājumi personāla motivēšanā un tās pilnveides iespējas privātā izglītības iestādē.,"As a result of changing environment, the employer constantly has to think about how to improve and adapt the motivation system so that employees don’t leave. The aim of the bachelor’s thesis is to study current trends and challenges in staff motivation to develop proposals to improve staff motivation in a private educational institution. The theoretical part of the bachelor’s thesis summarizes theoretical information on the motivation of the work environment, the opportunities and challenges created by technological development, the motivation of employees from different generations, and the external environment and the ability to adapt to it, including good practices in the real work environment. The research part of the bachelor’s thesis shows that overall the organization experienced relatively successful motivational experience, but also identified gaps and potential functions to be improved.",0
48,Jauno darbinieku adaptācijas pilnveide uzņēmumā “ Ozols”.,"Bachelor´s work theme – Improving the adaptation of young employees at company “Ozols” The purpose of the work was to explore theoritical and practical guidelines for the adaptation of young employees, by anketing and interwieving, how successful the adaptation process of young employees in the company is. An analysis of results has been performed and proposals to improve the adaptation process, have been developed. The work consists of three parts, the looks at the process of adapting new employees in theory, the characteristics at company “Ozols” have been perfomed, the adaptation processes in the company have been analysed, the analysis of personnel management SWOT  has been perfomed, conclusions have been made and proposals have been developed to improve the adaptation process. Key conclusion: a well-designed adaptation program, promotes a sence of safetly for employees, reduces the posibility of errors, encourage engagement and independent action by employees is expected faster. Scope or work: 60 pages, with the attachments – 67 pages. Work includes 15 pictures, one table and 3 annexes. Key words: adaptation of young employees, adaptation process, adaptation program, SWOT analysis.",0
49,Personu ar invaliditāti nodarbināšanas veicināšana apkalpošanas jomā Latvijā.,"Author of the work Elīna Millere. Bachelor's thesis „Promotion of employment of persons with disabilities in the service field in Latvia"". University of Latvia, 2020. The bachelor's thesis consists of the Introduction, Theoretical Part, Empirical Part, Conclusions and Proposals Part and the List of Literature and other sources. In the theoretical part of the bachelor's thesis, the author searched for available information about people with disabilities, their characteristics, the concept and prioritization of medical and social terms. Studied history and looked at how attitudes and beliefs of fellow human beings and society have changed over time. The characteristics of promoting the employment of disabled people in Latvia and abroad were compared. In the empirical part of the bachelor's thesis, initially, the author conducted research with employers who employ people with disabilities. Companies were approached and three in-depth face-to-face interviews were conducted. The main precondition for these interviews was to indicate reasons for employers to employ people with disabilities, what benefits and challenges are faced.  Based on the results of these interviews, the author created a questionnaire for ten companies in the service sector. The questionnaire was sent to more than 100 companies in the service sector. The total number of respondents to the questionnaires - 55. The results of the research were summarized, compared and conclusions and proposals were made. Main keywords: People with disabilities; Employment; Latvian labor market; Unemployment",0
50,"Personāla mainība, tās cēloņi un iespējamie risinājumi loģistikas uzņēmumā Akatrans SIA .","Human resources are the main value in the company, which is crucial for company operation. Staff turnover in a company depends on the attitude of management, the stability of a company and from company's management policy as well as labor market situation and economical situations, both in country and company. Staff turnover is minimal numbers can serve as a positive indicator, but high staff turnover can indicate problems inside the company. If the company can manage to find the causes of high staff turnover company can start to work on solving the problems inside in company and regain back the stability and reputation back and start to work forward their development strategy. This Bachelor thesis aims to research the causes of staff turnover in the company and to develop. Suggestions for its mitigation the theoretical part of the bachelor's thesis will look at the impact of staff turnover on the company and its role in the operation of the company, and the research part will analyze staff turnover, its causes in logistic company SIA Akatrans in Latvian Branch.",0
51,Personāla motivācijas sistēmas analīze un tās pilnveides iespējas valsts organizācijas struktūrvienībā.,"The  objective of the “Analysis of the Motivation system for staff and its development capacity within the National Organization” shall be the development of measures for the development of the staff motivation system within the structure of the State organization, as this is an organization with a specific activity. The work consists of an introduction, three parts, conclusions, proposals, table of literature and one attachment. The first chapter examined and analysed the motivation at work, the second chapter examined the current theories and trends of practice motivating staff, the third chapter, the opportunities for improvement in the organization. Key words: motivation of staff, motivation system for staff, motivation. The bachelor’s work consists of 62 pages, 4 tables, 16 pictures and 1 supplement.",0
52,Stresa vadība valsts iestādes darbiniekiem .,"One of the main problems in a healthy work environment is stress in the workplace. The bachelor's thesis ""Stress management for employees of a state institution"" deals with issues related to the impact of stress on the work environment, its influencing factors and prevention methods, provides a general description of the center, insight into the history and development of forensic medicine today. Center (VTMEC). Finally, conclusions are made and proposals are made on ways to reduce work stress. Key findings of the study: VTMEC employees are exposed to moderately high levels of stress, and women are more exposed to stress than men. One of the stressors is the feeling of discomfort in the workplace.  Keywords: work stress, types of stress, stress reduction methods.",0
53,Personāla apmierinātība ar darbu un tās pilnveides iespējas Rīgas pašvaldības kapitālsabiedrībā.,"Bachelor thesis title is “Staff satisfaction with work and opportunities for its improvement in Riga municipal capital company.”. The aim of the research is to study the factors influencing and hindering the staff satisfaction in the Riga municipality capital company, which field of acivity is medical treatment, and to develop proposals for its improvement. In order to achieve the goal and realize the work, literature research and analysis, observation during practice, as well as employee questionnaires were performed. The base of scientific literature is based on motivation theories. Analyzing the theory and the survey, the author comes to the conclusions and follows from them, provides suggestions for the improvement of staff satisfaction in the company. The bachelor's thesis consists of 69 pages, 3 chapters, the work includes 7 tables, 13 pictures and 5 appendices. Keywords: staff satisfaction, staff motivation, motivation theory, medical institution.",0
54,Darbinieku motivācijas pilnveides iespējas Rīgas domes struktūrvienībā.,"The theme of the Bachelor`s thesis is “Employee motivation improvement opportunities in the structural unit of the Riga City Council”. It is important for managers to motivate their employees. Motivation in the workplace is considered to be an integral part of an effective workforce. It increases employee satisfaction and work efficiency, which means better achievements for the company, and the avoidance of financial losses that could be associated with employee leaving the work. The aim of the bachelor's thesis is to study and analyze the motivation theories and employee motivation system in the structural unit of the Riga City Council, identifying the strengths and weaknesses of the motivation system, in order to provide suggestions for successful improvement of the staff motivation system. The bachelor's thesis consists of two chapters: In the first chapter the understanding of the concept of motivation was performed, the theories of various authors about motivation were summarized and analyzed. Based on the analysis of the literature, the author of the bachelor's thesis summarized the types of motivation and motivators, as well as studied the need for an employee motivation system. At the end of the chapter, the author summarized the most important factors related to employee motivation in Latvia. In the second chapter, the description of the Riga City Council structural unit was prepared and the evaluation of employee motivation processes was performed using SWOT analysis. With the help of the employee questionnaire, the negative aspects of employee motivation in the structural unit of Riga City Council were studied and, based on the results of the SWOT analysis and the employee questionnaire, suggestions for the improvement of employee motivation processes were made. After summarizing both chapters, the author created conclusions and suggestions.  Research methods which were used in Bachleors thesis are literature and internet resources analysis, document analysis (company's internal documents), SWOT analysis, statistical data analysis and employee questionnaires (survey).  The research was performed in the structural unit of Riga City Council and, as one of the most important conclusions, the author mentions that the structural unit doesn`t devote enough time to the issue of employee motivation and doesn`t improve the existing motivation system, which has contributed to employee dissatisfaction.  The bachelor's thesis consists of 77 pages (excluding appendices), which contains 21 figures and 2 tables. At the end of the bachelor's thesis, 4 appendices are attached, which consist of 15 pages. 47 literature sources were used in the bachelor's thesis.  Keywords: employee motivation, manager, employees, institution, motivation.",0
55,Darba devēja tēla nozīme personāla piesaistes procesā ražošanas uzņēmumā.,"The topic of the bachelor's thesis is “The importance of the employer brande in the process of attracting human resources for a manufacturing company”. The aim of the bachelor's thesis is to study the significance of the employer's brande in the process of attracting the human resources of the production company. The tasks set to achieve the goal are related to the analysis of theoretical literature on human resource management processes and human resource management policy, their role and significance in the company, as well as with the analysis of the results of the survey of potential and existing employees of the company. The bachelor's thesis consists of 3 chapters. The first chapter describes the role of the recruitment process in the company's work, the methods used and explains the concept of employer's brande. The second chapter provides a general description of the manufacturing company and prepares the SWOT analysis of the company's personnel management process. The last chapter presents the results of the study and provides an interpretation of the results, as well as a plan of possible measures for the targeted creation of employer's brande for the more effective recruitment of staff. The final conclusions are summarised and proposals have been drawn up. The results of the empirical study indicate that employer's brande has a direct impact on the recruitment process - the majority prefers a company with a positive employer's brande and a lower wage level. The obtained results also reflect the fact that the gender of the respondents plays an important role in the perception of employer's brande. The main conclusions indicate that the company's real employer's brande does not match expectations and that there is a need to create and manage the company's employer's brande, but it’s been ignored. The most important proposals for the company is to establish a employer's brande management team and develop an employer's brande management strategy. The volume of the bachelor's thesis is 72 pages, with appendices - 7 pages. The bachelor's thesis has 2 tables, 12 figures and __ appendices are attached to the thesis.",0
56,Jauno darbinieku adaptācijas programmas ieviešana un pilnveide uzņēmumā.,"The author of the dissertation Inga Šūmane chose the topic “Implementation and improvement of the adaptation program for new employees in the company” for the research of the Bachelor's thesis. The author set the task to find out what criteria characterize a successful adaptation program for new employees. During the theory research, terms such as adaptation, integration, guidance and socialization, as well as mobbing and mentoring were read. During the research, the theoretical literature was reviewed and information about the employee adaptation process in the company was analyzed in order to find out the significance, meaning and necessity of the adaptation process in the company. In the empirical or practical part, the adaptation process recently introduced in the construction company “Betons ABC” was studied. The methods used in the research are analysis of theoretical literature, analysis of secondary data, interview with the company's personnel specialist and employee questionnaires. During the research, the importance and significance of the adaptation process of new employees was concluded. The success of the new adaptation program and the company's benefits from it have been revealed. The results of the interview and questionnaire were analyzed and compared with the answers provided by the employees before the implementation of the adaptation program. The bachelor's thesis is prepared on 76 pages, using 32 literature and information sources. 6 tables, 23 figures and 2 appendices have been developed. In conclusion, 14 conclusions were made and 9 proposals were put forward.",0
57,"Personāla piesaistīšanas un atlases pilnveide uzņēmumā SIA “Caurule"".","The bachelor's thesis “Personnel Attracting and Selection Improvement in the Company SIA Caurule” is a study of how personnel is attracted and selected for a very narrow field of production, which requires specific requirements for the candidate to be able to qualify an position by developing for recruiting process and purposes. Currently, the problem of the Latvian market is the lack of competent personnel, so more and more employers are starting to think about attracting personnel and selection, investing time and resources to finally have the strongest team of specialists available. The aim of the work is to evaluate the ways of attracting entrepreneurial personnel, selection procedures, methods and evaluation, development proposal for the company's management to improve and perfect the personnel selection process. In order to achieve the objectives, main tasks and analysis of scientific and applied literature on recruitment opportunities and types, selection development, processes, methods and candidate evaluation, research companies, structure and personnel characteristics, research and analysis company recruitment methods and selection procedure. The principle of methods and evaluation, taking into account the theoretical findings and the results of the questionnaire, allows to conclude and propose the way of attracting the staff of the company SIA Caurule and to improve the selection process. In order to perform data analysis, the author used employee questionnaires and interviews with representatives of the company SIA “Caurule”. The results of the research were obtained in the study. The main results of the study show that employees in the company are satisfied with the selection process, but given the specific scope of the company, there are some shortcomings in the recruitment and selection process in the company, which were pointed out during the interview. According to the obtained data, the author of the work prepared proposals for the improvement of processes. Thesis consists of 64 pages, 1 appendix, 1 table and 15 pictures. Within the framework of the work 29 literature sources were used.  ",0
58,Personāla vadības funkciju analīze un to pilnveides iespējas uzņēmumā SIA “Secure Solutions Latvia”.,"The topic of the bachelor's thesis is the analysis of personnel management functions and the possibilities of their improvement in the company SIA ""Secure solutions Latvia"". The aim of the work is to identify the most significant problems based on the analysis of the personnel management functions of the company SIA “Secure Solutions Latvia” and to develop proposals for its improvement. To achieve the goal, the literature was researched and analyzed on personnel management and its functions, a study was developed analyzing personnel management functions and their implementation in SIA Secure Solutions Latvia, as well as employee surveys, the method is used to find out the company's employees' views on personnel management activities and performance of personnel management functions in the company. The results obtained in the research show that SIA “Secure Solutions Latvia” implements all personnel management functions discussed in the theoretical part - personnel planning, personnel selection, adaptation process, personnel motivation process and personnel evaluation, but the author found shortcomings in each of these functions. The author has made conclusions and put forward proposals to eliminate these shortcomings and improve the personnel management process in the company. Keywords: personnel management, personnel management functions, personnel, SIA “Secure Solutions Latvia”.",0
59,Latvijas iedzīvotāju subjektīvā labklājība un tās neseno izmaiņu analīze,"During the development of national policies and the allocation of budget funds the issue of priorities comes up every year. If the strategic objective of the state policy is happier residents in Latvia, in order to allocate the budget funds more efficiently, it is necessary to understand, which factors impact happiness or subjective well-being of the residents of Latvia. Based on the results of the European Union statistics on income and living conditions of Latvian residents, by using linear regression least squares method and Stata software, the main happiness (subjective well-being) factors are identified in this research. These factors are health status, income level and employment status.",0
