id,title,abstract,is_generated
141,Paterētāju tiesību aizsardzības centra kā uzraugošās iestādes kompetence kolektīvo strīdu risināšanā.,"In the thesis “Competence of the Consumer Rights Protection Centre as a supervisory authority in consumer collective dispute resolution” author examines the concept of consumer collective interest disputes, the most common infractions in the field of consumer collective interests, the competence of the Consumer Rights Protection in resolving collective consumer disputes, analyzes collective redress mechanisms in Latvia, Lithuania and European Union. The competence of the Consumer Rights Protection Centre in resolving individual consumer disputes differs significantly from its competence in resolving infringements that cause significant damage to the collective interests of consumer, therefore it is very important to understand which infringements are qualified as consumer collective interest disputes. The goal of research: to understand the concept of consumer collecive interests disputes within the meaning of national legislation and the Injunctive Directive, the powers of the Consumer Rights Protection Centre in resolving collective disputes, what collective redress mechanisms are available in Latvia, Lithuania and the European Union. Research consists of 3 sections and 9 subsections.",0
142,Kuģa karoga valsts starptautisko vides tiesību pienākums nodrošināt tās kuģu likumīgu zvejniecību citas valsts ekskluzīvajā ekonomiskajā zonā,"Illegal fishing is a global problem that is causing severe damage to coastal economies, damaging the environment and creating problems for public food security. Most fishing takes place in large and resource-rich exclusive economic zones. Although coastal states have a legally guaranteed ability to prevent illegal fishing by fishing vessels of other countries in their exclusive economic zone, their technical capacity to effectively prevent illegal fishing is limited. There is therefore a need for the responsibility of fishing vessel flag states. The aim of the work is to reveal the legal basis of the flag state obligations, as well as to find out the content of these obligations and the requirements for the responsibility of the state for its violations.",0
143,"Preču zīmes atšķirtspēja, tās iegūšana un zaudēšana.","Trademark registration is one of the ways in which persons can protect their goods and services. Despite the high interest in trademarks, their applicants and owners in Latvia still have problems with the understanding of trademark distinctiveness and related issues. In practice, such problems often lead to the refusal, invalidity or revocation of the registration of a trademark, thus hindering the successful development of the business. In order to solve this problem, in this work the preconditions for the trademark to acquire distinctive character and the cases in which the trademark loses distinctive character were identified and summarized. The author also tried to find the ways how to improve the existing trademark legal framework in order to achieve the objectives of the relevant legal norms more effectively.",0
144,"Krimināllikuma 317.panta kvalifikācijas teorētiskās un praktiskās problēmas""","In the Bachelor’s thesis, the author of the “Theoretical and practical problems of the qualification of Article 317 of the Criminal Law” studied the composition of the criminal offence provided for in Article 317 of the Criminal Law — exceeding the powers of the service with a view to gathering all the features of the composition in a unified work, highlighting guidelines for the correct qualification of the offence.  The focus of the study is based on errors found in case law. Law enforcement do not have a uniform understanding of the characteristics that need to exist so that public officials can be held criminally responsible for exceeding their powers of service. Amendments to the Criminal Law of 6 June 2019 also have a bearing on the aim of this work. As a result of the study, the author provides guidelines for qualifications with examples and points to problems identified in case law.",0
145,"Juridisko profesiju kvalifikācijas atzīšana darba ņēmēju pārvietošanās, uzņēmējdarbības un pakalpojumu sniegšanas brīvību ietvaros",". Citizens of the European Union have the right to provide the services and establish business. However, there are professions that require specific knowledge and skills. Member states may impose additional requirements on these professions. Such professions also include lawyers and notaries. Conditions imposed by the member states, may interfere fundamental freedoms enshrined in the Treaty on the Functioning of the European Union. Therefore, it is important that these conditions are non-discriminatory and based on objective considerations. As the requirements imposed by the member states may differ, it is necessary to have a regulation that allows citizens from other countries to work there as well. The European Union has developed secondary legislation that helps to even differences of the qualifications. Nowadays the role of professional mobility is growing and it is even more important to have an effective regulation of professional qualifications.  Nevertheless, the Directive on the recognition of professional qualifications of the lawyers was introduced more than thirty years ago and requires improvements. But the general Directive on the recognition of qualifications is not applicable to notaries. That is way the porpouse of this research was to find out whether the process of the recognition of professional qualifications in European Union, especially for legal professions, can currently create obstacles to the freedom of movement of workers or to freedom to provide services and establish business.",0
146,Saskarsmes tiesību piespiedu izpildes problemātika.,"Bachelor's thesis is ""Problems of the judgement enforcement in access rights"" has been developed in University of Latvia, facultaty of law, in department of Civil rights. The amount of Bachelor’s thesis is 49 pages and it consists of 32 literature sources – legal literature, regulations and case law. Bachelor’s title has been chosen based on problems of the judgement in access rights in Latvia’s law.  As practice show’s judgement enforcement, which is done by sworn bailiff, often ir inefficient and heavy to execute. Bachelor’s thesis had sen the following targets: 1.to identify problematic cases of enforcement of access rights; 2.to identify the cause of problems.  The author has concluded, heaviness and inefficieness of the judgement enforcement is based at the time of the court decision is in process. The author summarizes the following typical problems of judgement enforcement raises: •conflict between parents; •ineffectiveness of the penalty imposed by the court; •dishonesty of the parties with regard to the court decisions; •force majeure.",0
147,Personas izvertēšana adoptētāja statusam un kļūšana par adoptētāju.,"With the approval of the adoption person acquires custody rights over the child so the person must correspond to the necessary requirements. The aim is to study the process of assessing a person`s status as an adopter and becoming an adopter. The tasks are to ascertain the adoption procedure, to analyse the process of evaluating the person, to get acquainted with the most up-to-date adoption statistics in Latvia. It is concluded that in adoption the interests of the adoptee prevail over the interests of the adopter so the compliance with the law of the adopter does not guarantee the person becoming an adopter. Amendments are proposed to be made in the first paragraph of Article 162, the third paragraph of Article 163 of the Civil Law of Latvia and Cabinet Regulation no. 667 Articles 23.8., 25., 45., 53.",0
148,Psiholoģiskā aprūpe ieslodzījumu vietās kā resocializācijas līdzeklis.,"In bachelor’s thesis will be analysed psychological care as one of the means of resocialization, because the main task of prison is to resocialize a person. The aim of bachelor thesis is to research psychological care in prisons as one of the aspects of resocialization, to identify problems related to the activities of psychologists in prisons, and to find out whether this means of resocialization is fully provided. To achieve the aim, the author made a researh of Latvian and foreign laws, literature analysis and interviewing Latvian prison psychologists. As a result of this research,  author establishes the importance of psychological care as a means of resocialization in the execution of criminal sentences and points to the identified problems, making proposals to improve the situation.",0
149,Nepamatoti lēts piedāvājums Publisko iepirkumu likumā.,"The topic of the bachelor’s thesis is “Abnormally low offer in the Public Procurement Law”. The actuality of the topic is related to the fact that there are cases when abnormally low tenders are submitted in public procurement, it means that the offered price does not correspond to the real value of the goods or services and accordingly the quality of delivered goods and services could be doubted. The selection and evaluation of tenders in public procurement must be in accordance with the objectives set in the procurement in order to prevent corruption risks, promote fair competition between tenderers, ensure equal and fair treatment of them, as well as ensure efficient use of contracting authority funds.. The aim of the bachelor’s thesis is to analyse the institute of abnormally low tender in the public procurement, which leads to identifying the legal problems and proposing the improvement of the Public Procurement Law. As a result of the research, it has been concluded that legal regulation does not contain a definition of abnormally low tender, but the contracting authority is obliged to request an explanation from the tenderer if the contracting authority has doubts about the submitted tender. In turn, the tenderer shall provide the contracting authority with an explanation based on the contracting authority’s request, which should be quite detailed in order to receive the information necessary to make a decision on accepting or rejecting the tender. In addition, it has been concluded that it is necessary to standardise the procurement documentation, to determine the obligation to invite expert to be part of the commission and to develop criteria for evaluating the tenderer’s explanation.  Keywords: Public procurement, abnormally low offer, consultation, criteria, test.",0
150,Kompensācijas apmērs par noziedzīga nodarījuma radīto morālo aizskārumu,"The aim of the work of the bachelor is to investigate the determination of the amount of compensation for moral damage caused by criminal offence.  This work deals with theoretical aspects of the compensation for moral damage and their application in practice. In order to better understand how compensation for moral damage is currently being determined in Latvia, the latest judical judgments have been investigated in cases of criminam offences against the life and health of a person.  The results show that there are divergent approaches in Latvian case-law to determine the amount of compensation, as well as that compensation amounts are relatively low overall and have not increased significantly over the years as the economic situation improves. In the work also the extents of compensation that the courts could set for now are offered.",0
151,"Darba tiesisko attiecību nodibināšana , izbeigšana, speciālās garantijas grūtniecēm un sievietēm pēcdzemdību periodā.","The aim of the bachelor's thesis is to analyze the Latvian legal framework and court practice in order to draw conclusions about Latvian legislation compliance with in modern European Union law formulated opinions for the context of the legal protection of pregnant women. The bachelor's thesis analyzes issues that cover the restrictions provided by law for the employer, giving special guarantees for pregnant women and women during the period of following childbirth. In thesis is discussed about moment from which the employee is entitled to the special guarantees provided by law and when there is no such right. In the thesis is discussed about the specific situation of a pregnant woman regard to other employees, which, for example, entitles a pregnant woman to request paid annual leave regardless of the length of time she has been employed, while other employees are only entitled to request it after six months of continuous employment. It is discussed about questions that are not allowed in a job interview, who are directly or indirectly discriminatory, such as questions about a woman's pregnancy, family and family status. In thesis is discussed about whether is required to need written agreement for pregnant woman employment in overtime work, night work, weekly rest, as well as to send an employee on a business trip or business trip.",0
152,Stratēģiskas tiesvedības un žurnālistu aizsardzība pret tām Latvijā,"Strategic lawsuits against journalists are the way in which individuals can exercise their right to a judicial review for abusive purposes, to involve the defendant in lengthy judicial proceedings, thereby consuming the time and financial resources of the defendant, and to intimidate journalists and create a chilling effect on other journalists. The author's aim in this work is to ascertain whether journalists in Latvia are sufficiently protected against strategic litigation and whether strategic lawsuits can limit media freedom in Latvia, as well as find solutions to strengthen media freedom. In this work, the author concludes that, in general, media freedom in Latvia is not at risk, but in certain cases of legal proceedings there are signs of strategic lawsuits. Strengthening media freedom requires amendments to both the Criminal Law and the Civil Procedure Law.",0
153,Zemesgrāmatu lietās atstāto nostiprinājuma lūgumu bez ievērības problemātika.,"The Land register takes an important part in the judicial system and in the corroboration of different rights. Since in practice such actions that are not set in law are performed in land registers, the goal of the thesis is to improve the examination process of land register cases and reduce the number of refusals. For this purpose, special attention in the thesis is devoted to the analysis of the decisions to disregard the requests for corroboration in full and in part, indicating the problems in the corroboration process and suggesting possible solutions. If the applicant for corroboration was informed about the shortcomings in the request before the final decision is taken, he/she would be able to eliminate them and it would reduce the number of refusals. Therefore, Land Register Law should be amended, implementing decision to leave the request for corroboration not proceeded with and setting additional responsibilities to the employee who recieves the documents.",0
154,Būvdarbu veicēja pienākums atlīdzināt trešajām personām būvniecības procesa laikā nodarītos zaudējumus Latvijā.,"Although the obligation of the construction contractor to compensate third parties for the damage caused during the construction process and the liability of the construction contractor towards third parties is a topical issue in the Latvian construction industry, this issue is not often considered in Latvian legal practice. The aim of the bachelor's thesis is to study the legal literature, court practice, regulatory framework regarding the obligation of a construction contractor to compensate third parties during the construction process in Latvia, and to clarify the court regulation and issues, to propose amendments and additions to the law.   Keywords: strict liability, source of increased danger, loss, causal link, force majeure.",0
155,Kultūras pieminekļu tiesiskā regulējuma nepilnības Latvijā,"The aim of the thesis is to evaluate the problems of cultural monuments (buildings) in Latvia, which includes mainly the protection of cultural monuments and the study of restrictions on ther it sofowners. The tasks of the thesis are focused on the comparison and analysis of regulatory enactments, court judgments, and proposing proposals. The thesis examine the operation of the National Cultural Heritage and the rights and obligations of the owners. The field of protection of cultural monuments in Latvia is developing, but it is happening very slowly. The legal norms of regulatory enactments are not full-fledged, there are contradictions between regulatory enactments. States upport for the protection of cultural monuments is insufficient, especially financial support. Owners often do not follow the rules for the protection of cultural monuments, as a result of which the cultural and historical value of the object is lost. The activities of the Board are not uniformly organized, the list of cultural monuments is not updated and often contains in accurate information, such a situation canals obeobserves din the entries made in the Land Register.",0
156,Noziedzīgi iegūtu līdzekļu legalizēšana,"The aim of this work “Money laundering” was to study Article 195 of Latvia’s Criminal Law, which determines criminal liability for committing money laundering, to analyze the composition of this criminal offense, and to make proposals for improving the existing regulation. During the development of the work, the concept and composition analysis of a criminal offense and money laundering were considered and described. The composition of Article 195 of said Criminal Law was analyzed and interpreted with other norms of the law. At the end of the work, the problems of anti-money laundering measures were analyzed and based on the regulatory framework, proposals were suggested. The main results revealed that the material values of money laundering were criminally obtained and deliberately carried out with the intention of concealing or disguising the criminal origin of funds or other property and making them seemingly legal.",0
157,"Problemātika saistībā ar valsts amatpersonu ievēlēšanu, iecelšanu, apstiprināšanu un atbrīvošanu no amata","The theme of the bachelor's thesis is problems related to the election, appointment, approval and dismissal of the public officials. The aim of the work is to analyze and understand the main problems related to the appointment and dismissal of public officials, also to evaluate the effectiveness of the legal framework, to draw conclusions and provide proposals for the elimination of the problem. Also the role of the President in the appointment of officials was studied, as well as the procedure for the appointment of officials in other countries. The paper deals with the legal regulation of Latvian regulatory system regarding the appointment and dismissal of such public officials as judges, the Prosecutor General, the Ombudsman, the State Comptroller and others. The appointment of such officials must be a neutral, objective decision based on professional criteria and not a decision based on political considerations.",0
158,Darbinieku ar invaliditāti tiesiskā aizsardzība Latvijas normatīvo aktu tvērumā.,"The topic “Legal protection of handicapped workers within the scope of Latvian legislation” is actual because employment and successful integration of handicapped people into the labor market is still an actual problem. In the thesis, the author mainly analyzes the norms of the Labor Law in connection with the considered obstacles that hinder the employment of the handicapped.          After the analysis of the norms, the author has concluded that the main problem that hinders the successful integration of handicapped people into the labor market is the existing stereotypes in society - that the employment of handicapped people will be an additional burden for the employer. The author concludes that employers are afraid to employ handicapped people because they do not correctly understand the meaning and purpose of the regulations that protects handicapped people. In order to promote the correct understanding of the norms, the author invites other employers who have experience in employing handicapped people to share examples of good practice, as well as, it would be necessary to provide employers with more educational information.",0
159,Noziedzīgi iegūtu līdzekļu legalizēšanas un terorisma finansēšanas novēršana Eiropas Savienībā attiecībā uz neatkarīgo juridisko profesiju pārstāvjiem,"Prevention of money laundering and terrorism financing is topical issue at the moment in international level and in Latvia, and European Union as the globalisation has improved the possibilities for assets to be transferred within the global financial system. In the last 30 years the regulation in this area has significantly developed and expanded. One of the subjects of the regulation are legal professionals even though the primary subjects of the regulation are credit and financial institutions. The research paper looks at the development of the regulation in the EU regarding legal professionals and identifies issues that should be addressed for future developments and improvements of the regulation.",0
160,"Mantošanas regulas piemērošana, vedot mantojuma lietu pie Latvijas notāra un ar to saistītie problēmjautājumi.","The Bachelor’s thesis contains analysis of application issues of Regulation (EU) No 650/2012 of the European Parliament and of the Council of 4 July 2012 on jurisdiction, applicable law, recognition and enforcement of decisions and acceptance and enforcement of authentic instruments in matters of succession and on the creation of a European Certificate of Succession or Succession regulation, when inheritance case is conducted by a Latvian notary. The aim of this thesis is to analyze most important terms of the Succession regulation, the relevance of the Succession Regulation to its initial purposes, as well as to explore the challenges faced by those applying the Succession regulation in Latvia and suggest appropriate solutions to facilitate the application of the Succession regulation. Taking the view that Succession regulation is applicable only from 17 August 2015, extensive case law on the application of this regulation is not available and there are still countless open issues. As a result of the research author reaches several conclusions about the application of terms incorporated into Succession regulation, about regulatory failures of this regulation and the necessity to complement national regulation.",0
161,Krievijas kiberuzbrukumu pret Latviju klasifikācija starptautisko tiesību kontekstā,"Bachelor thesis reviews the issue of Russian cyber-attacks against Latvia classification under international law. Considering the absence of an international legally binding legal act that regulates the use of cyber-attacks as a weapon, the presence of cyber-attacks has drastically increased during time as an unregulated weapon to express power, causing significant losses to victim states. As part of the Thesis, cyber-attacks will be analyzed whether they qualify as use of force in the international legal system. The Thesis will look at the impact cyber-attacks have created so far, both internationally and in Latvia. Additionally, the challenges faced by international organizations in regulating cyber-attacks will be analyzed as well as why they have not yet established a legally binding instrument that regulates cyberspace. The Thesis will analyze on what type of cyber-attack can be answered to with a counterattack as self-defense, enshrined in Article 51 of the UN Statutes and in Article 5 of the North Atlantic Treaty as well as what alternatives exist for the victim state. In regards to Latvia, it will be ascertained what legal means exist for it, if it has suffered from a cyber-attack caused by Russia or another state, and what legal means can be applied in reality, considering the resources and the actual situation.",0
162,Ar nāvi sodāmi noziegumi padomju krimināltiesībās,"The bachelor's thesis ""Death Penalty Crimes in Soviet Criminal Law"" provides an insight into the course of Soviet life, which allows us to find out how totalitarianism and its oppression manifested itself, which could negatively affect almost anyone who disobeyed the laws of that time and opposed holders of the reins. The aim of the study is to find out what kind of crimes during the Soviet era were the basis for the death penalty. In order to reach the set goal, two characteristic Criminal Codes of the time - the Criminal Code of the Russian Soviet Federative Socialist Republic and the Criminal Code of the Latvian Soviet Socialist Republic - are studied and compared, and other types of information are obtained to look at history and understand Soviet legal values. The historical development and legal regulation of the death penalty in the Soviet period is studied, as well as an insight into the application of the death penalty practice in the sense of both the Criminal Code of the Russian Soviet Federative Socialist Republic and the Criminal Code of the Latvian Soviet Socialist Republic.",0
