id,title,abstract,is_generated
1,Tiesas izdevumu noteikšanas prasības un piemērošanas īpatnibas civilprocesā.,"In practice, the most common issues are related to the State duty imposed by the legislator, which, probably, restrict person’s free access to the court. A court or a judge, upon consideration of the material situation of a person, must respect the principle of proportionality to prevent a person from being deprived of the right to access to justice. The author considers, that the problem is related with court’s or judge’s right to assess the material situation of a person according Section 43, paragraph four of the Civil Procedure Law, however the Civil Procedure Law does not specify specific criteria, which prevent the person, who submit a statement of a claim in the court, from making payment of the court expenses. In the course of the study, it should be considered whether Section 34, Section 35 and Section 43, Paragraph four of the Civil Procedure Law should not be non-exhaustive in order to establish case-law and to take uniform judgments. The aim of the study is to assess the proportionality of the amount of the State duty in relation to defending the person’s rights in the court, as well as the clarification of the will of the legislator, which allows for the existence of gaps in law and the assessment of the actual conduct of a court or a judge by enforcing the Civil Procedure Law in practice. In the course of the study, it has been clarified that the legislator, without specifying the purpose of the office fee, concedes that the Civil Procedure Law includes court expenses which are duplicated by the fee packets specified in Cabinet regulations. In the course of the study, it has also been clarified that the legislator has not specified why Section 34 of the Civil Procedure Law determines exactly this amount of State duty. There isn’t clear answers, when determining the level of State duty, the legislator would have assessed their proportionality in relation to the overall economic situation in the country and the solvency of the population. In the course of the study, it has been clarified that the non-uniform application of Section 43, Paragraph four of the Civil Procedure Law could be assessed as a violation of a person's right of access to the court.",0
2,Tiesu varas neatkarības diskurss Latvijas teritorijā (1940-1993),"Along with the recognition and development of the human rights in the international area, the issue of ensuring the rule of law also became topical. The rule of law is one of the common values on which the European Union is founded. The independence of the judicial power is an essential precondition for the rule of law. However, violations of the principle of the independence of the judicial power, and the problems associated with it, still exist nowadays. The aim of the Master's thesis is to research the discourse of the independence of the the judicial power in the territory of Latvia (1940 - 1993), analyzing the understanding of the judicial power and its independence at that time. The issue of the independence of the judicial power did not arise out of empty space. In order for Latvia to be able to implement the internationally recognized requirement for an independent and impartial court, there must first be a common understanding of the content of judicial independence and its scope. Sequentially, the formation of this understanding is not possible without historical research.",0
3,Piesārņojuma novēršanas tiesiskais regulējums lauksaimniecībā,"Master’s Thesis “The pollution prevention legislation in agriculture” examines aspects for the use of various potentially polluting substances in agriculture in order to alleviate the the likelihood of comtamination. The work analysed diffuse pollution regulation and related problems in agriculture.  Author has identified a number of problemas that exist in the legislation, studying various publications, normative acts, literature and other sources. Viable solutions are offered for the problems by streamlining legislation and elimention of current weak-spots.  As the author concluded, the monitoring of pollution in agriculture is complex and is being realized with the help of many laws and regulations, the knowledge of wich is a difficulty not only for the farmer but also for supervising institutions.",0
4,Latvijas Republikas Valsts prezidenta ievēlēšana un tā pilnveidošanas aspekti,"Many years in Latvia it have been a very popular topic among the inhabitants and also members of the parliament of Latvia. And this topic is about, are there possibilities to vote for the President of Latvia in universal, equal, direct and secret ballot. This election model are familiar in the countries where the system of state is federation and not parliamentary republic where its members elect the President of the country. In the countries that are federations, President also have more power than in parliamentary republics.  The main goal of this work was to analyze the election procedure of the President of Latvia and also other countries with different election types, and maybe find some procedural aspects that could fit in the election system of Latvia. That means that in this work the Author also analyze direct elections of President and all details of this election model, because this topic was a very debated topic when the Republic of Latvia was found and also when Latvia regained independence. And of course, nowadays.  At the end of this work, the Author concluded that it is possible in Latvia that people vote for the President of the country, despite that the system of country is parliamentary republic. It’s also possible without any extension of power. It’s a possible combination, also other country examples show that. It’s also a question worth discussion that members of parliament and municipalities elect the President. Also at this question there are some examples.",0
5,"Pamattiesību ierobežojuma tiesiskuma kritērijs ""noteikts ar likumu"" Satversmes tiesas judikatūrā","The master thesis presents a research on the restriction of fundamental rights though “law” within the Constitutional court’s case law. This thesis discusses the meaning of the term “law”; discusses lawmaker’s law-making errors, found by the Constitutional court. This work further discusses examples of case law, where the content of the principle of good legislation has been reflected; points towards these elements in the discussed examples of case law in order to improve the process of law-making. The research provides a solution for the clarity of the norm based on the Latvian case law and foreign examples. Also, new insights, based on the principle of good legislation outlaid in Constitutional court's case law, are found to improve the quality of law-making process, thus promoting the citizens’ trust in the state and its laws.",0
6,Dzīvības un veselības apdraudējums dalībā un līdzdalībā,"The topic of Master’s thesis is “Endanger to life and health into participation and complicity”. The thesis examine the development of participation and complicity in the territory of Latvia. The development of participation and complicity had been started studied with the laws that were in force in the territory of Latvia from November 18, 1918. In this thesis also are reviewed explenation of participation and complicity and their specific issues. The seperation of participation and complicity also considered in this thesis. In this thesis are analized the case law of danger to life and health into participation and complicity. The aim of the thesis is to explore and analyze the literature, laws and case law of the participation of several persons in criminal offenses that endanger the life and health of persons.",0
7,Pašvaldības domes un tās priekšsēdētāja atlaišanas mehānisms Latvijā,"Principle of municipality autonomy provides that municipality generally is independent regarding its affairs. However, in order for municipality actions to be subjected to the principle of the law, certain authorized entities are granted rights to dismiss municipality decision-making body or chairman of the council. Such action can lead, mainly, to violation of rights provided in the Article 101 of Latvian Constitution, therefore it is essential to exercise dismissal rights by adhering to principles and laws and regulations of democratic, lawful country. Aim of the work is to analyze mechanisms of municipality council and its chairman dismissal in Latvia by identifying issues which are related to their implementation. Furthermore, author analyses protection mechanisms granted to municipality council and its chairman in the case of dismissal mechanism implementation. Author concluded that it is necessary to improve municipality council and its chairman dismissal mechanisms. In this way, municipalities would be protected against wrong interpretation of the law and political intrigue, and it would also encourage local resident involvement in municipality work.",0
8,Brexit tiesiskās sekas ģimenes lietās,"The master's thesis “Brexit legal consequences in family cases” focuses on the research of current family law issues in connection with the United Kingdoms` withdrawal from the European Union. The aim of this master's thesis is to determine the future legal activity of the United Kingdom in situations where there is a cross-border element in family cases. The content of the master's thesis is based on the research of various legal acts, analysis of case law, research of legal literature (doctrine). Mainly the case law of the Court of Justice of the European Union is analyzed. Within the framework of this work, the author of the master's thesis identified and found various discrepancies between the sources of European law and the sources of international law. The master's thesis is written in latvian language and consists of an annotation in latvian language and english language, four chapters, a summary, a list of used literature and a total volume of 72 pages.",0
9,Nepilngadīgajiem piekrītošā manta un tiesiskā regulējuma problēmas.,"The theme of master thesis is “Property of minor and legal framewrok problems”. In practice, guardians often face the need to apply to an orphan's court for permission to dispose of the child's property. It is the task of the Orphans' Court to assess whether the action will be in the best interests of the child before allowing the guardian to dispose of the child's property. In practice, such mediation by an orphan's court prevents the guardian from acting quickly and efficiently in managing the child's property.",0
10,Noziedzīgi iegūtu līdzekļu legalizēšanas sastāvs un tā pierādīšanas problemātika,"Laundering of proceeds derived from criminal activity or money laundering is a very common criminal activity seeking to fight worldwide. Latvian lawmakers and law enforcement officials have also sought to make all necessary steps to effectively fight against this crime. That's why it is very important to understand what constitutes this crime and what the order of proof is. The aim of the master's thesis is to carry out an analysis of the money laundering composition of crime and to investigate the specific nature of the evidence.  In the thesis are explored such questions as stand-alone money laundering, the presumed proceeds of crime as an object of money laundering, a reduced standard of proof as regards the criminal origin of the property, the reclamation of the burden of proof and other issues of law doctrine and practice.",0
11,Nesaderīga un nelikumīgā valsts atbalsta atgūšana maksātnespējas procesā Latvijā,"In cases in which the unlawful State aid was paid, it must be recovered from recipient undertakings which are in financial difficulty or are insolvent, and it should be known that such difficulties do not affect the obligation to recover the aid. In order to fulfil its obligation to recover incompatible aid, a Member State may either recover the entirety of the amount of that aid from the recipient undertaking, together with interest, or if not, bring about a declaration of insolvency. The Member State is required, as the case may be, to bring about the winding-up of that company, to have its claim registered as one of that company’s liabilities or to take any other measure enabling the aid to be recovered. The recovery of unlawful aid found to be incompatible with the internal market is to be effected without delay and in accordance with the procedures under the national law of the Member State concerned, provided that they allow for the immediate and effective execution of the Commission’s decision. As to the temporal aspects of the recovery of the aid found to be unlawful and incompatible with the internal market, that delayed recovery, namely, after the period prescribed, cannot satisfy the requirements of the Treaty on European Union and the Treaty on the Functioning of the European Union.",0
12,Normatīvo aktu preventīvās konstitucionālās kontroles teorētiskie un praktiskie aspekti,"The theoretical part of the master's thesis analyses the concept of preventive constitutional control and its quintessential features, paying special attention to the analysis of the archetypical French constitutional control model. At the same time, the author has weighed upon the counter-arguments of the preventive constitutional control mentioned in the legal doctrine, looking for the most effective way for its implementation. The practical part deals with the manifestation and operation of the preventive constitutional control in Europe, attributing the best solutions to possible improvements of Latvia's constitutional control. The author's standpoint, contrary to the opinions expressed in the legal doctrine, is that a correctly implemented preventive constitutional control can serve as a successful solution for enhancing the legal certainty and the quality of regulatory enactments.",0
13,Tieslietu padomes nozīme tiesiskā valstī,"Council for the Judiciary in Latvia exists almost ten years, the aim of it is to represent the view of the judiciary and ensure the independence of the judiciary in a state of the rule of law while implementing separation of powers. The aim of this paper is to clarify the importance of the Council for the Judiciary as judicial self-government institution in a state of the rule of law. Within the framework of the paper, the author analyzes the significance of judiciary independence in a state of the rule of law and in system of separation of powers, compares different models of the councils for the judiciary in Europe and analyzes the efficiency of the Council for the Judiciary in Latvia by researching how legistator has taken into the consideration the opinion of the Council for the Judiciary about draft law regarding judicial development during the period from 2017 to 2019. As a result, the author concludes that changes are needed regarding the structure of the Council for the Judiciary, also judges, who are in this Council, should be partially exempted from their direct duties. The legislator is not obliged to follow the view of the Council for the Judiciary, the legislator can make political decisions, however a respectful and reasoned dialogue between the branches of powers is essential in order to ensure the public interest in a state of the rule of law.",0
14,Kriminālatbildība par neslavas celšanu,"The right to freedom of expression is considered to be one of the fundamental human rights. There may be situations where the right to freedom of expression comes into conflict with other fundamental human rights. In such cases, the legislator should provide for a legal framework capable of effectively and fairly resolving the conflict of fundamental rights. One such legal framework is provided in Article 157 of the Criminal Law of the Republic of Latvia, which provides for liability for defamation. As a result of rapid technological development, a wide range of tools are available today, which can be used to communicate and disseminate information. The diversity of tools for communication leads to the fact that defamation can be carried out in a wide variety of ways. The criminal law of Latvia contains uncertainties regarding the determination of criminal liability in cases where defamation takes place in mass media.   The point of thesis is to investigate the legal aspects of criminal liability in relation to defamation in the media  In order to achieve the objective pursued, it is necessary to investigate the legal aspects of the qualification of a defamation offence, to understand the content of the concept of “mass media”, to synthesize the information obtained and to identify problems relating to the qualification of a defamation in mass media.",0
15,Psiholoģiska rakstura terors darba vietā.,"Manifestations of psychological terror in the workplace are described as emotional violence and intimidation against an employee and related to violations of the principles of legal equality, non-discrimination, non-discrimination, personal dignity and honor, the right to work (without ensuring equal, fair and healthy working conditions) implemented or permitted by the employer. The research aims to analyze the psychological manifestations of terrorism in the workplace and the legal regulation of the prohibition of implementation in the legal system of the Republic of Latvia. The results of the research show that in the legal system of the Republic of Latvia, an employee is protected against psychological terror in the workplace by the Constitution of the Republic of Latvia, the Labour Law and other special laws. The regulation of labour relations from the aspect of protection of employee rights is formally complete, the legislator has established social norms aimed at protection of employee human rights, but no law (should be understood broadly) imposes an imperative prohibition on psychological terror against employees, average user rights reader) in a comprehensible and clear text, thus concluding that a clear decision of the legislator on the regulation of such issues is required.  Keywords: psychological terror, workplace, mobbing, bossing.  ",0
16,Reģistrētās partnerattiecības un to normatīvā regulējuma ieviešanas iespējas Latvijā.,"The Master's thesis is dedicated to the problem of unregistered cohabitation in Latvian legislation with the aim to identify the range of legal problems of cohabiting partners and to assess whether there is a necessity of additional protective mechanisms to ensure and protect the rights of partners. The aim of the thesis is to explore the possibility of introducing institution of cohabitation in Latvia, analyzing legislation of other countries, and to put forward proposals on how it is possible to arrange the legal framework at the national level. During the course of the work the author studied the history of the establishment of the cohabitation institution, performed a comparative analysis of unregistered partnerships and marriage, reviewing the legislation of other countries, and also considered the possibilities of introducing registered partnerships in the Latvian legal space. Key words: partnerships, cohabitation, unregistered cohabitation, de facto marriage, marriage institution, family.",0
17,Pret komercsabiedrībām vērsti noziedzīgi nodarījumi- tos veicinošie faktori un novēršana,"Crimes against businesses is a rarely researched topic, and the knowledge of factors that promotes them and how to prevent them is not rarely based on researches of crimes against individuals. In this research author identifies different types of crimes that can do harm to businesses, offers to divide them in “direct” and “in-direct” crimes, reviews the order and meaning of preventive and reactive measures, as well as do case-studies and identifies measures that could have prevented the crime from happening. Author identifies the potential impact of the lack of deep studies about this topic on states economy and nominates a thesis about three main factors that promotes such crimes.",0
18,Galveno interešu centra noteikšana pārrobežu maksātnespējas procedūrās - tiesu prakses analīze.,"Master's thesis “Identification of the center of main interests in cross-border insolvency proceedings - case law analysis” investigates the role of case law in insolvency proceedings where the Council regulation (EC) No 1346/2000 of 29 May 2000 on insolvency proceedings and Regulation (EU) 2015/848 of the European Parliament and of the Council of 20 May 2015 on insolvency proceedings applies. The paper investigates Latvian case law and case law of Court of Justice of the European Union. The aim of the research: to ascertain whether the Latvian case law coincide with the provisions of Regulation (EU) 2015/848 of the European Parliament and of the Council on Insolvency Proceedings and the current case law of the Court of Justice of the European Union. The tasks of the research: study the legal framework of cross-border insolvency proceedings, the Latvian case law and the case law of Court of Justice of the European Union, identify problems of identification of the center of main interests, problems of securing the rights of creditors. Results of the research: Concerning the identification of the center of main interests, the Latvian court case law differs, therefore there is no clear compliance with the provisions of Regulation (EU) 2015/848 of the European Parliament and of the Council on Insolvency Proceedings and the current case law of the Court of Justice of the European Union..  Research  sources: regulations and law of the European Union and the Republic of Latvia, case law, legal literature, in total 76 sources, extent of research 60 pages.",0
19,Apsūdzības grozīšana iztiesāšanā,"The charge covers a number of basic principles, aspects and elements of criminal procedure. One such aspect of charge in criminal proceedings is the regulation of the amendment of the charge, It must be acknowledged that during the trial, the institute of indictment provides a wide margin of discretion for the accused. which exists both in the pre-trial and trial process, practically speaking, such issues are mostly seen during the trial. Therefore, the aim of the work is to research issues related to the amendment of the charge  (mainly during a trial), to identify legal problems, as well as to offer proposals  for the legal regulation of the said institute. During the development of the work, the author focuses on the practical side of the problem, so that the research could be applied in practice.",0
20,Aizdomas par defektu kā preces neatbilstību CISG 35. panta izpratnē un pierādīšanas pienākuma pārnešana uz pārdevēju,"This master’s thesis deals with examination and analysis, firstly, of the grounds for declaring a goods non-conforming under Article 35 of the CISG, which manifests in suspicion of a defect, and secondly, with examination and analysis of the division of the burden of proof, focusing on shifting the burden of proof from the buyer to the seller. Despite the topicality of these legal matters in the context of modern market turnover, their complex research and analysis, especially with regard to their interconnection, have not received enough attention in both court judgements, although these legal institutes are used in practice, and legal doctrine.  Tasks of this paper encompassess study and assessment of the suspicion of a defect as non-conformity of goods withins the meaning of Article 35 of the CISG, and examination and assessment of the possibility and preconditions for shifting the burden of proof.  As a result of this paper, the author concluded that:  a)a suspicion of a defect can be rendered as non-conformity within the meaning of Article 35. of the CISG if two preconditions are met: 1) the suspicion is reasonable, and 2) it restricts the usability of goods according to their intended use by the buyer; b)the most rightful and efficient outcome of the shifting of burden of proof can be achieved through a three-step burden shifting approach.  Keywords: non-conformity of goods, Article 35 of the CISG, suspicion of a defective goods, standard of proof, burden of proof, shifting the burden of proof.",0
