id,title,abstract,is_generated
79,Atbildības par krāpšanu krimināltiesiski aspekti,"The theme of the master`s thesis is “Criminal aspects of the liability of fraud”. The problem that exists in practice is to delimit the composition of fraud from other pieces of property theft, for example appropriation and theft. The same problem is to delineate fraud from tax evasion. Although at first glance it may seem that it is not complicated, however a more detailed analysis of the composition features reveals difficulties. The Criminal Law of Latvia also secrete several special forms of fraud, which also have certain characteristics which distinguish one composition from another. The correct and complete understanding of the composition of fraud requires the identification of all essential elements of fraud. Then should be done in-depth research of them, because such kind of actions can be decisive for the correct qualification of the offense, which is the cornerstone of a fair criminal procedure. The objectives of thesis are to study and analyze the nature of fraud, taking into account the historical development of such institute, as well as to find possible solutions for correcting deficiencies. The objective of the work was to fulfil the following tasks: to look at the framework that was in effect in the territory of Latvia in the 20th century and to compare it with, what exists today and how the fraud is defined in the Criminal Law of Latvia and also viewed abroad, examine Court practices in this regard. There are offered several solutions to facilitate easier fraud separation from another related compositions.",0
80,Obiter dictum Satversmes tiesā - teorija un prakse,"Constitutional Court of the Republic of Latvia (hereafter - Constitutional Court), when settling disputes regarding the compliance of legal norms with the legal norms of higher legal force, in its judgments and decisions on terminating legal proceedings tend to provide additional evaluations on the necessity of improvement of the legal system, however, this aspect of the actions of the Constitutional Court has not been sufficiently highlighted and analyzed profoundly. The aim of the Master's thesis “Obiter dictum in Constitutional Cout of the Republic of Latvia – theory and practice” is to determine the content, characteristic features and influence of the obiter dictum, contained in the judgments and decisions on terminating legal proceedings of the Constitutional Court.  In order to achieve the aim, the author has set 6 (six) tasks: 1) to determine the limits of competence of the Constitutional Court and the legal force of its judgment, as well as the decision on termination of legal proceedings; 2) to charectarize specifics of the concepts of the ratio decidendi and the obiter dictum; 3) to inspect the obiter dictum expressed by the Constitutional Court in the context of the principle of separation of power; 4) to analyze the obiter dictum considerations contained in the Constitutional Court judgments and decisions on terminating legal proceedings; 5) to consider the actions of the Saeima and the Cabinet of Ministers regarding the obiter dictum statements of the Constitutional Court; 6) to compile and analyze statistical data on the obiter dictum of the Constitutional Court. As a result of the elaboration of the Master's thesis the author, based on the extensive analysis of the obiter dictum considerations included in the judgments of the Constitutional Court and the decisions on terminating legal proceedings, has provided conclusions on the content, ability to influence and characteristic features of the obiter dictum. Keywords: Constitutional Court of the Republic of Latvia, obiter dictum, ratio decidendi, judgment, decisions on terminating legal proceedings.",0
81,Pašvaldības domes deputāta tiesību aizsardzības līdzekļi,"The aim of the Master thesis is to clarify the legal status of a member of the local government council and the possibilities for protecting their subjective rights if, in exercising the powers of the Member, the rights of the Member are infringed. The relevant issue has not been studied in the legal literature until now, but it is confirmed by both the Constitutional and Administrative Courts' practice. In the process of drawing up work, the author concluded that a Member of the municipal council has in some cases subjective public rights, the protection of which is possible in the administrative courts. However, a Member of the municipal council does not have a mechanism for the protection of rights in any situation in which it is confronted with subjective discontent over the work of the local government and its institutions.",0
82,Personu tiesību īstenošana un ierobežošana vārdu un uzvārdu izvēlē,"This thesis examines the collisions, restrictions, aims, necessity and proportionality of naming, changing and transcription of names, surnames of persons. The problematic aspect is the proportionality of the exercise of the rights of individuals and the public interest.     The tasks of the thesis are to identify and evaluate the relevant legal norms in Republic of Latvia and international law, to summarize and analyze case law in limiting the respective rights in order to reach the goal of concluding how the public interest prevails over the individual rights.     The paper draws conclusions on how the public interest is aligned with the rights of individuals, and recognizes that the assessment of national courts may be called into question by the international court if the assessment made by the national court is manifestly arbitrary, there are errors in the exercise of discretion. The work concludes, among other things, that the state has not effectively implemented the duty to protect a person's personality, and it is recognized that it is not necessary to establish restrictions on the choice of name in regulatory enactments. In addition, the paper acknowledged an error by the court that could have led to a misjudgment of the case.",0
83,Saistību dzēšana kā jauna sākuma garants fiziskās personas maksātnespējas gadījumā.,"The Master's thesis is devoted to the study and analysis of theoretical and practical aspects of debt discharge in both Latvian and foreign regulatory frameworks, while assessing the possibility for a debtor to obtain a fresh economic start through debt discharge. The debt discharge as the final result of an insolvency proceeding of a natural person affects the future lives of many debtors, however, the author criticized in the study the assertion that the debt discharge guarantees the debtor a fresh start in the broadest sense of this term. Within the framework of the study it was found that debt discharge is only one element of the fresh start concept, and in order to gain a more complete understanding and implementation of this concept it is necessary to focus on other elements as well, including the situation after insolvency process. In addition, the debtor's chances of debt discharge and ability to gain a fresh start are limited due to the inconsistent case law that has been identified as a result of the analysis of case law during the study.",0
84,Kriminālprocesa obligātuma princips,"Every criminal procedure starts with the adoption of a decision on the initiation of criminal procedure. The procedure for the initiation of criminal proceeding is based on the legality principle, which provides an obligation for the officials to initiate criminal proceeding in each case when a criminal offence has been committed.  Currently the Saeima is considering October 10, 2019 draft law No. 427/Lp13 “Amendments to the Criminal Procedure law”, which provides to phase opportunity principle in some provisions of the Criminal Procedure law.  In the master’s thesis are being analyzed the topicalities of the application of the legality principle, including the above amendments. The purpose of the master’s thesis is to clarify the role of the legality principle in criminal procedure and explore the problems in practice with the application of the legality principle.  As a result, author makes conclusions and proposals for the improvement of the existing practice. Keywords: criminal procedure, legality principle, initiation of criminal procedure, opportunity principle, termination of criminal procedure, refusal to initiate criminal procedure, victim.",0
85,Noziedzīgi iegūtu līdzekļu legalizācijas pierādīšana,"Money laundering is a criminal offense that has been deep-rooted in history, however, over the last twenty years it has drawn increased attention both on national and international levels changing the conception and altering established fundamental findings in substantive and procedural law. Considering the recently made controversial amendments, this Master’s thesis aims to investigate the process of proving money laundering, searching for the reasons of opinion collision and offering solutions. Key aspects of proving money laundering are successively outlined and analysed, whilst accentuating the identified pre-existing issues and suggesting possible resolutions that are based on case law analysis and doctrine. The results, which are summarized in the form of theses, are aimed to strengthen the formation of common comprehension of the money laundering in Latvia and its questions of proof.",0
86,Instrumenti sabiedrības ietekmei uz likumdevēju tiesiskā demokrātiskā valstī,"The topic of the master's thesis is “Instruments for public influence on the legislation in a legitimate democratic state”. In order for a society to be able to create a country in which it would like to live, it is important for the society to be aware of its possibilities and available tools for influencing the legislator. The aim of the work is to find out what society is in the context of legislation, its existing instruments and their manifestations on the legislator in a democratic state, their effectiveness and consequences, as well as to analyze how long and which societies groups managed to realize its will. The tasks are to analyze the essence of a democratic state governed by the rule of law, the structure and functions of the legislature, to define the concept of society in the legislative context, to summarize the tools of influencing the legislator, to determine their effectiveness and consequences, as well as the society exercised their will. The results of the work indicate that the society in the context of legislation is the interest groups of active units of society, which, by using various instruments, try to achieve the observance of their interests in the legislative process. In summarizing the tools by which the public can influence the legislature, the author singled out mechanisms such as the election and removal of representatives in the legislature, referendums, the right of legislative initiative, collective submission, participation of non-governmental organizations in the legislative process, meetings, marches and pickets, media and social networks. On the example of the case considered in the work, the author concluded that the society can change the existing procedure within two years through the use of various tools. The volume of the master's thesis is 80 pages.",0
87,Kriminālatbildība par personas atstāšanu bez palīdzības,"The subject of the Master’s Thesis is „Criminal liability for abandoning a person without assistance”.  Undeniably most important value to human is life, but nowadays, because of continuous flow of information and our everyday life, that we spend in a hurry, we tend to forget about it. People ar so busy with themselves, that they tend to overlook, what is happening around them, that somebody is in a need for help, but we just pass by. There is no room for such indifference in nowaday's society, therefore legislator has provided criminal liability for not providing assistence to a fellow man. The aim of this Master’s Thesis is to carry out an in-depth study of the content and the legal framework of the criminal liability for abandonment without assistence, and its application in judicial practice. In order to achieve the aim of the Master’s Thesis it is necessary to find out, how the criminal liability for abandonment without assistence has evolved over time and how its content has changed over the years, what is the current legal framewor of criminal liability for abandoning a person without assistance in Latvia and how abandonment without assistence is  qualified in various situations. Finally, it is necessary to identify common and different aspects  between Latvian legal framework and foreign legal frameworks. As a result of the research, the author of the Master’s Thesis came to a conclusion, that there has emerged a situation, when one type of criminal offence for leaving the scene of a road accident, without providing assistance to the victim, is qualified differently.",0
88,Disciplinārsodu piemērošanas prakse un tās saistība ar resocializāciju,"Recently, the re-socialization of prisoners has been increasingly studied, neglecting the issue of disciplinary sanctions against prisoners, which is equally important, among other things, because discipline is one of the factors influencing re-socialization. The aim of the work is to find out the practice of disciplinary sanctions and its peculiarities in prisons, to analyze the observance of the basic rules of the penitentiary regime and other obligations imposed on prisoners, and to assess violations and penalties imposed on them. To achieve this goal, it is necessary to analyze the historical development of the classification of prisons and prisoners, to study and analyze the violations committed by prisoners in prisons and the disciplinary sanctions applied to them, and analyze the re-socialization of prisoners and it’s relation with discipline.",0
89,Negodīgi līgumu noteikumi līgumos ar patērētājiem.,"Problem: Large ammendments in the Consumer rights protection law have been made, that are significantly enforcing consumer rights protection, and therefore creates the need to explore them more in depth. Additionally, the current legal literature is lacking extensive analysis of unfair contract terms in consumer contracts, unfair contract term types and the current newest court practice and the conditions of consumer rights protection.  Task: Percise the term „consumer”, make conclusions regarding types of unfair contract terms, the conditions of consumer right execution relating to unfair terms in consumer contracts, by analyzing legal literature resources, normative acts and court rulings in consumer rights protection field, as well as by viewing the newest Consumer rights protection law terms. Aim: Evaluate the efficiency of the newest Consumer right protection law terms and develop suggestions for their interpretation and application, and precise the therm „consumer”. View the concept of consumer and consumer contracts, types and signs of unfair terms in consumer contracts, look at the terms contrary to legal equality and undiscussed unjust contract terms in court practice and legal literature, determine conditions of consumer right protection execution in practice regarding the unfair contract terms.",0
90,Ģenerālklauzulas izpratne un praeter legem metode,"There is no common understanding in legal doctrine on whether the praeter legem method of concretizing general clauses belongs to the legal method of interpretation or further development of law. This master’s thesis “Meaning of Open Ended Terms and Praeter Legem Method” studies the nature of this method and concludes that it is a form of further development of law. The decisive argument for this classification is the delegation of concretizing from the legislator to the law applicator. The point of gravity of this method is the formulation of a third premise in the scheme of legal syllogism. Such intellectual activity possesses an element of value or axiology judgement, which is also characteristic of the extra legem method of analogy of law. In view of this, it is clarified and proved that the praeter legem method of concretization is not an analogy of law.",0
91,Cilvēku audu un orgānu nelikumīgas izņemšanas regulējums,"The topicality and problems of the master's thesis “Regulation of illegal removal of human tissues and organs” are related to the rapid development of science and medicine in the world, which has created new social, legal and bioethical issues that must be solved by both medicine and law. Considering that the regulatory framework for the removal and transplantation of human tissues and organs has historically not existed, the aim of the study is to study the development of this regulatory framework both in Latvia and in other countries, paying special attention to how detailed the legislator lists provided for penalties for violations of permitted activities. As a result of the performed scientific research, conclusions have been made regarding the current legal regulation of the removal of human tissues and organs, comparing the legislation of Latvia with the legislation of the European Union and other countries.",0
92,Reliģisko svētku statuss Latvijā,"The Master’s Paper “The Status of Religious Holidays in Latvia” examines issues related to the Legal framewor for public holidays in conformity with the requirements of regulatory acts in Latvia. The aim of the Paper is to assess the current regulation on publicē holidays, remembrance days and observance days. To achieve this aim it is necessary to analyse the legal framework for public holidays within the period starting from the First Independence up to the present times as well as to compare the effective regulation on public holidays in other countries. The obtained results of the research allow for a better understanding and through analysis to possibvle amendments to the Law on Holidays, Remembrance Days and Observance Days. The subject is of high topicality at the moment as the bill on recognising the 7th of January, which is Orthodox Christmas, as a public holiday has been brought before the Saeima (the Parliament of Latvia) since 1990s. The Master Paper consists of three chapters with subchapters. Chapter 1 examines the historical and effective Legal framework for the publicē holidays. Chapter 2 explores religions aspects of the public holidays. Chapter 3 provides an overview of the issues brought forward by the previous Saeimas when debating the bill in question. The final part of the Paper contains conclusions and suggestions regarding necessary amendments to the legal norms in order to ensure a more balanced and relevant regulation on public holidays in Latvia.",0
93,"Pierādīšanas pienākuma īpatnības darba strīdos, kas izriet no darba tiesiskajām attiecībām.","The topic of the master’s thesis is „Peculiarities of the burden of proof in employment disputes arising from employment relationships”. The thesis is devoted to peculiarities of the burden of proof in labor disputes, which arise from labor relationships between employers and employees. Considering fact, that as more and more often labor disputes are resolved in courts, a living issue becomes, what kind of proofs needs to be submitted and which facts are evaluated in court.  Analyzing peculiarities properties of the burden of proof in labor disputes, there is necessity to point out on it’s ambiguous regulation, which might in many cases deceive the employee as a plaintiff or as a defendant in court. The master’s thesis consists of 4 chapters. In the first chapter labor dispute concepts and types as well as principles of labor dispute settlement are reviewed. In the second chapter the author examines preconditions for lodging an application on labor disputes in court as well as questions related to this subject, such as deadlines for lodging an application, renewal of missed application lodging date and finally lodging application to court. In the third chapter the author focuses on important institute in civil proceedings – the burden of proof in labor disputes. The adversial principle and the reversed burden of proof principles are analyzed, it is clarified in which cases, which of the sides of the dispute has to bear the burden of proof. In the fourth chapter the author compares individual labor dispute settlement procedure in Latvia and in foreign countries. The summary of the thesis contains the most important theses, conclusions drawn from the content of the thesis, as well as the proposals for amendments to the regulatory enactments. Keywords: labor disputes, labor legal relationships, the peculiarities of evidence, court.",0
94,Valsts sociālās apdrošināšanas pabalsts – tiesības uz pabalstu un tā apmērs,"By means of the state social insurance system, a person is guaranteed a definite repla-cement of income in the event of any of the social risk cases specified by the law. At the same time, the state is given a wide margin of discretion in the design of this system, enabling it to decide what benefits a person is entitled to claim and to receive, as well as the conditions for granting benefits and the procedure for calculating the amount of benefit. Research  is based on the current legislation research and analysis in the field of state social insurance, revealing it impact on the right to benefit and its amount. In this way, it has been identified the main problems of the state social insurance system. In the research, the author also conducts comparative research on regulation in other European countries and offers solutions for improving Latvian regulation.",0
95,Tiesības uz nāvi,"The author of the Master paper “The right to death” studies the practice of the rights to die in the legal system of Latvia, historical development and modern understanding of previously mentioned rights. The paper deals with forms of suicide and euthanasia, the separation of these terms and their interaction. The aim of the study is to ascertain if existing regulation regarding the rights to death is appropriate for today’s understanding and needs. In view of the rapid development of life extensions, voluntary cessation of persons life should be explored. Keywords: the right to death; the right to life; euthanasia; suicide.",0
96,Vienota tiesiska regulējuma normu nepieciešamība kapsētu uzturēšanas un apbedīšanas jomā,"The bachelor's thesis is ""The need for a unified legal regulation in the field of maintenance and burial of cemeteries"". The aim of the work is to investigate whether a unified regulation in the field of burial is necessary, or whether the existing regulatory framework is sufficient. The main problems and shortcomings of Latvian cemeteries are studied and identified in the work. Identify the problems of the existing regulation. The author has analyzed literature sources, regulatory enactments, legal literature and court findings expressed in court judgments. The work consists of four chapters and three subsections. The first chapter describes the burial of the dead in accordance with regulatory enactments. The second chapter analyzes the regulatory framework and the actions of local governments in allocating a new grave site. The third chapter describes the experience of European countries. The fourth chapter evaluates the interpretations of the judgment of the Constitutional Court and the consequences thereof.",0
97,Ģimenes izpratne mūsdienās konstitucionālajās tiesībās,"Thesis topic: Concept of Family in constitutional law nowadays. Latvian legislation contains a barrow definition of the concept of family, which is found in the Civil law. The Constitution of Latvia stipulates that the state has a duty to protect the family, but it does not explain what is meant by the term “family”. Objective of the thesis is to explore how this concept is used, what it means and what rights and responsibilities it confers. The paper examines family models, which are known in Latvia and in Europe, also court practice related to them and expresses an opinion on the possible development of legal acts to regulate different family models, not only marriage. At the end of research the author draws conclusions and proposes how to improve legislation for it to protect as many families as possible. Thesis consists of 4 chapters and 62 pages.  Keywords: family, household, cohabitation, The Constitution of Latvia, partnership, marriage.",0
98,Garīgās veselības tiesību aizsardzības īstenošana Latvijā,"Bachelor’s thesis looks at mental health protection rights in the context of rights to health. The aim of the paper is to research how mental health protection is regulated according to law in Latvia, determine the state obligations regarding the protection of individual’s mental health, as well as to investigate the legal aspects concerning health education, workplace bullying, sexual harassment and compensation for mental health harm. The outcome of the research is recommendations for improving the implementation of mental health protection rights as well as for distinction between mental health harm and other types of non-material damages.",0
