id,title,abstract,is_generated
42,Dominējoša stāvokļa ļaunprātīga izmantošana informāciju tehnoloģiju jomā ES un ASV tiesībās,"The title of this Master thesis is “Abuse of dominant position in the information technology field in EU and US legal framework”.  Master thesis gives an insight in the theoretical application of the Article 102 of TFEU as well as the case law of CJEU in regard to abuse of dominance in the IT sector. Additionally, most substantial differences between the EU and US approach to competition policy are identified during this thesis. IT industry is one of the most leading industries in the current economy with a high possibility of creating new markers. Hence why the potential of dominance and the abuse of it is high. IT industry has a high degree of innovation hence why the antitrust policy must advance accordingly and take the nature of this industry into account.  During this Master thesis specific forms of abuse will be analyzed within the confines of IT industry. Focus will be given to the latest EC and CJEU decisions, especially to Google’s Android case since it is the latest decision pertaining to the IT industry and is available  to the general public.  In addition, characteristics of the IT industry will be identified, as well as problems which arise from these characteristics. Lastly, the latest tendencies in antitrust cases will be identified.   Keywords: two-sided markets, multi-homing, per se and form-based approach, dominant position, indirect network effects.",0
43,Ārvalsts tiesas un ārpustiesas dokumentu izsniegšana Latvijā.,"The master's thesis is dedicated to exploring the delivery of documents, with particular attention to situations where the parties are located in different countries and documents are required in a country where court proceedings are not taking place. The thesis examines and analyses document delivery types and their specificities. In the course of the study, the author examines the importance of civil procedural cooperation in the process of delivering and issuing of documents, as well as the role of document delivery and issuance in court proceedings. In addition, the author, in the course of the thesis, has analysed statistics for document delivery in Latvia, attempting to find practical recommendations in order to improve the quality of this process. Key words: delivery of documents, international civil procedural cooperation, legal proceedings, legitimate interests.",0
44,Valsts loma personas socializācijā izglītības regulējuma kontekstā,"Socialization is a process that happens throughout individual’s life, but the most important stage in socialization is right from childhood to adolescence, when a lot of time is spent in educational institutions. Nowadays, when the role of the family in the socialization of the child is decreasing and online communication is growing, the role of educational institutions as a socialization agent for the success of the individual in a given society is increasing. Consequently, the role of the State in the socialization of the person is also growing through the adoption of a regulatory framework in the field of education, through which a harmonious personality, who feels the sense of belonging to the state and is able to live in particular society, can be formed and developed. The aim of this work is to explore the effectiveness of the regulatory framework in Republic of Latvia in the context of personal socialization by looking at the Education Law and its development over the last five years. The study has shown that the aim of the right to education is not only to master curriculum, but also the development of individual’s personality, acquiring skills that allow them to live in a particular society. Education legislation has a decisive influence on the way the national identity and the democratic legacy are transferred to the new generation. Thus, the pre-legislative analysis of the regulatory framework for education plays a particularly important role.",0
45,Prokurora priekšraksts par sodu,"The subject of the Master's paper is ,,Prosecutor's prescription for punishment” which examines prosecutor's prescription for punishment as simplified form of criminal proceedings, model of out-of-court criminal justice solution and as one of the ways of completing the pre-trial process. The aim of the Master's paper is to investigate the admissibility of the application to the prosecutor's prescription for punishment, procedural arrangements, legal preconditions for this simplified form of criminal proceedings to be applied, as well as the legal consequences of its failure to comply. The author studies not only the prosecutor's prescription for punishment in Latvia, but also studies regulatory framework for the Republic of Lithuania and the Republic of Estonia regarding this simplified form of criminal proceedings in order to better draw conclusions about possible deficiencies on the Latvian regulatory with regard the form of completion of the pre-trial process.",0
46,Mākslīgā intelekta regulējums tiesībās,"The subject of the Master thesis is “Legal regulation of artificial intelligence”. The aim of the thesis is to explore the historical development of artificial intelligence and legal challenges that thus arise. Technologies of artificial intelligence operates with a large amount of data (big data), the use of which is rarely justified with legitimate aim, not to mention evaluation of proportionality. Such situations create potential threats to the individual’s interests and freedoms. In order to achieve the aim of the Master thesis, following tasks have been identified: 1. Research historical development of artificial intelligence and the basics of its operation; 2. Analyze term of Big data; 3. Get to know how and if artificial intelligence is used in the justice system; 4. Summarize collected information and make proposals regarding the need of a legal framework. In a result of the thesis, the author concludes that the legal framework for artificial intelligence should be both in international and national level. There is no need for the creation of a specific category of legal subject yet, since artificial intelligence is a technology and subject for legal framework should be use of it. Artificial intelligence has made an impact on the values of society and has an impact on every area of life, therefore discussions on the introduction of specialised courts or judges that could judge arguments in the area of technology are required.",0
47,Plaši pazīstamas preču zīmes un preču zīmes ar reputāciju.,"Neither the Law on Trade Marks, nor Directive (EU) 2015/2436 of the European Parliament and of the Council of 16 December 2015 to approximate the laws of the Member States relating to trade marks define what a well known trade mark and a trade mark with reputation is. Provisions stipulating protection of these marks contain special conditions for application thereof. Interpretation of the condition included in the provisions relating to protection of well known trade marks and trade marks with reputation is based on insights gained by practice of the Court of Justice of the European Union. The goal of the paper is to distinguish between conditions applicable in each case and correct interpretation of these conditions. The objectives of research are to study the functions and role of trade marks in the market economy; to study the general regulations in relation to trade marks; to research interpretation of protection preconditions of well known trade marks and trade marks with reputation, at the same time viewing practical examples. Conditions intended for the protection of well known trade marks and trade marks with reputation may overlap; however, these should be explained and interpreted very carefully to avoid an erroneous result in the collision of trade marks. Moreover, market conditions where the particular goods or services are located are very important, as well as the degree of attention of the relevant consumer.  Key words: trade marks; well known trade marks; trade marks with reputation; protection of trade marks",0
48,Apsūdzība un tās tiesiskā nozīme kriminālprocesā,"The topic of the Master's thesis is ""Prosecution and its legal significance in criminal proceedings"". The aim of the work is to identify problems and suggest possible solutions by analysing the existing quotes on prosecution in legal sources. The tasks of the Master's thesis are: to define the concept of prosecution, to analyse the standards of prosecution, to find out the impact of the boundaries of prosecution, to study cases when the prosecution needs to be amended, to analyse cases of incorrect prosecution, to investigate the obligation to refuse prosecution, to analyse the court's obligation to acquit persons. In the work the content and standards of the prosecution are analysed, the issues of amending the prosecution and the impact of its boundaries on the court are studied, the consequences of incorrect prosecution are analysed, the issue of the court's right to establish factual circumstances different from the prosecution is studied.",0
49,"Cilvēktiesību ierobežošanas problēmas kriminālprocesā, piemērojot ar brīvības atņemšanu saistītus drošības līdzekļus","The subject of the master's work is ""The issue of limiting human rights in the criminal procedures, with the application of the preventive measures related to deprivation of the freedom."" Preventive measures related to deprivation of freedom deprive the suspect or accused of one of the main human rights - the right to freedom. In order to deprive a person of the right to freedom, this decision must be not only legal, but also reasonable from the legal point of view, which includes validity and proportionality. To determine whether the deprivation of freedom was lawful usually does not cause difficulties; in turn, to determine whether the deprivation of freedom was reasonable and proportionate causes difficulties both in theory and in practice. While legal doctrine discusses the nature and significance of preventive measures related to deprivation of liberty, the European Court of Human Rights considers fundamental questions about the validity and proportionality of deprivation of liberty related to preventive measures, as well as about other problems that these measures entail suppression. The purpose of this work is, firstly, to understand exactly what problems exist in legal regulation, applying preventive measures related to deprivation of liberty, secondly, to find a possible solution to these problems, thirdly, to understand in which cases a person can be deprived of freedom, and determine what is the meaning of the criminal process principles in this context. As a result of the study, the author of the work made conclusions and put forward her assumptions on this issue.",0
50,Kultūras pieminekļu tiesiskā aizsardzība,"Proceedings regarding criminally acquired property are specified in Section 59 of the Criminal Procedure Law and provides the possibility to deal with property issues in criminal proceedings in a timely manner, i.e. to decide whether the property is criminally acquired in pre-trial criminal proceedings and also when terminating criminal proceedings for reasons other than exoneration of a person. The aim of Master thesis is to clarify the understanding of the criminally acquired property, to research the criminal-legal regulation of the proceedings regarding criminally acquired property, court decisions taken in the proceedings regarding criminally acquired property, identifying problems and offering possible solutions. The task of Mater thesis is to find out reasons for initiating proceedings regarding criminally acquired property and the procedure of this process, to analyse weather the decisions taken in the proceedings regarding criminally acquired property comply to legal regulations, and to find out the rights and duties of persons involved in the proceedings regarding criminally acquired property and how they could be applied.  The author of this work concludes that it shall be necessary to improve the legal regulation in order to ensure the full protection of rights of third parties.  Keywords: criminally acquired property, proceedings regarding criminally acquired property, predicative criminal offence, presumed criminally acquired property, proven criminally acquired property.",0
51,Process par noziedzīgi iegūtu mantu,"Employment is an area where personal data is processed for half of the Latvian population. The right to data protection is a fundamental right of every human being in the European Union. Therefore, adequate safeguards should be put in place to protect this right. The purpose of the study is to evaluate the protection of personal data in employment in Latvia. The main tasks of the research are to understand the content and problems of personal data processing in employment and to propose solutions to these problems. As a result, the author has conducted a study which, based on theory and case law, has identified how personal data processing in employment should be properly conducted, identified problems, and made suggestions for solutions.",0
52,Fizisko personu datu aizsardzība nodarbinātībā,"The Master thesis ""Guarantees of independence of a judge of Constitutional Court and topical aspects of their implementation"" draws attention to the role of the independence of a judge in a democratic state and the judges of the Constitutional Court as subjects of the judicial independence, as well as provides insight into the guarantees of independence of the judges of the Constitutional Court compared to foreign regulation and practice. The thesis consists of three chapters, giving first and foremost an insight into the understanding of the institute of the independence of the judge, followed by the characterization of the institute of independence of the judge as a part of the right to a fair trial, whereas the third section of the Master thesis provides an analysis of the guarantees of independence of the Constitutional Court judges, their expression and compliance with foreign regulation. The author provides not only an insight into the content of the guarantees of independence of the judges of the Constitutional Court, but also analyses problematic aspects of the existing legal framework, as well as gives recommendations for improving the legal framework, considering foreign experience. Keywords: independence of judges, recruitment guarantees, guarantees while in office, financial security, social guarantees, immunity, suspension of powers, termination of powers.  ",0
53,Satversmes tiesas tiesneša neatkarības garantijas un to īstenošanas aktuālie aspekti,"Present Thesis studies relevant issues connected with municipal waste management in the context of municipality competences. For this purpose, the Thesis researches currently applicable Latvian and European Union legislation as well as case law. The Thesis also studies Latvian competition law, focusing on competition neutrality, obligations of ensuring free and fair competition borne by direct and indirect authorities and capital companies in which a public person has a decisive influence. In this regard, the Thesis analyses decisions taken by municipalities and agreements about transferring waste management rights concluded between municipalities and capital companies. In present Thesis, the author primarily examined problems related to waste management regulation as well as the interrelationship between waste management and competition laws. Within the framework of this Thesis, the author does not address the subject of waste shipping or waste transportation on national and international levels. Application of stringent waste management requirements and municipality involvement in the waste management market has a direct impact on residents’ possibilities to receive the best offer from service providers. In light of modern trends and tendencies, the relevancy of mentioned questions will grow.  As the result of the Thesis, the author has identified gaps in domestic normative regulation and has developed recommendations for law amendments and additions, which can help to prevent the impact of stated problems on waste management process. In addition to recommendations about law amendments, the author has introduced new and valuable theoretical theses.",0
54,Sadzīves atkritumu apsaimniekošanas tiesiskās problēmas.,"Agate Patrīcija Grīna. Master's thesis on the independence of the judiciary, separation of powers. Advisor: Dr.iur., Prof. Sanita Osipova, Riga, 2020th. The aim of this thesis is to analyze the independence of the judiciary by looking at the problems of its relationship with the legislature and the executive. It also addresses judicial independence in Lithuania, Estonia and Poland.  The author concludes that the extension of the powers of the Council for the Judiciary is essential to strengthen the independence of the judiciary, but in order to give the Council for the Judiciary greater powers in matters affecting the judiciary, such as the career development of judges, the Council for the Judiciary should be composed only of members of judiciary. The thesis consists of 3 chapters, 6 subsections, an introduction, a summary and a list of references. It is based on a work of John Locke, Charles Louis de Montesquieu and others.  Keywords: separation of powers, judiciary, legislature, executive, Council for the Judiciary, independence of the judiciary.",0
55,"Tiesas neatkarība, varas dalīšanas diskurss","The aim of the Master’s thesis “Authorisation of investigating judge regarding application of security measures” is to research the full scope of powers and authorisation given to investigating judge regarding application of security measures in criminal proceedings, as well as to identify current issues in legal framework concerning powers and authorisation of investigating judge. As well as providing a possible solutions to those issues discovered. To achieve this aim, author have researched the definiton and status of investigating judge, necessity of human right control mechanisms in criminal proceedings. The main focus of this research is geared towards powers and authorisation of investigating judge regarding application of security measures. As well as analysis of legal decesions of investigating judge regarding application of security measures. During this research the Author, have come to the conclussion that Latvian Criminal procedure law contains shortcomings and issues regarding application of security measures and investigating judge’s power and authorisation regarding this topic. Variety of proposals are made regarding issues in legal framework concerning powers and authorisation ofm investigating jude.",0
56,Izmeklēšanas tiesneša pilnvaras drošības līdzekļu piemērošanā,"The topic of Master thesis “Property usage right restrictions of surface water body protection zones”, is relevant due to the society members increasing trend to develop construction intentions close to surface water body without estimating the construction impact on the specific water body as a whole, which results in endangering the water ecosystem and environment. The thesis explore the concept of surface water body protection zone and its genesis, the property usage rights restriction prerequisites, the area planning and construction peculiarities within the surface water body protection zones. As a result of the study it is concluded that there are existing problems with the methodology defining the surface water body protection zone, an inapropriate use of area planning tools, arbitrary and new construction within surface water body protection zones.",0
57,Īpašuma lietošanas tiesību aprobežojumi virszemes ūdensobjektu aizsragjoslās.,"The theme of the Master’s thesis is “Well known facts and procedural presumption in civil proceedings”. Well-known facts and the presumption of civil procedure is one of the least restricted possibilities for a court to release persons from the burden of proof by derogating from the most important component of civil procedure, see the case on an adversarial basis. The author chose to study the topic of the master's thesis in a narrower discourse, namely, in the field of Labour Law. The research was carried out mainly by looking at the meaning of the concept in civil proceedings in general and then in connection with the chosen areas of civil law. In the study, the author is aware of the legal nature of the burden of proof and the burden of proof in relation to the exceptions to the burden of proof set out in Article 96 of the Civil Procedure Law, will study the essence of the general concepts of civil procedural presumptions and well-known facts, as well as will analyse the mentioned concepts in the area of Labour Law, identifying examples recognized in case law and their impact on the burden of proof. The work consists of 4 chapters, 17 sub-chapters, introduction and summary",0
58,Vispārzināmi fakti un procesuālā prezumpcija civilprocesā.,"The theme of Master’s thesis is “Facts from which persons have been exempted from proving in criminal proceedings”, the aim of the master’s thesis is to explore the regulatory framework, doctrine and case law in Latvia and abroad, thereby by providing an overwiev of the uncertainties of proof and the understanding of proof and legal  pre-sumption in Criminal proceedings. At the same time, the author shall clarify the effectiveness of the application of legal proposals and the need for criminal proceedings to be compared to other legal sectors.  In order to achieve the aim of the master’s thesis, the author of this thesis has made a number of contributions, including examining the institute of legal presumption in Latvia, taking into account foreign mayors, for example, with little insight into the rights of the Russian Federations, the Netherlands, France, to make comparisons of legal presumptions in the institute’s criminal proceedings with administrative process and civil proceedings of the institute of criminal proceedings, existing problems within the fra-meworkof the institute of legal presumptions, as well as proposals for a more effective understanding of the legal presumption and the limits of its application.  The master’s thesis is based on the regulatory framework, case-law in the Repub-lic of Latvia, as well as example of foreign countries.   Keywords: Criminal proceedings, legal presumption, presumption of innocence, legal presumption of fact, proof",0
59,"Fakti, no kuru pierādīšanas personas ir atbrīvotas kriminālprocesā","In the theory and practice of the civil process a very significant importance has the electronic document as an evidence in writing, as evidence is a constituent part of any civil process without which the civil process is not possible, and, due to the development of modern technologies, the court is submitted diverse electronic documents as written evidence in a case. Owing to the rapid development of modern technologies and global changes introduced through them, the civil process shall not ignore these changes, and therefore in the civil process the matter of electronic evidence and electronic documents has to be regulated in a sufficient amount. The aim of the Master paper is to clarify the nature of the electronic document and requirements set to it so that it can be used in the court as written evidence. The electronic document has become a constituent part of the law, and therefore it is necessary to find out whether the civil process regulation is sufficient for the electronic document, as well to offer possible options for a more complete regulation of the electronic document. The tasks of the Master paper are to analyse the concepts and characteristics of the evidence, document, electronic evidence and electronic document, looking into the findings of the legal literature published in Latvia and foreign countries, as well the legal practice in Latvia. As the results of the research study, the nature of the electronic document and requirements to be set to it, enabling it to be written evidence in the court, were clarified. The author concludes that the civil process regulation for the electronic document and electronic evidence is not sufficient, but generalised that complicates the court work and therefore a more detailed regulation for the electronic evidence and electronic documents should be introduced.   Key words: evidence, document, written evidence, means of giving evidence, electronic evidence, electronic document, principle of competition, truth.",0
