id,title,abstract,is_generated
100,Ārzemju studentu labizjūta Latvijas augstākās izglītības iestādēs,"Students’ well-being and life satisfaction have been one of the important trends in research and practice over the last decades. Often students, who come to study to another country encounter a number of challenges in the process of integration. Within the framework of the current research international students’ subjective well-being was explored, as well as the problems they encounter within the integration in Latvian higher education institutions (HEIs) were analyzed.  The aim of the Master’s Paper was to explore well-being of international students in Latvian HEIs in order to foster their integration in the specific environment of the host country.  The chosen method of research was narrative analysis carried out during nine weeks in Business Higher School Turība and online. To conduct the research, the following data collection methods were used: in-depth interview, questionnaire, and narrative interview. The author of the Master’s Paper interviewed nine international students enrolled in higher education programmes at the Business Higher School Turība and the University of Latvia (UL) to explore their level of subjective well-being. Based on the data, the conclusion was drawn that the majority of the respondents demonstrated relatively high level of subjective well-being.  In the framework of the next research stage, the questionnaire to international students was carried out in order to validate the collected data. The aim of the questionnaire was to measure the extent of international students’ subjective well-being. Altogether 25 international students responded to the questionnaire. The results obtained in the research framework confirmed that the majority of the respondents demonstrated rather high levels of well-being.  Finally, the narrative interview with educators was conducted. The aim of the narrative interview was to explore educators’ opinions on higher education internationalization, and how the process of higher education internationalization can influence educators’ professional life.  The main conclusions of the Master’s Paper are as follows: international students, who came to Latvia in order to study have high level of subjective well-being.",0
101,"Atbalsts augstākajā izglītībā studentiem ar mācīšanās traucējumiem Latvijā, Somijā, Vācijā un Kanādā","This research has been focused on support systems for persons with learning disabilities in Latvia, Finland, Germany and Canada. The study revealed that Latvia’s normative acts do not grant any support for these students while other of the countries define support measures differently. Students were interviewed to find out how these support systems work in practice. From them it was concluded that the most thoughtful support is in Finland and Canada. Students in Germany have not used much support so the efficiency of the system cannot be judged. Reasons were studied for students choosing to reveal to the university about their disability. Study concluded that support in previous education levels is important to develop learning strategies and become competitive as well as that learning disabilities affect person’s view of themselves.",0
102,Tehnoloģiju bagātināta aktīvā mācīšanās matemātikā,"On 1 September 2020, new minimum content of general secondary education will enter into force in Latvia, the principles of which are based on a pupil-focused learning approach. This approach is characterised by active learning, one of which is technology-enhanced learning. In the light of the development of the digital environment and the opportunities offered for the diversification of didactics through archival and content analysis, observation and autoethnography, a number of technological solutions were analysed to ensure active learning in math, both in-house and remote learning. As part of an educational case study, both the teacher and pupils themselves had the opportunity to test different digital tools.",0
103,Mazākumtautību 6.klases skolēnu mutvārdu monoloģisko prasmju pilnveide latviešu valodas stundās,"The Master's thesis examines the oral monological skills improvement among sixth graders of national minorities at Latvian language lesson. The author of the master's work is Nadezhda Rachkova. This study is current, because there are less studies that are devoted to the improvement of students’ monologic skills of minorities students who learn Latvian language, but the requirements for minorities students when forming monologic expressions in Latvian (in each stage of mastering the language) are much higher than in a foreign language, they are close to the requirements in native language. However, the didactic ways how to achieve these requirements differ from those that are assumed in the methods of native and foreign languages. The aim of the study is to research the didactic possibilities to improve the verbal monologic speech in Latvian language of minorities students from grade 6. The master paper consists of two parts – theoretical and empiric.  The meaning of lingual personality, role of monologic speech during the process of learning Latvian is analysed theoretically; linguodidactic experiences of scientists are summarized where methods and techniques for improvement of students’ monologic skills in second language are in the centre; difficulties are characterized that the students encounter when creating verbal texts during learning a second language. The study is based on theoretical opinions of J. Karaulovs, V. Vinogradovs, I. Halejeva, N. Gaļskova, N.Geza, Z. Anspoka, I. Alekse, V.Strautiņa, D. Šulce,  and other authors. Results of questionnaires of Latvian language teachers and results of assessment of verbal monologic speech of students from grade 6 are summarized and analysed in the practical part of the maser paper. Justified recommendations are developed for teachers of Latvian language to improve the verbal monologic speech of minorities students from grade 6 during lessons of Latvian language. The results of this study can be used by teachers of Latvia language in minorities schools, and the formulated didactic recommendations in the master paper can be regarded as additional didactic materials that can be used along with the textbook Latvian for grade 6 in minorities schools.",0
104,Skolēnu mācību satura apguve integrētā angļu valodas un matemātikas mācību procesā sākumskolas 3. klasē,"The modern world is constantly evolving, people are given endless amounts of new information and the school's aim is to help them to “open the World”. School has a huge role in developing  pupil's thinking skills by analysing and systematising information, using the information obtained in practice. Education in Latvia comes with great strides to the future, using the most recent approaches and methods. One of the methods is integrated education. The Diploma Paper describes  “Students’ learning content acquisition in the integrated English and Mathematics teaching process in the 3rd grade of primary school” It consists of an introduction, four chapters, conclusions, list of used literature and appendix. In order to complete the research of the Diploma Paper the following data collection methods were used: analysis of scientific, pedagogical psychological literature sources, analysis of regulatory document, the interview with an expert and pedagogical observation. The introduction reflects the relevance of the bachelor's subject nowadays, shows the subject, object, purpose, hypothesis, and study tasks. The first part consists of the analysis of the scientific literature and sources. The following subjects were analysed: the characteristics of pupil development, the nature of learning integration and the integrated learning content. In the second part the author interviewed the teacher, observed and indicated the teaching lessons according to the subject of the Diploma Paper. All the tasks of the study were done and analyzed. Conclusions have been reached at the end of the bachelor's work. Diploma Paper contains 65 pages, 35 literature sources and 7 appendixes. Keywords: young language learners, integration, content of English and Mathematics teaching.",0
105,"Jaunrades veicināšana tēmā:""Gurnu somu izgatavošana"" mājsaimniecības mācību priekšmetā 12.klasē","The aim of the diploma work “Promotion of Creativity in the Topic ""Sewing of Belt Bags"" in Home Economics in Grade 12” is to study the possibilities of making belt bags in home economics in the 12th grade, develop and approve a thematic plan, as well as to promote students' creativity through various methods. Diploma work “Promotion of Creativity in the Topic ""Sewing of Belt Bags"" in Home Economics in Grade 12” consists of 4 chapters and 15 subchapters. The first chapter researches and analyzes the literature on the concept of creativity and theoretical approaches. In the second chapter, the analysis of normative data is performed, as well as information about the study content is summarized. The study content includes topics on the history of the belt bags, composition, necessary materials, and the sewing process of the belt bag. In the third chapter, the study of age was performed, and the thematic plan and evaluation criteria of student works were developed. The fourth chapter describes the approbation of the thematic plan and analyzes the obtained results. Keywords: crativity, designe, belt bags, home economics, grade 12th.",0
106,Jēgpilnas mācīšanās iespējas veselīga uztura apguvē mājturībā un tehnoloģijās 6. klasē,"The thesis entitled “Meaningful Learning Opportunities for teaching Home Economics and Technologies During the Nutrition Learning Process in the Grade 6” is to study meaningful learning opportunities when teaching a Healthy Snacks topic within Home Economics and Technologies subject in the Grade 6. The research question is whether it is possible to encourage and develop healthy eating habits in pupils by providing meaningful learning opportunities for when they study nutrition in Home Economics and Technologies.  The literature review explores the conditions of meaningful learning, the approach to competence education, the characteristics of the age of the pupils and the importance of nutrition in the development of adolescents. The practical part of the thesis outlines the thematic plan of the topic of healthy snacks and provides the analysis of the thematic plan and the performed approbation of the subject of the study.  A questionnaire was developed to understand the knowledge, opinions and attitude of pupils and their parents regarding the research question; the obtained results were summarized and analyzed in the thesis.  The thesis is formed of 3 chapters, 10 subchapters, conclusions, bibliography and 11 appendices and 101 pages. The thematic plan of the content of the study has been approbated in Grade 6 of the X secondary school. Keywords: home economics and technologies, healthy eating, healthy snacks, meaningful learning, profound learning.",0
107,Latviešu valodas un literatūras integrētas apguves iespējas 10. klasē,"The aim of the Diploma Paper Opportunities for Integrated Learning of the Latvian Language and Literature in Grade 10 is to develop an integrated didactic material for the integrated learning of the personality of Nora Ikstena and the novel “Soviet milk” of Latvian language and literature and to assess its suitability for the development of the skills of the 10th grade pupils in the linguistic and artistic world.  The topicality of the problem is the fact that the implementation of the content requirements of the “Competencies approach in the learning content” project implemented by the State Education Content Centre will start on 1st September 2020, but there are currently no adequate means of teching in Latvian and literature. Five chapters of the Diploma Paper offer an insight into the analysis of the regulatory documents regulating the content of teaching, the theoretical knowledge of linguists, Literal-scientists and psychology doctors, the development of a well-founded didactic material, describing the teaching experimental activity and analysing the results are obtained.  Thet attachments summarise samples of worksheets and other handouts included in the didactic material, evaluation criteria, constipation of lessons and a literary newspaper created by pupils. Diploma Paper is advisable both to the students and highschool Latvian language and literature teachers, as well as those who prefer postmodern literature. The amount of Diploma Paper is 72  pages. Keywords: Integrated learning, Nora Ikstena, text reference, novel, literary newspaper.",0
108,Didaktiskās spēles un kustību aktivitātes kā līdzeklis 1.klases skolēnu uzmanības sekmēšanai matemātikas stundās,"The aim of the diploma thesis “Didactic Games and Activities as Tools for Improving Attention Span in Maths Classes for First-Grade Students” is to investigate the role of attention in the learning process in order to improve pupils’ attention skills by utilizing didactic games and physical activities. The study delves into a theoretical analysis of attention, the characterization of child development and the developmental significance of didactic games and physical activities. For the practical element of the research, teachers interviews, student testing and an expert survey were carried out to explore attention development techniques.  Finally, the main conclusions, recommended strategies and methodological materials for the development of learners’ attention are presented.  Keywords: attention, didactic games, physical activities.",0
109,Šūšanas pamatprasmju apguve kompetenču izglītības aspektā mājturībā un tehnoloģijās 5. klasē,"Diploma thesis “Acquisition of Basic Sewing Skills in the Realm of Competence Based Education in Home Economics in Grade 5” aim is to create a study content for the topic “Basics of Sewing” in the aspect of competence education and to approbate it in home economics and technology lessons in the 5th grade. The first part of the work researches the concept of competence education and normative documents, describes the peculiarities of teenagers, and analyzes the achievable results and their evaluation. In the second part of the work, a thematic plan for the study topic “Basics of Sewing” is developed, the process of creating a design product is described and visual aids are created. The third part of the work was approbated of the study content partly both in person and remotely and the analysis of the obtained data was performed.  Keywords: basic sewing skills, competence education, bag sewing, housekeeping and technology.",0
110,Imanta Ziedoņa personības un daiļrades apguve 12. klasē,"The aim of the diploma paper “Learning about the Personality and Creative Work of Imants Ziedonis in Grade 12” is to create a version of a methodological system that would help the students to show interest and understanding of the work and personality of Imants Ziedonis. The diploma paper consists of an introduction, five chapters with subsections, conclusion and attachments. The first chapter identifies and examines the available literature about the personality and creative work of Imants Ziedonis. The second chapter is dedicated to the research of the specifics in literature as a subject. The third chapter describes the preparation of the teacher for work in the class, examines the characteristics of age in youth and represents the students who took part in the research. The third chapter also includes the planning of educational content selection and organization. The forth chapter describes the course of the lesson dedicated for teaching about the personality and creative work of Imants Ziedonis. The fifth chapter consists of the analysis and evaluation of the cooperation between students and teachers. The attachments include educational content development, evaluation criteria and examples of students work. The effectiveness of this version of the methodological system has been tested in a pedagogical experiment. This diploma paper is suggested for use for students, high school literature teachers and other interested parties. Key words – Imants Ziedonis, poetry, epiphany, literature.",0
111,Didaktiskās spēles skolēnu vārdu krājumu paplašināšanai latviešu valodas stundās mazākumtautību sākumskolā,"The issue explored in the work «Didactic games for vocabulary replenishment in Latvian language lessons in the elementary school for national minorities» emerges from the need to study teaching practice and reveal the problems, that are solved in order to make the program of learning of the state language by national minorities be aimed at the pupil, especially at this time, when there is a gradual transition to the education in the state language with the competency based approach. The objective of the diploma work is to explore the possibility of using didactic games in Latvian language lessons to replenish vocabulary of the pupils in the elementary school. The diploma work provides information on the issues of learning a second language in didactic games, as a means to achieve this aim. Practical study shows that contemporary games can be diverse (cards, digital cards). It encourages pupils to be active during the studying process.",0
112,Salīdzinājums starp tiešsaistes testiem (KAHHOT platforma) un tradicionāliem testiem (papīra formāts)5. – 7.klašu grupās,"The purpose of the theses was to research what is the difference between traditional tests and online tests, what’s pupil attitude towards them and which test they prefer more. The main instrument for the data gathering in this research was a survey which was made and then distributed via e-mail During the research, it was discovered that online tests are used more often than traditional tests. Students like completing online tests due to their ease of use and their low difficulty. Online tests are a good way to measure the pupil’s current knowledge level in a subject, but they are prone to technical risks. To raise test effectiveness if the tests teachers should improve the content of the tests. Traditional tests give the possibility to tests higher cognitive abilities and skills in students. It also allows for teachers to delve deeper into students answers and not mark it only based weather it is correct or incorrect. Traditional tests allow students to approach the test in their own speed without any time constraints and allows them to go back and changes or improve the answers they had given before. The biggest issue for traditional tests is the number of written tasks which completion requires a lot of time and are difficult to complete",0
113,Lasīšanas Detektīvi Skolēnu Lasītprasmes (Lasītpratības) Pilnveidei Angļu valodas stundās 7.klasē,"The author of the Diploma Paper has experienced that rather little research is carried in Latvia that would measure students’ reading comprehension in a foreign language; such measurement is done yearly in Latvian and is known as Progress in International Reading Literacy Study (PIRLS). Yet, students are asked to challenge their English reading skills in centralised examination (CE) in Grade 9 and 12, thus it seems reasonable to strive for improvement of reading comprehension in a foreign language, too. As foreign language acquisition is connected with native language comprehension, meta-cognitive approach is favoured nowadays, one of the meta-cognitive strategies advised is called Reading Detectives, which focuses on cognition strategies, when students are exposed to challenging texts. The aim of the Diploma Paper is to examine how the particular strategy can improve students’ reading comprehension in English lessons in Grade 7.  The research method is a case study that involves the author’s journal entries, Meta-cognitive Awareness of Reading Strategies Inventory (MARSI) questionnaire carried out among students before and after implementing Reading Detective strategy and semi-structured interviews with three subject related teachers of School X, also, before and after the strategy implementation process.  It was found that there are several activities within Reading Detective strategy to improve reading comprehension, used not only in language related subjects as the strategies are used depending on the purpose, that is, either to summarize, visualize, recall, decode or organize. Among the activities contributing to the development of reading comprehension are word and context clues, story detective game, summary wheel, story wheel (map) strategy, character trait summary chart, Venn diagram, summary wheel with questions, discussions and role-play story detective game, which positively correlates with the development of meta-cognitive strategies, namely, Support Reading, Global, and Problem-Solving.  Together with the data gained in the research about the activities underlying Reading Detective strategy for promoting reading comprehension in Form 7, the Diploma Paper can be used as a guideline for teachers, working on reading comprehension skills in the classroom either on regular basis or with students from special education.",0
114,Karjeras izglītības stratēģijas sniegumu uzlabošanai angļu valodas stundās skolēniem ar mācīšanās traucējumiem 7.klasē,"Career education has been studied and implemented in general and special needs education for decades, thus there is still room for improvement especially in combination with gaining popularity competence-based approach. Much of what has been investigated primarily is related to general education or subjects overall. This thesis serves to provide insight into career education activities for students with learning disabilities in English language acquisition.  The aim of this study is to find the most successful implementation of career education strategies and the right forms of students’ both English skills and career orientation improvement. The objectives made were to analyse literature, develop the case study by carrying out interviews with teachers of special needs education, and creating a notebook with career education activities for students with learning disabilities for English lessons in Form 7.  The most common obstacles were to combine all of the elements together, as well as dealing with various learning disabilities. Nonetheless, the insight provided by the research sample made it possible to plan the process of gathering superior techniques and approaches of career education implementation.  Keywords: career education, learning disabilities, competence-based approach, soft skills, case study, English skills, teaching principles, portfolio.",0
115,IKT iespējas valodas stundu ietvaros,"The aim of the Thesis topic “ICT possibilities in language skill testing” is to find various possibilities for integration of smart device based testing in the learning process. Finding out about the opportunities and difficulties of electronic testing. And whether it can be implemented in English, taking into account the standard of education. The theoretical part describes the test methods adopted so far. The role of electronic devices in the daily life of the pupil and their adaptation to the learning process. The practical part consists of integrating various electronic testing methods into the learning process. At the end of the school year, students are surveyed about the results of integration in these systems. All results achieved are analyzed and conclusions are drawn.",0
