id,title,abstract,is_generated
132,Jaunākā skolas vecuma bērnu emocionālo inteliģenci sekmējoša skolas kultūra,"The author of the Paper has experienced that different types of management styles and teaching styles influence the way students feel, their productivity and motivation. One class can be joyful and inspiring, yet another – depressing and dreadful. Hence why it was necessary to determine what criteria of teaching style can influence students positively and negatively. While researching, the author found out that teaching style is part of school’s culture that has the most influence on student’s character growth and emotional intelligence of students was taken as personality growth that is influenced by this culture. Further it was established that school’s culture is influenced by each teacher’s personal cultural level that has straight influence on student’s emotional intelligence. This emotional intelligence later regulates how a student feels, behaves, and acts in certain situations not only in school, but for the rest of his life. Thus why it was necessary to make further research on how exactly these two concepts influence each other. The research method is survey about student’s emotional intelligence and teacher survey that involves class and management style observation that determines single classes culture level. Four primary classes were researcher in total, allowing to determine culture level of each class, overall emotional intelligence level of students. When these data were compared, it was concluded that classes with lower culture level had lower index of emotional intelligence, yet higher culture level shows higher index of emotional intelligence. Consequently, this Paper can be used by teachers to analyse their style of work and improve some aspects of their own culture to positively impact student’s emotional intelligence.",0
133,IT tehnoloģiju lietojums matemātikas stundās 10. Klasē,"In the diploma thesis “The Usage of IT Technologies in 10th Grade Mathematics”, the use of IT technologies in the learning process of a secondary school mathematics course was considered. The aim of the research is to study the possibilities of using IT technologies for their meaningful application in 10th grade mathematics classes. The objectives of the thesis are to analyze the findings of experts in pedagogy and mathematics on the use of IT technologies in mathematics lessons, and to explore the capabilities of IT technologies in topics such as ""Introduction to secondary school mathematics"", ""Extension of the Angle in a Triangle”, and ""Geometric Transformations"".  The thesis examines the versatility and classification of IT technology tools in mathematics education, their implementation in Latvian education according to the secondary school mathematics curriculum, and their applicability in distance learning. Through empirical research, teaching methods and ways of utilizing IT technologies in the mathematics teaching process were developed. Student surveys, assignments and tests were developed and the advantages and disadvantages of using IT technologies in mathematics classes were analyzed.  The pertinence of this research is specified in the State Education Law, the Education Standard and Curiculum, the Education Model Programs, and the criteria for lesson management, as well as the author's interest in increasing the efficiency of lessons.  The diploma thesis consists of two sections. The first chapter has three subsections and the second chapter has two subsections. The volume of the diploma thesis is 61 pages with 58 figures and 1 table. There are 7 appendices in the work, and 17 literature sources are used.  The study concludes that the successful integration of IT technologies in the learning process increases students' interest and motivation, creates correct mathematical ideas, develops mathematical imagination and visualization, improves performance and creates a positive atmosphere in the learning process.",0
134,Grafikas izteiksmes līdzekļu apguve vizuālajā mākslā 9.klasē,"The author of the graduation diploma work Ginta Teterovska has developed a work on the  topic: ""Acquisition of Printmaking Elements in Visual Art for Grade 9"". The aim of the diploma  thesis is to study the use of experimental graphic techniques as texture, space and form applicable  as means of expression in graphic works.  The diploma thesis consists of four parts. Of which, the first chapter describes the  technical research of graphics. In the second chapter the theoretical research of graphic means of  expression is performed. The third chapter deals with the development of a set of tasks. In the  fourth chapter the approbation of the set of tasks was performed.  The work consists of 70 pages and 4 attachments.",0
135,Mācību priekšmeta standarta un autorprogrammas izstrāde programmēšanas priekšmetam vidusskolā,"The aim of the Diploma paper is to develop a program of the subject ""Programming"" and a standard of the subject ""Programming"" for the secondary school based on the literature sources and criteria for a correct program of a subject. Within the framework of the Diploma paper the program of the subject and a standard of the subject have been developed. During the research it was found that the subject can be taught in the secondary school because its standard has been accepted to be corresponding to the set criteria of the evaluation of the subject's program.",0
136,Logopēda un pirmsskolas pedagoga sadarbība skaņu izrunas traucējumu mazināšanā pirmsskolas vecuma bērniem,"Author : Ilze Spriņģe Head of work: Prof., Dr. paed.Sarmīte Tūbele Subject of the diploma: Cooperation between a speech therapist and a preschool teacher in reducing sound pronunciation disorders for preschool children. Aim of the papre: to investigate the possibilities of cooperation between a speech therapist and a preschool teacher in reducing sound pronunciation disorders for preschool children. Research question: what are the possibilities of cooperation between a speech therapist and a preschool teacher in reducing sound pronunciation disorders?  The paper consists of three parts. The first part summarizes the findings of specialists about the development of preschool children as a whole and children with sound pronunciation disorders. In the second part, analyzing the literature and regulatory enactments, the main tasks of a pre-school teacher and a speech therapist and the theoretical explanation of their cooperation are clarified. The third part is dedicated to analyse of data obtained in the study on the real situation in the cooperation of pre-school teachers and speech therapists. The developed model of cooperation of the mentioned specialists in the pre-school institution X are also analysed in the third part. The model also offers tools for the pedagogue's work in the corrective development of sound pronunciation disorder. The findings of the work are included in the conclusions and recommendations.  The paper consists of 60 pages; 58 literature sources were used in the development of the paper, the work includes 9 figures, 7 tables and 4 appendices.   Keywords: preschool, speech therapist, teacher, cooperation, sound pronunciation disorders.",0
137,Vārdu krājuma pilnveide bērniem ar fonētiski fonemātiskiem traucējumiem kustību rotaļās vecākajā pirmsskolas vecumā,"Author : Gita Lejniece Head of work: Mg. paed. Egija Laganovska Subject of the diploma: Developing the vocabulary for children with phonetic disabilities in the older pre-school age in motion games. The aim of the work is to study the lessons of the various authors in theory and to test in practical terms the development of the vocabulary of children with phonetic digital disabilities in the game of movement. In order to achieve this goal, the theoretical part identified and analysed the lessons of logopeds, psychologists, educators. On the basis of these findings, the author drew conclusions on the lines of child development, on the importance of physical development in the development of children and on the use of motion playing in logopic adjustment work. In the analysis of studies from different authors, the author has analysed the cognitive and physical development of children of older preschool age and has looked at emotional and social development while playing games of movement. The practical part of the study assessed the children's vocabulary and the development of fine and large motorics according to the age stage. Corrective action was taken by linking the logopic correction work to the playing of movements. Logoppers were also involved during the study. When compiling and performing an analysis of the results of the work, the author concludes that the logopper can use motion games in the developing operation. The playing and exercise of movements can improve children's vocabulary and promote the physical development needed for children to develop together. The amount of the diploma work is on 70 pages. Working using: 56 literature sources, 13 pictures, 10 table and 5 attachments.",0
138,Pakalpojuma dizaina nozīme lauku tūrisma attīstībā,"The topic of the dissertation is ""The role of service design in the development of rural tourism"". The topic of the research quite significant, because a carefully and qualitatively developed service design structure provides an understanding of the customer's wishes and promotes customer attraction, which is one of the main factors for a successful and profitable company. The author of this work chose this topic because she found it interesting and useful to study the possibilities provided by service design, the connection with user experience design and interior design. The author of the work is Evita Neimane, a fourth-year student at the University of Latvia(Latvijas Universitāte). The main goals of the bachelor's thesis “The role of service design in the development of rural tourism” are to create modern comfort and service requirements for the guest house (hostel), which will be located in the former Dobelnieki HES building, while creating a functionally and aesthetically suitable environment for different groups of travelers. history and functions of the house. The work consists of three parts - theoretical review; research methodology process, and creative part. The first part includes information on the origins of accommodation, the history of development in Latvia and elsewhere in the world, as well as an overview of the structure, classification and categorization of the accommodation sector. In order to obtain information and draw conclusions that would confirm the validity of the choice of accommodation type and be useful during the interior design, the Empirical part of the work studies and analyzes the interior design and range of hotels, guest houses and hostels, as well as in other districts of Latvia and elsewhere in the world. . The third - creative part - includes a description of the interior design, its economic calculations and the main components of the interior design, as well as visual materials about the creative work. The work consists of annotations in English and Latvian, introductory parts, theoretical parts, practical parts and conclusions. The work consists of 79 pages",0
139,Riskējošas un pozitīvas uzvedības saistība ar motivācijas veidu agrīnajā pieaugušo vecumā,"The objective of the present study was to examine the relationship between positive behavior, type of motivation to engage in it and risk-taking behavior, and also to develop methods to measure both risk-taking and positive behavior and motivation to engage in positive behavior in line with self-determination theory. In this study data from 204 participants aged 18 to 30 was gathered and the analysis of that led to the confirmation of the hypothesis on positive relationship between positive behavior and autonomous motivation to engage in it. The frequency of risk-taking behavior was very low hence the examination of the relationship between risk-taking behavior and motivation to engage in positive behavior was constrained. There was however a statistically significant relationship found between some isolated types of less socially condemned risk-taking behavior and controlled motivation to engage in positive behavior. Overall the results confirm the suitability of the conceptual framework of self-determination theory for explaining positive behavior and indicate the necessity to continue the research of the relationship between motivation and risk-taking behavior.",0
140,"Meditāciju saistība ar smadzeņu darbību, izmantojot elektroencefalogrāfu (EEG), randomizēti kontrolētos pētījumos: metaanalīze","The aim of this Master's thesis is to investigate whether and how the depression sympthoms and substance use are related to attitudes towards sexual risk behavior in adolescence, also to determine whether there are gender differences in attitudes towards sexual risk behavior. Study participants included 102 adolescents aged 15 to 19 (50 boys and 52 girls). During the study, respondents were asked to fill out a form, based on three different surveys: 1) Child Depression Survey (CDI, Kovacs, 1980; adapted by Voitkane & Miezite, 1994), that consists of five scales representing the symthoms of depression: Negative Mood, Interpersonal Problems, Ineffectiveness, Anhedonia, and Negative Self-Esteem; 2) Screening Tool for Adolescent Substance Abuse, Part 1 (CRAFFT, Knight, 2016), which was translated within the Master's thesis. The CRAFFT is a substance use screening tool for adolescents aged 12-21; 3) Sexual Risk Behavior Beliefs and Self-efficacy Scales (SRBBS, Basen-Engquist et al., 1998), adapted within the framework of the Master's thesis. These scales measure attitudes of adolescents, perceptions, and beliefs concerning sexual risk behavior (Attitudes about sexual intercourse, Norms about sexual intercourse, Self-Efficacy in refusing sex) and protective sexual behavior (Attitudes about condoms, Norms about condom use, Self-efficacy of communication about condoms, Self-efficacy in using and buying condoms, Barriers to condom use). During the study, both of the research questions were answered: ‘Whether and how the symthoms of depression and substance use are related to attitudes towards sexual risk behavior in adolescence?’ and ‘Whether there are gender differences towards sexual risk behavior in adolescence?’. The results show statistically significant correlations between the sympthoms of depression, substance use, and attitudes towards sexual risk behavior in adolescence. Also, the results indicate statistically significant gender differences in attitudes towards sexual risk behavior.",0
141,"Depresijas pazīmju, apreibinošo vielu lietošanas un attieksmes pret riskantu seksuālo uzvedību saistības un dzimumatšķirības pusaudžiem","University of Latvia, Faculty of Education, Psychology and Art, Arts division, Profes-sional Bachelor’s Degree Program in Art course 4 student Janis Upitis (Student ID ju16006), bachelor’s  “Use of graphic design in making board games for children” aim is to create a board game for preschoolers. The diploma thesis consists of three parts. The theoretical part summarizes information about the history of board games and the world’s most popular board games and their design. The empirical part compares 10 especially popular and demanded children’s board games both in Latvia and in the world, and developes and analysis of the design of these games, as well as summarizes the answers from semi-structured interviews. In the creative part, summarizing and analyzing the obtained information, a board game for preschool children is developed.",0
142,Grafiskie izteiksmes līdzekļi bērnu galda spēļu izstrādē,"This work is about web page evolution since the start of the 90s, when it became more popular in broader public. This thesis is to study the information about history of web design, trends and principles of today, and personal web page analysis. In the end result the task is to create a personal web page portfolio design.",0
143,Dizaina portfolio evolūcija tīmeklī,"Nowadays efficient reading speed and comprehension are needed to find relevant and truthful information, for example, in news articles or transportation timetables among other textual sources.  The aim of the Paper was to explore how the use of video materials with English subtitles can increase reading speed and comprehension in Grade 11. A case study of 12 students was chosen as the method research. Measurements of the students’ reading speed and comprehension, feedback questionnaires and semi-structured interviews with 2 teachers were selected as data collection methods.  The results revealed that there was a slight increase in reading speed, but reading comprehension declined. In this case, subtitled videos had a positive effect on reading speed; however, further research is needed to determine if the results could be applied generally.",0
144,Video materiāli ar subtitriem angļu valodā lasīšanas ātruma un izpratnes paaugstināšanai 11. klasē,"The aim of this study was to explore seniors’ engagement in leisure activities, independence in everyday activities and its relation to three components of subjective well-being, satisfaction with life, positive and negative affect.   The study sample size were 74 participants- 59 women and 15 men from ages 65 to 89 (M=74,60, SD=6,64). The following measures were used: Engagement in Leisure Activities Questionnaire (Fernández-Mayoralas, et al., 2015), Katz Index of Independence in Activities of Daily Living (Katz, 1983), Satisfaction With Life Scale (Diener, Emmons, Larsen & Griffin, 1985) and The Positive and Negative Affect Scale (Watson, Clark & Tellegen, 1988). Results showed that there was a statistically significant correlation between seniors’ engagement in different leisure activities and positive affect. Engagement in passive, cultural and social activities was statistically significantly correlated to higher positive affect. Results for regression analysis were that passive and social activities explains the most variance of positive affect. Additionally, it is concluded that older age correlated to less engagement in different activities and that higher perceived health was significantly correlated to more frequent engagement in leisure activities and higher positive affect.   Because of the sample size and uneven gender distribution, the result interpretation should be made carefully.",0
145,"Senioru iesaistīšanās aktivitātēs, neatkarība ikdienas aktivitātēs un subjektīvā labklājība","The subject of the study was to identify depression, anxiety symptoms and self-esteem of pregnant women during pregnancy with the first child and first time mothers’ post-natal depression, anxiety symptoms, self-esteem and mother-baby attachment during the year after giving birth. The study involved 200 pregnant women with the first child aged 18 to 38 years (M = 27,27; SD = 4,32) and 200 first time mothers aged 18 to 46 years (M = 28,08; SD = 4,71) who have become mothers during the last year. The study used the Rozenberg self-esteem Scale (Rosenberg Self-Esteem Scale, Rosenberg, 1965), State-Trait Anxiety Inventory (Spilberger, 1983, State-Trait Anxiety Inventory; STAI), The Postpartum Bonding Questionnaire (The Postpartum Bonding Questionnaire, PBQ, Brockington et al, 2006) and Edinburg Postnatal Depression Scale (Edinburgh Postnatal Depression Scale, epds, Holden, Sagovsky, Cox, 1989). It can be concluded from the results that pregnant women have reduced self-esteem, increased anxiety rates and symptoms of depression during pregnancy. symptoms of depression appear in the post-natal period, and anxiety increased, a lower self-esteem and a mother-baby attachment rates are lower from 4 to 12 months.",0
146,"Grūtnieču un pirmdzemdētāju depresijas simptomi, trauksme, pašvērtējums un mātes pēcdzemdību saikne ar bērnu","Author: Estere Gleske Subject: Hundertwasser Art as a Source of Inspiration in Grade 5 Art Lesson. This diploma work was written in order to reveal Hundertwasser art as a source of impulse of creative activities in grade 5 art. First chapter introduces Hundertwasser himself, his art, sources of inspiration, as well as means of artistic expressions he used. Second chapter researches and analyses regulatory documents, teenager age group features and presents a created task set, methodological material for eight unique classes, developed criteria and system of evaluation, aas well as wellfounded methods of teaching process. Third chapter examines results, obtained during pedagogical tryout activities, applying task set found in diploma work. Analysis practical works of students and created class materials, stressing the significance of Hundertwasser art work inspiration in creative visual arts classes. Pupil can be inspired and motivated by art works, that are personally relevant and interesting to them. These works, which are at the heart of this task set, inspire artistic ideas and freedom. Conclusion makes a summary of results and deductions of the diploma work done.",0
147,Hundertvasera daiļrade kā iedvesmas avots vizuālās mākslas mācību stundās 5. klasē,"Author of the work: Irina Teļežņikova Work supervisor: Mg. paed. Egija Laganovska Title of work: use of toys for the correction of interdental pronunciation in five-year-old children. Aim of the twork: to find out how the use of toys helps to reduce interdental pronunciation disorders in five-year-old children. Research hypothesis: interdental pronunciation in children can be fixed if speech and language disorders are observed and diagnosed in time; take into account the peculiarities of the age of children; purposefully toys will be used. Research methods used: (theoretical, empirical) •The first chapter analyzes the theoretical literature on children’s speech and language development, pronunciation disorders in the context of research, the role of games in language development. •The second chapter contains a study on the correction of the interdental pronunciation in children. This chapter describes the research methods, tasks and analyzes the research results. At the end of the work, the author summarizes the conclusions about the results obtained in the study in relation to the aim of the work and the hypothesis. Research period: 2019 – 2020. The theory of pedagogy and psychology literature, databases and academic literature were used as a research sources. The workload of thesis is 55 pages, for the research, the work includes 4 tables and 6 pictures, 5 applications are attached to work. 29 literature sources were used for the research, 3 of which are in a foreign language. Key words: language, speech, interdental pronunciation, toys.",0
148,Rotaļu izmantošana starpzobu izrunas korekcijai piecus gadus veciem bērniem,"The aim of this study was to find out the gender differences and correlations of suicidal thoughts, bullying experiences, social skills and reasons for living in adolescents, as well as to understand how the constructs can predict positive thoughts about own life and suicidal ideation. 165 adolescents participated in the study (82 girls; 83 boys), of ages 10-16. 4 methods were used: Olweus Bully/Victim Questionnaire, The Positive and Negative suicide ideation inventory, The Rasons for Living Inventory for Adolescents, Social skills inventory for adolescents. The acquired results of research show, that boys act on different forms of violence on their peers and behave antisocially more often, while girls more frequently feel suicidal ideation and demonstrate positive behavior to others. Statistically significant correlations between constructs were acquired and concluded, that positive thoughts in adolescents were best predicted by future optimism, prosocial behavior, gender and age, meanwhile in explaining suicidal ideations, the biggest significance is in difficulties of self-acceptance and the experience of the role as the victim. The results allow to see groups adolescents that may have potentially higher risk of suicide-related behavior more clearly, as well as to understand the protective factors.",0
149,"Pašnāvības domas, dzīves iemesli, mobinga pieredze un sociālās prasmes pusaudžiem","The main goal of the diploma thesis titled “Research of the Artistic Expression Means in the Works of Georges Seurat in Visual Art Classes in Grade 7” is to study G. Seurat's artistic means of expression and the possibilities of their use in grade 7 visual art lessons.   In order to achieve the goal, several tasks have been set in three chapters, within which the author has studied and described the means of artistic expression in Georges Seurat's works; has researched the basic education standards and program for grade 7 visual art lessons. The author has also researched peculiarities of adolescent age; she has developed and applied a set of tasks as well as the most appropriate teaching methods matching the evaluation criteria appropriate to each task. The author has also analyzed and summarized the results obtained in the pedagogical pilot activity.  At the end of the diploma thesis you can get acquainted with the research results and conclusions. The appendix includes the artist’s reproductions used in the visual materials as well as the questionnaire, the developed set of tasks, the evaluation system charts and pictures of the students' works. Keywords: Georges Seurat, pointillism, optical mixing of colors,shape,point.",0
