id,title,abstract,is_generated
52,Rotaļas 2-3 gadu vecu bērnu priekšstatu par sakarībām starp lielumiem veidošanās veicināšana,"The name of the qualification paper: Games to stimulate the development of the notion of children aged 2-3 years of the relationships between the sizes.  The qualification paper author: Jekaterina Zaiceva. The qualification paper supervisor: Prof. Dr. of Pedagogy Rudīte Andersone The goal of qualification paper:  Theoretically to find out and practically to study the understanding of 2-3 year old children about relationships between sizes and the promotion of  formation. The first chapter analyzes the pedagogical and psychological literature about the games, its classification, the second chapter analyzes the characterization of the stage of the age of 2-3-year-old children, the third chapter analyzes the understanding of 2-3-year-old children regarding the formation of relationships between sizes. The fourth chapter analyzes the pedagogical experience in the use of toys, creating a desirable understanding of 2-3-year-old children about the relationships between sizes. The fifth chapter describes the examination of the use of toys in 2-3-year-old children's understanding of the relationships between sizes and the promotion of formation. During the research, the answer was obtained to the qualification paper research question regarding what games can be used to promote the formation of 2-3-year-old children's understanding of the relationships between sizes. The answer is: the most used toys are didactic toys and construction toys: ""Pyramid"", ""The assembly of the tower!"", ""Find by size!"", ""Find the same"", ""Assemble the path"", ""Treat the mice with tea"", ""Let's attach hair bands to the doll's hair"", ""Picking up the balls"". Keywords: 2-3-year-old children, understanding about relationships between sizes and games. The qualification paper consists of:  54 pages, 16 pictures, 2 tables, 55 literature sources.",0
53,Profesionālā izdegšana un ar to saistītie darba faktori finanšu nozarē strādājošajiem,"The aim of the bachelor's thesis “Professional burnout and related work factors for those working in the financial sector” is to examine the indicators of the clinical subtype of burnout for those working in the financial sector and their relation to work factors - low pay, lack of positive assessment, workload and perceived control. The findings of recent studies were summarized and an empirical study was conducted. The study resulted in a survey of 52 financial employees who completed two questionnaires: the Burnout clinical subtype questionnaire, BCSQ-36 (Marin & Campayo, 2010) and some articles from the Copenhagen Psychosocial Questionnaire (Kristensen, Hannerz, Hogh & Borg, 2005). The results showed that there was a statistically significant association with the age of respondents with the clinical subtype “Worn-out”, a negative correlation with the subtype “Underchallenged” with a lack of positive evaluation and perceived control, a negative correlation with subtype “Worn-out” with low pay, lack of positive evaluation and perceived control.  Keywords: occupational burnout, clinical subtypes of burnout syndrome, employees of organizations, work factors, perceived control.",0
54,Depresijas simptomu saistība ar problēmu risināšanas stiliem,"The study was aimed at exploring the relationship of less-studied, backward-looking depressive symptoms with social-problem-solving styles. The theoretical part of the study examined what constructions and relationships were between depression symptoms and problem-solving styles; what subscales from the Depression Symptoms Scale (Vanags, 2020) would be worth using in the study; what's the spotlight for this kind of study. As part of the study, five hypotheses were raised: (1) the symptoms of energy and lack of interest have a positive relationship with the elusive problem-solving style, (2) lack of concentration and sleepimpaired symptoms have a positive relationship with the impulsive-casual problem-solving style, which partly obtained approval, (3) a positive-oriented problem-solving style has a negative relationship with all of the subscales of depressive symptoms that did not gain approval, 4) the negatively targeted problem-solving style has a positive relationship with selfconscious thoughts, sad sentiment and self-disapproval that obtained approval, 5) selfcondemnation has a negative relationship with the rational problem-solving style that gained approval in empirical data. The study was conducted in a sample of adult individuals (N = 82). The Social Problem-Solving Inventory, /SPSI-R/D' 640illa, Nezu, Maydeu-Olivares, 2002), Depression Symptoms Scale (Vanags, 2020) were used. The study confirmed the existence of previously studied constructs – that problem styles can associate paterns of depression symptoms, and that they are generally different for each style and contributed to the spotlight on the presence of individual, less studied symptoms of depression.",0
55,Trauksmes un depresijas simptomu saistība ar dzimuma disforiju un uztverto sociālo atbalstu transvīriešu populācijā,"The aim of this study is to investigate the relationships between depression and anxiety symptoms, perceived social support, and gender dysphoria in the transgender male population. The study participants are adult transgender men (N = 81). Participants completed 3 surveys: Depression Anxiety & Stress Scales (DASS) Lovibond, SH & Lovibond, PF, 1995), The Gender Congruence and Life Satisfaction Scale (GCLS) Bethany A. et al., 2018) and the perceived social support scale (Zimet GD. Et al., The Multidimensional Scale of Perceived Social Support (MSPSS)). The survey also includes demographic questions such as: age, education, country and whether the transgender men have already started hormone replacement therapy. The results show that there is a statistically significant relationship between depression and anxiety symptoms, perceived social support and gender dysphoria.",0
56,"Augstākā izglītība un mainīgais darba tirgus pieprasījums – Latvijas Universitātes studiju programmas “Grāmatvedība, analīze un audits” gadījums","Title Higher Education and Changing Demand of the Labour Market - Case study of the University of Latvia Study Program “Accounting, Analysis and Audit” Author name and surname  Asnate Liniņa Aim of the qualification work  To study higher education in the context of the labour market demands in the case study context of the study program “Accounting, Analysis and Audit” of the University of Latvia Content of the work  The work consists of two parts - theoretical and empirical. The theoretical part analyzes scientific literature and documents, analyzing the link between higher education and the labour market. The empirical part analyzes the process of study program development and implementation at the University of Latvia in the context of labour market involvement, comparing the study program “Accounting, Analysis and Audit” learning outcomes with professional standard of economist and current situation in the labour market.  Outcomes  The thesis consist of two parts - theoretical and practical, 2 chapters, 7 subchapters, conclusions, proposals. The volume of the work is 58 pages (without appendixes) and 4 appendixes. The work is illustrated by 6 figures, 2 tables. 89 literature and other sources were used - 49 literature sources are in Latvian, 38 in English, 2 in Russian language.",0
57,Kustību rotaļu nozīme 3-4 gadus veciem bērniem uzvedības pašregulācijas attīstībā,"Ilona Grigorjeva The role of movement games in the development of behavioural self-regulation in 3-4 year-old children Supervisor: Mag.paed. Ineta Aizporiete  The aim of the research: to theoretically and practically determine the self-regulation development abilities of 3-4 year-old children using movement games.  The theoretical part of the research defines the concept of self-regulation and describes the developmental and self-regulatory features of 3-4 year-old children. The role of various games in the process of self-regulation and the role of movement games in the development process of 3-4 year-old children is also analysed.   In the practical part of the study, children's self-regulatory abilities, according to the developed criteria, are observed initially and repeatedly after recurrent organisation of regular movement games. The results are compared. The opinion of pre-school teachers on the problems of self-regulation is also obtained.   The hypothesis that the development of self-regulation of 3-4 year-old children takes place if interesting age-appropriate movement games are used is confirmed.  Keywords: self-regulation abilities and development, movement games, 3-4-year-old children Scope of work: 52 p. 4 tables, 8 figures, 53 literature sources,   2 supplement",0
58,Atgriezeniskā saite kā kritiskās domāšanas veicinātāja tehnoloģiju mācību jomā 4- 5 gadu vecumā,"The aim of the diploma paper “Feedback as critical thinking promoter in technology scholastic field in age 4-5” is to study 4- 5 years old children critical thinking development opportunities, using feedback in technology scholastic field. Actuality of study determines critical thinking also one of transversal competencies significance in new curriculum of preschool education in Latvia. The diploma paper’s theoretical part includes different authors study and analysis of literature and sources about critical thinking concept, critical thinking development, critical thinking also one of competencies in Latvian education, technology scholastic field, feedback’s importance, preschool children development.  In empirical part was performed children pedagogical observation in technology scholastic field lesson, pedagogical experiment, by using critical thinking evaluation table, as well as developed proposals for critical thinking encouraging feedback. The diploma paper contains introduction three sections, nine subsections, conclusion, used literature list, which includes 34 sources, four supplements.",0
59,Kompetencēs balstītas izglītības pilnveidošanas iespējas 7.-8. klašu grupā ģeometrijas stundās Zemgales vidusskolā,"Author: Sigita Šjadiene. The topic of the bachelor paper: Opportunities for improving competence-based education in geometry for grades 7-8 at Zemgale secondary school. The aim of research: to identify opportunities of improving competence-based education 7.-8. class group in geometry learning. The paper contains: 52 pages, 14 figures, 8 tables, 27 bibliography sources During the research the opportunities for the improvement of the competence-based educational process and the development of students' cognitive motivation were explored offering to students lessons for individual learning support after lessons, practical classes, discussion clubs, series of activities, study visits and individual consultations. It was concluded that the use of the above-mentioned learning activities during the mathematics lessons and out of the class activities, which ensured active involvement of students in the learning process, school subject relevance to everyday life and practical application, promoted students' competence in geometry and cognitive motivation. Key words: competences, geometry, cognitive motivation.",0
60,Grandiozā narcisma saistība ar sociālo mediju lietošanas biežumu,"The title of the qualification paper: “Promoting fine motor skills for 3-4 years old children in the constructive activities.” Author: Žanna Zaharova The scientific advisor: Mg.paed. Ineta Aizporiete. The aim of the research is to investigate the possibilities of constructive activities usage for promoting fine motor skills of 3-4 years old children. The subject of the research: development of 3-4 years old children’s fine motor skills in constructive activities. The object of the research: the pedagogical process in preschool. The question of the research: what possibilities of constructive activity usage are there for promoting fine motor skills for 3-4 years old children? The methods of the research are the analysis of the pedagogical, psychological and scientific literature, questionnaire. The paper is structured in 4 chapters. In the first chapter there is analyzed the meaning of fine motor skills development for 3-4 years old children. The second chapter deals with the pedagogical-psychological characteristics of 3-4 years old children. In the third chapter is analyzed the contents of the constructive activity of 3-4 years old children in preschool. The fourth chapter reveals the possibilities of constructive activities usage for promoting fine motor skills of 3-4 years old children, as well as there is pedagogical experience analysis. Keywords: fine motor skills, constructive activities, 3-4 years old children, preschool educational institution. Qualification paper contains 36 pages, 11 images, 5 appendixes, 23 sources of literature and information.",0
61,Sīkās motorikas veicināšana 3-4 gadus veciem bērniem konstruktīvajā darbībā,"Physical activities have a positive effect on a person's mental development, maturity and psycho-emotional state. The aim of the diploma is to study how dynamic pauses in primary school for children with mental disabilities can promote the development of social skills. The theoretical part of the work deals with the characteristics of primary school children with mental disabilities, identifies the characteristics of these children in the process of developing social skills and theoretically studies the peculiarities of dynamic pauses management in children with mental disabilities. In the practical part of the work, teachers of the 1st and 4th grades of special primary schools and parents of children are surveyed in order to find out the level of children's physical activities and social skills. An example of a dynamic pauses program is developed in the work, which is improved according to the recommendations of a special education sports teacher and physiotherapist. Keywords: dynamic breaks, primary school, children with mental disabilities, social skills",0
62,Dinamiskās pauzes kā sociālo prasmju veicināšanas līdzeklis sākumskolā bērniem ar garīgās attīstības traucējumiem,"Author: Anete Geidžūne Theme: Creating mathematical understanding through games for 5 – 6 years old children with mixed development disorders. As creation of mathematical understanding has a huge effect on child development and preschool educational process consists of games and play, author of the paper has decided to explore the following question: How to develop mathematical understanding through games for 5 – 6 years old children with mixed development disorders? The purpose of the work is to analyze the theoretical orientations on play and games in the development of mathematical conceptions for children aged 5 – 6 years with mixed developmental disorders. The work consists of four chapters. The first chapter explores the theoretical guidance for the psychological development of children aged 5 – 6 years with mixed developmental disorders. The second chapter explores the importance of play and games in organizing the pedagogical process; The third chapter analyses the use of children's play and games in mathematics learning in pre-school 5 – 6 years old with mixed developmental disorders; The fourth chapter depicts a practical research.  Theoretical base: Avotiņš, Jonīte, Lieģeniece D., Ukstiņa R., Meikšāne Dz., Montesori M., Svence G., Liepiņa, Tūbele   Work amount 65 pages.",0
63,Rotaļu izmantošana matemātisko priekšstatu veidošanā 5-6 gadus veciem bērniem ar jauktiem attīstības traucējumiem,"Author: Sarmite Zakarite Theme: Child-oriented environment in preschool educational process for 1,5 till 3 year old children independence development. Suitable and equipped environment for each child development stage as well as appropriate educational behavior are the two pillars of bringing up children that facilitate and allow “to be themselves”, to develop moral personality and as Maria Montessori claims that is the aim of bringing up children. Research questions: 1.What is child-oriented environment? 2.What promotes development of independence for 1,5 till 3 year old children in child-oriented environment? Paper consists of 3 parts: First part contains theoretical guidelines for characteristic signs and necessities of development for 1,5 till 3 year old children from the point of view of different authors. Second part contains analyses of theory about child-oriented approach in organizing preschool pedagogical process. Child-oriented approach is defined as subjective experiences, which lead to self-experience development. Third part is a practical research where child-oriented preschool environment is observed. Conclusions have been made: in child-oriented pedagogical environment children gain necessary information for development of independence through the environment but experience, skills and acquirements are formed via subject mattered, playful, research and educational activity. In conclusion – forming educational environment, which promotes self-motivating action and attitudes formation for others in interaction, makes conditions for child independence and independent operation. Theoretical base: H.Hansena, H. Holtšīge, M. Montessori, B.Skiba, L.Vigotskis, R.Šteiners",0
64,"Bērncentrēta vide 1,5 līdz 3 gadus vecu bērnu patstāvības attīstībai pirmsskolas izglītības procesā","Author of the work: Līga Miglone Scientific supervisor of the work: Mg. paed. Egija Laganovska Title of study: Reduction of phonetic phonemic disorders in five-year-old children through play. Aim of the research: To theoretically find out and practically study the possibilities of using play in the reduction of phonetic phonemic disorders in five-year-old children. Hypothesis of research: Phonetic phonemic disorders can be reduced by using play in a speech therapy classes. Research methodology: •theoretical-scientific literature analysis from the problem point of view; •empirical-pedagogical observation, speech therapy research of children's speech, corrective developmental activity, analysis of research results. In the theoretical part, literature sources were selected and researched, theoretical findings on the general development of 5-year-old children were selected, researched and analyzed. The phonetic phonemic types of pronunciation disorders and the stages of their correction in corrective developmental work using play were analyzed. In the practical part, children were observed and speech research was performed. Summarizing the obtained data, 5 children were selected for the study. Corrective developmental activity is based on the psychological and pedagogical peculiarities of the child's personality and the type of sound pronunciation disorder. Using play in the practical part, their effect on children's speech, reduction of phonetic phonemic disorders, as well as analysis of research results are described. Result of work: The study confirmed that the use of play in corrective developmental activities reduces phonetic disorders. Work volume: 84 pages, number of pictures: 1; number of tables: 5; number of used literature: 69; number of annexes: 6.  Keywords- 5-year-old children, phonetic phonemic disorders, play, speech therapy research, corrective developmental activity.",0
65,Fonētiski fonemātisko traucējumu mazināšana piecus gadus veciem bērniem izmantojot rotaļas,"Topic: Physical activities to improve communication skills for 2-3 years old children. Author: Marina Zeinalova Type of work: qualification work Supervisor: Agita Klempere-Sipjagina Study objective: to study, theoretically and practically, physical activities application possibilities for 2-3 years old children’s communication skills development.             The theoretical part of the research defines and describes social communications, the peculiarities of the development of 2-3 years old children during this age, as well as the peculiarities of children’s communication. The findings of the pedagogical and methodological literature on the interrelationships of children’s movement development and communication have been analyzed. In the practical part, according to the established criteria, children’s physical development and communication was observed both initially and repeatedly after practical work with children. It can be concluded that regularly organized physical activities improve children’s communication skills. This is also confirmed by the results from teachers’ survey. Work consists of introduction, 3 chapters, conclusion, used literature and other list of sources, attachments. Work volume: 54 pages, 6 tables, 6 pictures, 55 sources of literature, 2 attachments. Keywords: 2-3 years old children, physical development and activities, communication skills, movement games.",0
66,Fiziskās aktivitātes 2-3 gadus vecu bērnu saskarsmes prasmju sekmēšanai,"The theme of the work: Sensory development of 3-4 years old children by working with fine motor skills. The qualification paper author: Jūlija Tarasova Type of work: Qualification work The qualification paper supervisor: Master of Education: Ineta Aizporiete The goal of qualification paper: to study the development of sensory skills in children 3-4 years old when working with fine motor materials (using different activities).   Structure: introduction: 3 chapters, conclusion, references, 9 appendices. The qualification paper consists of: 73 pages, 4 tables, 25 figures, 59 references, 9 appendices. The theoretical part of the work describes the general development of children 3-4 years old, as well as sensory development. The goals and objectives of education in preschool-age were analyzed, also the types of education and the role of education in the sensory development of children. In the research part of the work, according to the developed criteria, classes were held to develop sensory skills in children 3-4 years old. Initial observation and re-observation were made after the performed experimental activity of the children. A survey was also conducted among preschool teachers regarding the issue of the research. The question of qualification paper: Is it is possible to stimulate the sensory development of children 3-4 years old using various fine motor materials? - Yes, it is possible. Keywords: children 3-4 years old, sensory development, the field of technology, and fine motor skills.",0
67,"Sensorā attīstība 3-4 gadus veciem bērniem, darbojoties ar veidošanas materiāliem","Work theme: Development of speech skills in 4-5 year old children in pre-school education institution through didactic games.  Work author: Anna Perevalova  Type of work: the qualification paper  Supervisor: professor, Dr.paed. Baiba Kaļķe  Aim of the work:  Explore the impact of didactic games in the development of speech skills for four-year-old children.  The qualification paper consists of: an introduction, 3 parts, conclusions, list of reference literature, 5 supplements.  Qualification paper volume is 62 p., 9 tables, 9 pictures, 5 attachments, literature list includes 44 sources.  In the first part, a theoretical analysis is carried out: 4 special features of the development of children's speech skills in a pre-primary education institution.  The second part analyses the impact of didactic games on the development of children's speech skills.  The third part analyses didactic games that promote children's speech development. The results are summarized.  The work examines the role of didactic games in the development of children's speech skills. In the course of the study, responses have been obtained - if national pre-primary education institutions use didactic games as a form of action, the speech skills of 4-year-old children will develop.   Keywords: didactic games, speech development, speech skills, vocabulary.",0
