id,title,abstract,is_generated
1,Bērnu - vecāku attiecību kvalitāte saistībā ar bērna kompulsīvo interneta lietošanu longitudinālā skatījumā,"The aim of this Master’s Thesis was to determine the parent-child relationship quality considering the emotional warmth valued by parents as an approach to parenting as well as children's assessment of the relationship with their parents in relation with indicators of a child’s compulsive internet use symptoms in the measurements of the first and repeated studies. The research was carried out within the framework of a research cooperation project “School – aged Children’s internet Use in Relation to Socioemotional Development and Parenting Practices in Latvia, Lithuania and Taiwan: A Longitudinal Study”. The study involved 263 second and third grade students, aged 8 to 10 years, with a mean age of 8.6 years and one of the child’s parents, with a mean age of 37.34 years. The following questionnaires were used in the study: for the measurements of the Internet addiction - Compulsive Internet Use Scale, CIUS; Meerkerk, van den Eijnden, Vermulst, & Garresten, 2009; for the measurements of the relationship between children and their parents - statements from Block’s Child Rearing Practices Report, CRPR; Block, 1981. Within the framework of research there was created an additional question for children about how they value their relationship with their parents. The results of the study show that there is a positive statistically significant correlation between how the child self-assesses their compulsive internet habits and how their parent evaluates them, as well as there is a statistically significant relationship between parents assessed emotional warmth as an approach of parenting and the quality of relationships in the child's assessment. Children's assessment of the child's-parent's relationship statistically significantly predicts the child's compulsive Internet use symptoms indicating that the child's assessment of emotionally warm relationships with parents can predict a reduction in the child's compulsive Internet use symptoms. Whereas the parents' assessment of the child's-parent's relationship does not statistically significantly predict the child's compulsive Internet use symptoms. The results of the study show that the more the child feels the emotional warmth expressed by the parents and his or her importance in the family, the less the child will have symptoms of compulsive Internet use.     The aim of this Master’s Thesis was to determine the parent-child relationship quality considering the emotional warmth valued by parents as an approach to parenting as well as children's assessment of the relationship with their parents in relation with indicators of a child’s compulsive internet use symptoms in the measurements of the first and repeated studies. The research was carried out within the framework of a research cooperation project “School – aged Children’s internet Use in Relation to Socioemotional Development and Parenting Practices in Latvia, Lithuania and Taiwan: A Longitudinal Study”. The study involved 263 second and third grade",0
2,"Pašnāvības domu saistība ar traucētu piederības izjūtu, uztverto apgrūtinājumu un trauksmes sensitivitāti","The aim of this study was to explore suicidal ideation in relation to thwarted belongingness, perceived burdensomeness and anxiety sensitivity, as well as to examine the potential effect of thwarted belongingness, perceived burdensomeness and anxiety sensitivity on suicidal ideation. Adult participants (N=500) filled out Negative thoughts scale, Interpersonal Needs Questionnaire and Anxiety Sensitivity Index-3. The results of this study correspond with current empirical evidence regarding suicidal ideation where the perceived burdensomeness and the cognitive dimension of anxiety sensitivity show the strongest correlations, moreover, they appear as predictors of suicidal ideation.",0
3,Modes katalogu dizaina vizuālā stilistika,"University of Latvia, Pedagogy, psychology and art faculty computer design department bachelor study program of Art 4th semester student Laura’s Anspoka’s (Stud. apl. Nr. la16037) diploma  The diploma consists of three parts.  Theoretical part gathers information about the history of fashion catalogs, their development to the present day, types of fashion catalogs.  In the empirical part, fashion look-books and catalogs created by contemporary Latvian designers are reviewed and analyzed according to four criteria created by the author. The general tendencies in them are summarized and conclusions are made. In the creative part, a design project is developed. In this part, a fashion lookbook of the author's own clothing brand is created.",0
4,"Nesuicidāls paškaitējums, emociju regulācija un vardarbības pieredze pusaudžiem","The aim of this research was to investigate the relationships between nonsuicidal self-injury methods and motives, emotion regulation dimensions and histoy of abuse. Sample was made of 82 adolescents, aged 14 -18, mean age – 15,71 years. From them 54 were girls (66 %) and 28 were boys (34 %).             Nonsuicidal self-injury methods and motives was measured with Inventory of statements about self – injury (Klonsky, 2008), emotion regulation dimensions - with Emotion Regulation Questionnaire (Gross & John, 2003) and history of abuse was measured with Childhood Trauma Questionnaire (Fink, Bernstein, Handelsman, Foote,& Lovejoy, 1995).             Results showed statistically significant relationships between nonsuicidal self-injury methods and motives with emotion regulation dimensions and history of abuse. Overall nonsuicidal self-injury methods were statistically significant prognosed by motives -  anti-dissociation, self-punishment and interpersonal boundarites. This research underlies importance of nonsuicidal self-injury motives in development of self – injurous behaviour. .         Key words: nonsuicidal self-injury, emotion regulation, history of abuse",0
5,Pusaudžu problemātiskas interneta lietošanas saistība ar vecāku audzināšanas stiliem un attiecībām ar vienaudžiem,"The aim of this master's thesis was to study the connection between problematic Internet use and parenting styles and relationships with peers; to investigate the extent to which parental upbringing and peer relationships predict PIL. The study involved 70 adolescents aged 11-15 years (mean age 13.03), of whom 40 were girls and 30 were boys. Participants completed the Internet Use Survey (Miltuze, Bite & Sebre, 2012), the People in My Life (PML), Ridenour, Greenberg & Cook, 2006 section of the People in My Life survey, and the Parenting Style Survey (Parental Authority Questionnaire-PAQ, Buri, 1991). The results of the study showed a significant relationship between the authoritarian upbringing style and PIL. This means that a more authoritarian style of upbringing is associated with problematic use of the Internet. A similar relationship was observed between permissive parenting style and PIL, but the statistical significance is weaker. No statistically significant relationship was found between PIL and the levels of trust, communication and alienation, while respondents with higher delinquent behavior in friendship also showed the highest problematic use of the Internet. The results of the hierarchical regression analysis obtained in the study showed that both delinquent behavior and authoritarian upbringing style predict PIL.",0
6,Kāzu grafiskās stilistikas tradīcijas Latvijā 20.gadsimta otrajā pusē,"European wedding traditions have developed on an unitary basis of history and traditions. Indisputably, individual territory historical destinies have affected also wedding visual decoration traditions in these territories. Western Europe lost its individuality; decorations became industrial like, the same was applied for everyone. The special status of Latvia within second half of 20-century affected the fact that wedding visual decoration traditions experienced renaissance. In this period, weddings was one of the allowed traditional events by the political authorities, that is why all Latvian desires for nationality and individuality were concentrated in them.  Due to that, also today Latvian wedding visual decorations is experiencing creative growth, is individual and preserve historical traditions and values.",0
7,Piesaistes stila un apmierinātības ar attiecībām saistība ar pieķeršanos dzīvniekiem,"The aim of the study is to find out to what extent the style of attachment and satisfaction with the partnership predicts attachment to the animal. Is there a connection between attachment to animals, satisfaction with the partnership and attachment style. A total of 150 respondents, aged 20-45, who are in a partnership, participated in the study. The Relationship Questionnaire (Bartholomew & Horowitz, 1991) was used to determine attachment. Relationship Assessment Scale (Hendrick & Hendrick, 1988). Lexington Attachment to Pets Scale (LAPS-M), 2014. The study found that relationship satisfaction predicts overall attachment to animals, but there is no statistically significant relationship to attachment to the style of attachment to animals.",0
8,Māksliniecisko izteiksmes līdzekļu izpēte Dž. Polloka darbos mākslas skolas 1. Klasē,"The main goal of the diploma work “The Research of Artistic Means of Expression in J. Pollock’s works in the 1st grade of the School of Art” is to explore J. Pollock’s means and techniques of artistic expression in his paintings and to encourage 1st grade students to use them in the ptocess of creating their own creative works. To achieve the goal, several tasks are set up, under which the author studies and describes the emergence of the abstract expressionism in the USA and the means of artistic expression in the works created by the artist. Special features of the development of children of primary school age are also being studied, the guidelines for the subject Painting developed by the Nacional Culture Centre of Latvia are getting known, a set of tasks is developed and realised, applying appropirte training methods, as well as the obtained results are summarized and analysed. The results of the study, conclusion and findings can be consulted at the end of the diploma. The appendix contains reproductions of the artist’s work, which were used as visual materials, the developed set of tasks, evalution system tables and pictures of student’s works.",0
9,"Uzvedības problēmu, mērījumu un intervenču analīze, plānojot ieviest Labās Uzvedības Spēli skolā","The aim of the master's thesis was to systematically analyze and summarize the methods and results of research conducted in the world so far on the impact of a class-based support program on the promotion of positive behavior and the reduction of unwanted behavior in school-age children. First, the work examines the manifestations of behavioral problems, focusing on measuring behavior in research. Support programs for unwanted behavior are explained later, with an emphasis on The Good Behavior Game (GBG). The research described in this paper provides an insight into the short-term and long-term effectiveness of the Good Behavior Game. It also addresses issues that should be addressed when planning to introduce a new method of behavior management. The initial goal of the study was to test the effectiveness of the Good Behavior Game in general and special education schools, but due to the emergency situation in the country it was not possible to implement it, so a pilot study of children's behavior problems was conducted in four 3rd and 4th grade general school classes. The agreement of the observations made in this pilot study in the data of two observers was evaluated, which in general showed a partial agreement, as a result of which recommendations are given for observing behavioral problems in future studies, as well as for planning and implementing Good Behavior Game.",0
10,Starppriekšmetu saiknes īstenošana kulturoloģijas stundās tematā “Sengrieķu kultūra” vidusskolā,"The title of this diploma paper is ""Cross-curricular approach in secondary education on Ancient Greek culture studies"". The aim of the research is to explore cross-curricular opportunities in the pedagogical process in secondary grade culture studies. Schemes and criteria have been developed in this study for the purpose of evaluating the cross-curricular approach.   A total of 10 lessons plans have been constructed on Greek culture studies that can be utilized for various classes. Three types of data have been analysed: self evaluation forms of pupils, test results of pupils and criteria based assesement of the teacher.  The lessons plans were approbated in a single secondary school class, benefits and limitations were analyzed if the topic had been taught cross-curricularly, conclusions were made about the process and recomendations were provided for implementing the cross-curricular approach in the pedagogical process.",0
11,Vecāku zaudējušu pusaudžu sēru komunikācija ar galveno aprūpētāju saistībā ar piesaisti un sēru reakcijām,"This study examined how the openness of adolescents’ and their main caregivers’ grief communication is associated with adolescents’ grief intensity, and whether secure attachment mediates the association between communication and grief intensity. Fifty one adolescents who had lost one or both of their parents during the last six years took part in the study. Using a cross-sectional study design, adolescents filled out self-assessment questionnaires: The Persistent Complex Bereavement Disorder Checklist – Youth Version, adapted into Latvian; The Inventory of Parent and Peer Attachment – Revised for Children; as well as Adolescents – Caregiver Grief Communication Survey, created specifically for the purpose of this research. Correlation analysis between the main variables showed that secure attachment correlates positively with grief communication and negatively with grief intensity, but grief communication corelates negatively with grief intensity. Mediation analysis showed that secure attachment mediates the relationship between grief communication and grief intensity. For grief communication to occur effectively, it is important that the adolescent feels safe in attachment to his or her main caregiver.   Key words: adolescents, grief communication, secure attachment, grief reactions",0
12,Afektīvā stāvokļa atpazīšana pieaugušo runā izmantojot balss augstumu un balss intensitāti,"The aim of this paper is to determine association between affect and the pitch; association between affect and intensity of the voice; difference between affect and the pitch depending on the narrative; difference between affect and the intensity of the voice depending on the narrative; difference in affect before and after either a positive or a negative narration. The study involved 65 participants, 26 (40%) men and 39 (60%) women, age varying between 19 and 53 (M = 30,06; SD = 8,14). 62 (95.38%) participants indicated Latvian as their native language, 3 (4.62%) participants – Russian. All participants understood and spoke Latvian. In order to measure affect, scales of valence and arousal were used – these scales correspond to the two-dimensional model of affect. Both are 9-point Likert scales corresponding to the non-verbal image survey methodologies (Bradley, & Lang, 1994; the Self-Assessment Manikin, SAM). Results of the study show that there is a weak correlation between the pitch in the negative narrative and valence before narration (rs = 0.23, p = 0.07), just as there is no statistically significant difference between the pitch in the positive narration and the valence before narration (rs = 0.18, p = 0.16). There are no statistically significant differences in the existing sample for the voice intensity depending on the narrative (p = 0.48), also, the pitch indicators do not differ statistically, depending on the narrative (p = 0.84). Results show that there is a statistically significant difference in valence between measurements prior to narration, after a negative narrative and after a positive narrative (χ2(2) = 25,48, p = 0,00). There is a statistically significant difference between arousal measurements (χ2(2) = 15,14, p = 0,00). The results indicate that there is a statistically significant difference between arousal indicators before the measurement and after a negative narration (p = 0,04), as well as between arousal indicators before the measurement and after a positive narration (p = 0,00). Between arousal indicators after a negative narration and after a positive narration, the difference was not statistically significant (p = 0,07).",0
13,Ēšanas uzvedības saistība ar vadības funkcijām un lemšanas procesu,"The aim of this study is to examine and investigate the relationship between eating behavior, executive function and decision-making process. The addition aim is to examine the differences between eating behavior, executive function and decision-making process people with low, normal or high body mass index.  The final sample of the study consists of 184 respondents (27 men and 159 women) aged from 19 to 60.   The data were collect online. For determine eating behavior styles respondents electronically filled Eating Behaviour Patterns Questionnaire (EBPQ) (Schlundt, Hargreaves, & Buchowski, 2003), Eating Atiitude Test – EAT-40 (Garner & Garfinkel, 1979) subscale bulimia/food preoccupation, Eating Disorder Examination Questionnaire EDE-Q 6.0 (Fairburn & Beglin, 2008) subscale restraint. The data collection tools in this study for determine examine executive function and decision-making process were a Card sorting test (Vanags & Ekmanis, 2018), Card reaction tests 2. Version (Vanags, Ekmanis, 2018, based on Stroop test, Stroop, 1930), Digit span test (Vanags, Ekmanis, 2018, based on Smith, 1973). The results of the study indicate that there are statically significant relationships between eating behavior styles and significant differences in bulimia/food preoccupation behavior in body mass index groups. The study found a number of relationships between eating behavior and executive functions, but some of them are controversial and do not coincide with previous studies. Significant correlations between eating behavior, cognitive flexibility and working memory this study do not show.",0
14,"Kognitīvie izkropļojumi, seksuāla kauna izjūtas un pagātnes vardarbības pieredzes saistība ieslodzījumā esošiem dzimumnoziedzniekiem, kuri veikuši noziegumu pret nepilngadīgajiem","The aim of the study was to determine the differences and connections between cognitive distortions, feelings of sexual shame and past experiences of violence in convicted sex offenders who have committed a crime against children and criminals convicted of killing and crimes against personal health, and to determine the extent to which the feelings of sexual shame and past history of violence predict cognitive distortions in both imprisonment groups. The study included 80 men, aged 20-61 (M =39,80; SD=5,28), sex offenders who have committed a crime against children (n=40) and criminals convicted of killing and offences against personal health (n=40). Cognitive distortions were measured by Bumby Cognitive Distortions Scale: The MOLEST Scale (Bumpy, 1996), feelings of sexual shame by the Kyle Inventory of Sexual Shame (Kyle, 2013) and past experiences of violence with the Childhood Trauma Questionaire (Fink et.al, 1995).  The results of the study showed that indicators of cognitive distortions, feeling of sexual shame and experience of past violence are statistically more higher for convicted sex offenders than criminals convicted of killing and crimes against personal health; there are statistically significant positive connection between physical, emotional and sexual abuse experienced in childhood in sex offenders; criminals convicted of killing has statistically significant positive connection between emotional, sexual abuse and feeling of sexual shame in adulthood; there are statistically significant positive connection between cognitive distortions and feelings of sexual shame among criminals convicted of killing; there are statistically significant positive connection between emotional, physical and sexual abuse experienced in childhood in criminals convicted of killing; feelings of sexual shame and past experience of violence do not predict cognitive distortions in sex offenders; feelings of sexual shame predict cognitive distortions in criminals convicted for killing and crimes against personal health.",0
15,Mērķa orientācija darbavietā un tās saistība ar indivīdu izjusto afektu,The aim of the current study was to find possible correlations between work goal orientation and affect at work. There were 2 parts to the current study. First a pilot study for the adaptation of the work goal orientation questionnaire was done. The sample for pilot study was 82 participants of which 49 were female and 33 male. The results of pilot study supported a 2X2 factorial model of goal orientation and provided good internal consistency. In the final part of the study the adapted goal orientation was used alongside PANAS scale of positive and negative affects. Sample size of final study was 129 participants of which 115 were female and 14 male. The results of this study indicate a positive correlation between approach dimensions and positive affect and a positive correlation between avoidance dimensions and negative affect.,0
16,Vecāku audzināšanas pieejas un emociju regulēšana saistībā ar pusaudžu uzvedības problēmām,"The aim of this master’s degree research was to determine the relationship between parenting practices, parent emotion regulation processes and adolescent behavioral problems, according to parental report. The study involved 128 adolescents’ parents, 107 mothers and 21 fathers, of adolescents aged 11 – 15 years old. Parents completed the Alabama Parenting Questionnaire (Shelton, Frick, & Wootton, 1996), the Emotion Regulation Questionnaire (ERQ) (Gross & John, 2003) and the Child Behavior Checklist for Ages 6 - 18 (Achenbach & Rescorla, 2001). The results of this research showed a negative correlation between adolescent externalized behavior and parental involvement, indicating that the more parents are involved, the lower is adolescent externalized behavior. The results showed that there is a positive relationship between the adolescent externalized behavior problems and inconsistent disciplining, lack of supervision and physical punishment. Parental inconsistent disciplining and lack of supervision was associated with adolescents' internalized behavior problems. Regression analysis showed that inconsistent parental discipline was predictive adolescent externalized behavioral problems. Lack of parental supervision was predictive of adolescent internalized behavior. Also, the results of the study showed that the more parents use emotional suppression to regulate their emotions, the more positive is their involvement with their adolescent. In this study the emotion regulation strategy - cognitive reappraisal had no significant association with parental parenting practices in relation to adolescent behavior problems.This study showed that emotion regulation - expressive suppression was positively correlated with adaptive parenting practices- positive parenting and involvement.",0
17,Priekšējo mēleņu R un L izrunas traucējumu novēršana vecākā pirmsskolas vecuma bērniem,"Author: Inese Ozolina Theme: Prevention of front lingual consonant /r/ and /l/ speech sound disorder in late pre-school age. Purpose: Theoretically research and practically approbate conclusions of various authors contributing to facilitatory speech sound articulation possibilities. Organisation: The thesis consist of two parts – the theoretical and the practical. The theoretical part deals with analysis of literature on psychological pedagogy and methodology of the importance of speech sounds in language development.  The practical part carries out the initial logopaedic research of the speech in late pre-schoolers; specific exercises and games are selected in order to avert development of front lingual consonant /r/ and /l/ pronunciation disorder. Aims: •Analyse literature on psychological pedagogy and methodology concerning the significance of speech sounds in language development; •Characterise the causes and manifestation of speech sound disorders;  •Characterise ages and stages of child development; •Carry out corrective developmental exercises with objective to prevent disorders in pronouncing front lingual consonants /r/ and /l/. Results: The research confirmed that the pronunciation of the front lingual consonants /r/ and /l/ improves if the speech therapist: •Carefully investigates the speech sound disorders present in the child; •Systematically applies games, exercises for correcting developmental processes, taking into account children-specific speech sound articulation.  Contents and volume: The thesis consists of the title-page, introduction, annotation in Latvian and English languages, theoretical and practical parts, conclusion, literature sources and attachments, which amounts to 92 pages in total - theoretical and practical parts (57 pages), 3 images, 4 tables, 11 attachments, 60 literature sources.  Keywords: importance of speech sounds in language development, front lingual consonants, ages and stages of child development, causes of speech sound disorders, speech sound disorder correction.",0
